n_legs,legs,hit_prob,payout_mult,kernel_mult,payout_mult_eff,ev_mult,atlas_power_mult,pricing_engine,avg_p,avg_fragility,slip_key,pen_team,pen_family,pen_frag,pen_role_ctx,pen_total,role_ctx_bonus,role_ctx_on_legs,role_ctx_on_share,score_adj,players,rank_ev,beam_selected,leg_1,leg_2,leg_3,leg_4,q_leg_count,q_players
4,Duncan Robinson OVER FG3M 1.5 (GOBLIN) [id:10801146] | Collin Sexton OVER PRA 14.5 (GOBLIN) [id:10801649] | Daniel Gafford UNDER PRA 20.5 (STANDARD) [id:10798762] | Jevon Carter UNDER PTS 8.5 (STANDARD) [id:10800390],0.25576946813308493,10.0,0.5564976935105697,5.564976935105697,1.423351190864869,10.0,pp_kernel,0.7127537246275373,0.04913424541296998,Duncan Robinson OVER FG3M 1.5 (GOBLIN) [id:10801146] | Collin Sexton OVER PRA 14.5 (GOBLIN) [id:10801649] | Daniel Gafford UNDER PRA 20.5 (STANDARD) [id:10798762] | Jevon Carter UNDER PTS 8.5 (STANDARD) [id:10800390],0.0,0.0,0.0,0.0,0.0,0.0,4,1.0,2.023351190864869,"['duncan robinson', 'collin sexton', 'daniel gafford', 'jevon carter']",1.423351190864869,1,Duncan Robinson OVER FG3M 1.5 (GOBLIN) [id:10801146],Collin Sexton OVER PRA 14.5 (GOBLIN) [id:10801649],Daniel Gafford UNDER PRA 20.5 (STANDARD) [id:10798762],Jevon Carter UNDER PTS 8.5 (STANDARD) [id:10800390],0,
4,Matas Buzelis OVER PA 14.5 (GOBLIN) [id:10803956] | Caris LeVert OVER PR 7.5 (GOBLIN) [id:10801715] | John Collins UNDER PRA 23.5 (STANDARD) [id:10798166] | Brice Sensabaugh UNDER PR 23.5 (STANDARD) [id:10802412],0.24190785554540564,10.0,0.5706198764837342,5.7061987648373425,1.380374306517644,10.0,pp_kernel,0.7016548345165483,0.05582920408312993,Matas Buzelis OVER PA 14.5 (GOBLIN) [id:10803956] | Caris LeVert OVER PR 7.5 (GOBLIN) [id:10801715] | John Collins UNDER PRA 23.5 (STANDARD) [id:10798166] | Brice Sensabaugh UNDER PR 23.5 (STANDARD) [id:10802412],0.0,0.0,0.0,0.0,0.0,0.0,4,1.0,1.980374306517644,"['matas buzelis', 'caris levert', 'john collins', 'brice sensabaugh']",1.380374306517644,1,Matas Buzelis OVER PA 14.5 (GOBLIN) [id:10803956],Caris LeVert OVER PR 7.5 (GOBLIN) [id:10801715],John Collins UNDER PRA 23.5 (STANDARD) [id:10798166],Brice Sensabaugh UNDER PR 23.5 (STANDARD) [id:10802412],0,
4,Tobias Harris OVER PA 11.5 (GOBLIN) [id:10801641] | Jalen Smith OVER RA 5.5 (GOBLIN) [id:10797684] | Jalen Suggs UNDER PA 20.5 (STANDARD) [id:10799821] | Tyler Herro UNDER PA 25.5 (STANDARD) [id:10796934],0.17798669388987076,10.0,0.7514196825218122,7.514196825218122,1.3374270501583367,10.0,pp_kernel,0.6537346265373463,0.05744654006552012,Tobias Harris OVER PA 11.5 (GOBLIN) [id:10801641] | Jalen Smith OVER RA 5.5 (GOBLIN) [id:10797684] | Jalen Suggs UNDER PA 20.5 (STANDARD) [id:10799821] | Tyler Herro UNDER PA 25.5 (STANDARD) [id:10796934],0.0,0.0,0.0,0.0,0.0,0.0,4,1.0,1.9374270501583366,"['tobias harris', 'jalen smith', 'jalen suggs', 'tyler herro']",1.3374270501583367,1,Tobias Harris OVER PA 11.5 (GOBLIN) [id:10801641],Jalen Smith OVER RA 5.5 (GOBLIN) [id:10797684],Jalen Suggs UNDER PA 20.5 (STANDARD) [id:10799821],Tyler Herro UNDER PA 25.5 (STANDARD) [id:10796934],0,
4,Kevin Huerter OVER FG3M 0.5 (GOBLIN) [id:10801516] | Darius Garland OVER PRA 24.5 (GOBLIN) [id:10801275] | Jalen Suggs UNDER PRA 24.5 (STANDARD) [id:10799827] | Brice Sensabaugh UNDER PR 23.5 (STANDARD) [id:10802412],0.1925887285266359,10.0,0.6656833723782491,6.6568337237824915,1.282031142876501,10.0,pp_kernel,0.665058494150585,0.051054301478333605,Kevin Huerter OVER FG3M 0.5 (GOBLIN) [id:10801516] | Darius Garland OVER PRA 24.5 (GOBLIN) [id:10801275] | Jalen Suggs UNDER PRA 24.5 (STANDARD) [id:10799827] | Brice Sensabaugh UNDER PR 23.5 (STANDARD) [id:10802412],0.0,0.0,0.0,0.0,0.0,0.0,4,1.0,1.8820311428765009,"['kevin huerter', 'darius garland', 'jalen suggs', 'brice sensabaugh']",1.282031142876501,1,Kevin Huerter OVER FG3M 0.5 (GOBLIN) [id:10801516],Darius Garland OVER PRA 24.5 (GOBLIN) [id:10801275],Jalen Suggs UNDER PRA 24.5 (STANDARD) [id:10799827],Brice Sensabaugh UNDER PR 23.5 (STANDARD) [id:10802412],0,
4,Tre Jones OVER PA 14.5 (GOBLIN) [id:10801689] | Naji Marshall OVER PRA 19.5 (GOBLIN) [id:10800955] | Jalen Duren UNDER RA 13 (STANDARD) [id:10800894] | Desmond Bane UNDER AST 4.5 (STANDARD) [id:10801952],0.16947519571492672,10.0,0.7514196825218122,7.514196825218122,1.2734699775943223,10.0,pp_kernel,0.6446605339466054,0.055984245363491114,Tre Jones OVER PA 14.5 (GOBLIN) [id:10801689] | Naji Marshall OVER PRA 19.5 (GOBLIN) [id:10800955] | Jalen Duren UNDER RA 13 (STANDARD) [id:10800894] | Desmond Bane UNDER AST 4.5 (STANDARD) [id:10801952],0.0,0.0,0.0,0.0,0.0,0.0,4,1.0,1.8734699775943224,"['tre jones', 'naji marshall', 'jalen duren', 'desmond bane']",1.2734699775943223,1,Tre Jones OVER PA 14.5 (GOBLIN) [id:10801689],Naji Marshall OVER PRA 19.5 (GOBLIN) [id:10800955],Jalen Duren UNDER RA 13 (STANDARD) [id:10800894],Desmond Bane UNDER AST 4.5 (STANDARD) [id:10801952],0,
4,Duncan Robinson OVER PA 9.5 (GOBLIN) [id:10801564] | Desmond Bane OVER PR 19.5 (GOBLIN) [id:10802231] | Jalen Smith OVER RA 7.5 (STANDARD) [id:10797685] | Derrick Jones UNDER PR 16.5 (STANDARD) [id:10798147],0.19966340726821466,10.0,0.6289979800728684,6.289979800728684,1.255878798661735,10.0,pp_kernel,0.6779072092790721,0.09294702067559558,Duncan Robinson OVER PA 9.5 (GOBLIN) [id:10801564] | Desmond Bane OVER PR 19.5 (GOBLIN) [id:10802231] | Jalen Smith OVER RA 7.5 (STANDARD) [id:10797685] | Derrick Jones UNDER PR 16.5 (STANDARD) [id:10798147],0.0,0.0,0.0,0.0,0.0,0.0,4,1.0,1.855878798661735,"['duncan robinson', 'desmond bane', 'jalen smith', 'derrick jones']",1.255878798661735,1,Duncan Robinson OVER PA 9.5 (GOBLIN) [id:10801564],Desmond Bane OVER PR 19.5 (GOBLIN) [id:10802231],Jalen Smith OVER RA 7.5 (STANDARD) [id:10797685],Derrick Jones UNDER PR 16.5 (STANDARD) [id:10798147],0,
