n_legs,legs,hit_prob,ev_mult,avg_p,avg_fragility,slip_key,leg_1,leg_2,leg_3,leg_4
4,LaMelo Ball OVER REB 2.5 (GOBLIN) [id:9795265] | De'Anthony Melton UNDER PRA 21.5 (STANDARD) [id:9800016] | Draymond Green UNDER PRA 22.5 (STANDARD) [id:9797550] | Scoot Henderson OVER RA 7.5 (DEMON) [id:9801396],0.2706882498854094,2.7068824988540943,0.7359468106378724,0.004795097775334079,LaMelo Ball OVER REB 2.5 (GOBLIN) [id:9795265] | De'Anthony Melton UNDER PRA 21.5 (STANDARD) [id:9800016] | Draymond Green UNDER PRA 22.5 (STANDARD) [id:9797550] | Scoot Henderson OVER RA 7.5 (DEMON) [id:9801396],LaMelo Ball OVER REB 2.5 (GOBLIN) [id:9795265],De'Anthony Melton UNDER PRA 21.5 (STANDARD) [id:9800016],Draymond Green UNDER PRA 22.5 (STANDARD) [id:9797550],Scoot Henderson OVER RA 7.5 (DEMON) [id:9801396]
4,Jrue Holiday OVER RA 7.5 (GOBLIN) [id:9801329] | Bobby Portis OVER FG3M 1.5 (STANDARD) [id:9801486] | De'Anthony Melton UNDER PA 17.5 (STANDARD) [id:9797208] | Scoot Henderson OVER AST 5.5 (DEMON) [id:9801379],0.2653430699129348,2.6534306991293484,0.7333848230353929,0.003482909444354476,Jrue Holiday OVER RA 7.5 (GOBLIN) [id:9801329] | Bobby Portis OVER FG3M 1.5 (STANDARD) [id:9801486] | De'Anthony Melton UNDER PA 17.5 (STANDARD) [id:9797208] | Scoot Henderson OVER AST 5.5 (DEMON) [id:9801379],Jrue Holiday OVER RA 7.5 (GOBLIN) [id:9801329],Bobby Portis OVER FG3M 1.5 (STANDARD) [id:9801486],De'Anthony Melton UNDER PA 17.5 (STANDARD) [id:9797208],Scoot Henderson OVER AST 5.5 (DEMON) [id:9801379]
4,Deni Avdija OVER RA 9.5 (GOBLIN) [id:9799261] | Isaiah Collier UNDER AST 10.5 (STANDARD) [id:9799010] | Pat Spencer UNDER PRA 25.5 (STANDARD) [id:9797302] | Saddiq Bey OVER PR 24.5 (DEMON) [id:9799607],0.25342394388037465,2.5342394388037466,0.7262757448510299,0.0022643587827784624,Deni Avdija OVER RA 9.5 (GOBLIN) [id:9799261] | Isaiah Collier UNDER AST 10.5 (STANDARD) [id:9799010] | Pat Spencer UNDER PRA 25.5 (STANDARD) [id:9797302] | Saddiq Bey OVER PR 24.5 (DEMON) [id:9799607],Deni Avdija OVER RA 9.5 (GOBLIN) [id:9799261],Isaiah Collier UNDER AST 10.5 (STANDARD) [id:9799010],Pat Spencer UNDER PRA 25.5 (STANDARD) [id:9797302],Saddiq Bey OVER PR 24.5 (DEMON) [id:9799607]
4,Duncan Robinson OVER PR 9.5 (GOBLIN) [id:9802195] | Pat Spencer UNDER RA 11.5 (STANDARD) [id:9797304] | Moses Moody UNDER PR 22.5 (STANDARD) [id:9797288] | Cade Cunningham OVER AST 10.5 (DEMON) [id:9795130],0.23507498918084757,2.3507498918084755,0.7160747850429915,0.005006348526887904,Duncan Robinson OVER PR 9.5 (GOBLIN) [id:9802195] | Pat Spencer UNDER RA 11.5 (STANDARD) [id:9797304] | Moses Moody UNDER PR 22.5 (STANDARD) [id:9797288] | Cade Cunningham OVER AST 10.5 (DEMON) [id:9795130],Duncan Robinson OVER PR 9.5 (GOBLIN) [id:9802195],Pat Spencer UNDER RA 11.5 (STANDARD) [id:9797304],Moses Moody UNDER PR 22.5 (STANDARD) [id:9797288],Cade Cunningham OVER AST 10.5 (DEMON) [id:9795130]
4,Jalen Johnson OVER PA 24.5 (GOBLIN) [id:9801934] | Jaden McDaniels OVER AST 2.5 (STANDARD) [id:9801226] | Scoot Henderson OVER REB 2.5 (STANDARD) [id:9802121] | Tim Hardaway OVER REB 3.5 (DEMON) [id:9796361],0.21818801406991578,2.1818801406991577,0.7129074185162967,0.0,Jalen Johnson OVER PA 24.5 (GOBLIN) [id:9801934] | Jaden McDaniels OVER AST 2.5 (STANDARD) [id:9801226] | Scoot Henderson OVER REB 2.5 (STANDARD) [id:9802121] | Tim Hardaway OVER REB 3.5 (DEMON) [id:9796361],Jalen Johnson OVER PA 24.5 (GOBLIN) [id:9801934],Jaden McDaniels OVER AST 2.5 (STANDARD) [id:9801226],Scoot Henderson OVER REB 2.5 (STANDARD) [id:9802121],Tim Hardaway OVER REB 3.5 (DEMON) [id:9796361]
4,Franz Wagner OVER PTS 14.5 (GOBLIN) [id:9801911] | Tim Hardaway OVER PRA 16.5 (STANDARD) [id:9796354] | Scoot Henderson UNDER PTS 11.5 (STANDARD) [id:9801388] | Kevin Porter OVER REB 5.5 (DEMON) [id:9798856],0.20809951436491841,2.0809951436491843,0.6874400119976005,0.001913446921531318,Franz Wagner OVER PTS 14.5 (GOBLIN) [id:9801911] | Tim Hardaway OVER PRA 16.5 (STANDARD) [id:9796354] | Scoot Henderson UNDER PTS 11.5 (STANDARD) [id:9801388] | Kevin Porter OVER REB 5.5 (DEMON) [id:9798856],Franz Wagner OVER PTS 14.5 (GOBLIN) [id:9801911],Tim Hardaway OVER PRA 16.5 (STANDARD) [id:9796354],Scoot Henderson UNDER PTS 11.5 (STANDARD) [id:9801388],Kevin Porter OVER REB 5.5 (DEMON) [id:9798856]
4,Dennis Schröder OVER AST 2.5 (GOBLIN) [id:9795975] | Scoot Henderson OVER PA 15.5 (STANDARD) [id:9801389] | De'Anthony Melton UNDER PTS 15.5 (STANDARD) [id:9797207] | Desmond Bane OVER PTS 20.5 (DEMON) [id:9801530],0.20671091314874,2.0671091314874,0.7092906418716257,0.004146069207462921,Dennis Schröder OVER AST 2.5 (GOBLIN) [id:9795975] | Scoot Henderson OVER PA 15.5 (STANDARD) [id:9801389] | De'Anthony Melton UNDER PTS 15.5 (STANDARD) [id:9797207] | Desmond Bane OVER PTS 20.5 (DEMON) [id:9801530],Dennis Schröder OVER AST 2.5 (GOBLIN) [id:9795975],Scoot Henderson OVER PA 15.5 (STANDARD) [id:9801389],De'Anthony Melton UNDER PTS 15.5 (STANDARD) [id:9797207],Desmond Bane OVER PTS 20.5 (DEMON) [id:9801530]
4,Bam Adebayo OVER AST 1.5 (GOBLIN) [id:9798271] | Isaiah Collier UNDER PRA 29.5 (STANDARD) [id:9798054] | Lauri Markkanen OVER PR 28 (STANDARD) [id:9798103] | Desmond Bane OVER PTS 20.5 (DEMON) [id:9801530],0.20028405083126896,2.0028405083126897,0.687135072985403,0.0010685103708359767,Bam Adebayo OVER AST 1.5 (GOBLIN) [id:9798271] | Isaiah Collier UNDER PRA 29.5 (STANDARD) [id:9798054] | Lauri Markkanen OVER PR 28 (STANDARD) [id:9798103] | Desmond Bane OVER PTS 20.5 (DEMON) [id:9801530],Bam Adebayo OVER AST 1.5 (GOBLIN) [id:9798271],Isaiah Collier UNDER PRA 29.5 (STANDARD) [id:9798054],Lauri Markkanen OVER PR 28 (STANDARD) [id:9798103],Desmond Bane OVER PTS 20.5 (DEMON) [id:9801530]
4,Wendell Carter OVER PA 9.5 (GOBLIN) [id:9798986] | Moses Moody UNDER PRA 23.5 (STANDARD) [id:9800039] | Jamal Murray OVER PRA 36.5 (STANDARD) [id:9796071] | Ryan Kalkbrenner OVER RA 5.5 (DEMON) [id:9800509],0.1918863949732141,1.9188639497321411,0.66876174765047,0.0026772203468746385,Wendell Carter OVER PA 9.5 (GOBLIN) [id:9798986] | Moses Moody UNDER PRA 23.5 (STANDARD) [id:9800039] | Jamal Murray OVER PRA 36.5 (STANDARD) [id:9796071] | Ryan Kalkbrenner OVER RA 5.5 (DEMON) [id:9800509],Wendell Carter OVER PA 9.5 (GOBLIN) [id:9798986],Moses Moody UNDER PRA 23.5 (STANDARD) [id:9800039],Jamal Murray OVER PRA 36.5 (STANDARD) [id:9796071],Ryan Kalkbrenner OVER RA 5.5 (DEMON) [id:9800509]
4,Joel Embiid OVER PRA 34.5 (GOBLIN) [id:9801322] | Al Horford UNDER RA 9.5 (STANDARD) [id:9797158] | Scoot Henderson OVER PA 15.5 (STANDARD) [id:9801389] | Zion Williamson OVER REB 7.5 (DEMON) [id:9799675],0.18562772830398894,1.8562772830398893,0.7026369726054789,0.0023960352891649354,Joel Embiid OVER PRA 34.5 (GOBLIN) [id:9801322] | Al Horford UNDER RA 9.5 (STANDARD) [id:9797158] | Scoot Henderson OVER PA 15.5 (STANDARD) [id:9801389] | Zion Williamson OVER REB 7.5 (DEMON) [id:9799675],Joel Embiid OVER PRA 34.5 (GOBLIN) [id:9801322],Al Horford UNDER RA 9.5 (STANDARD) [id:9797158],Scoot Henderson OVER PA 15.5 (STANDARD) [id:9801389],Zion Williamson OVER REB 7.5 (DEMON) [id:9799675]
4,Nikola Jokić OVER REB 9.5 (GOBLIN) [id:9796281] | Moses Moody UNDER PR 22.5 (STANDARD) [id:9797288] | Zion Williamson UNDER PA 27.5 (STANDARD) [id:9799666] | Jaden McDaniels OVER FG3M 1.5 (DEMON) [id:9801222],0.1808387168823509,1.808387168823509,0.6567136572685464,0.0030799313310027237,Nikola Jokić OVER REB 9.5 (GOBLIN) [id:9796281] | Moses Moody UNDER PR 22.5 (STANDARD) [id:9797288] | Zion Williamson UNDER PA 27.5 (STANDARD) [id:9799666] | Jaden McDaniels OVER FG3M 1.5 (DEMON) [id:9801222],Nikola Jokić OVER REB 9.5 (GOBLIN) [id:9796281],Moses Moody UNDER PR 22.5 (STANDARD) [id:9797288],Zion Williamson UNDER PA 27.5 (STANDARD) [id:9799666],Jaden McDaniels OVER FG3M 1.5 (DEMON) [id:9801222]
4,Donovan Clingan OVER PR 19.5 (GOBLIN) [id:9802015] | Brandin Podziemski UNDER PR 21.5 (STANDARD) [id:9797172] | Gary Payton UNDER PR 12.5 (STANDARD) [id:9800029] | Kon Knueppel OVER RA 9.5 (DEMON) [id:9800725],0.1789102947395301,1.789102947395301,0.6574185162967408,0.0013767318493525355,Donovan Clingan OVER PR 19.5 (GOBLIN) [id:9802015] | Brandin Podziemski UNDER PR 21.5 (STANDARD) [id:9797172] | Gary Payton UNDER PR 12.5 (STANDARD) [id:9800029] | Kon Knueppel OVER RA 9.5 (DEMON) [id:9800725],Donovan Clingan OVER PR 19.5 (GOBLIN) [id:9802015],Brandin Podziemski UNDER PR 21.5 (STANDARD) [id:9797172],Gary Payton UNDER PR 12.5 (STANDARD) [id:9800029],Kon Knueppel OVER RA 9.5 (DEMON) [id:9800725]
4,Ryan Rollins OVER FG3M 1.5 (GOBLIN) [id:9798944] | Kelly Oubre UNDER PA 17.5 (STANDARD) [id:9798564] | Scoot Henderson OVER PA 15.5 (STANDARD) [id:9801389] | Desmond Bane OVER PRA 29.5 (DEMON) [id:9798786],0.1787076972453311,1.7870769724533109,0.6935300439912017,0.002640961309916818,Ryan Rollins OVER FG3M 1.5 (GOBLIN) [id:9798944] | Kelly Oubre UNDER PA 17.5 (STANDARD) [id:9798564] | Scoot Henderson OVER PA 15.5 (STANDARD) [id:9801389] | Desmond Bane OVER PRA 29.5 (DEMON) [id:9798786],Ryan Rollins OVER FG3M 1.5 (GOBLIN) [id:9798944],Kelly Oubre UNDER PA 17.5 (STANDARD) [id:9798564],Scoot Henderson OVER PA 15.5 (STANDARD) [id:9801389],Desmond Bane OVER PRA 29.5 (DEMON) [id:9798786]
4,Nickeil Alexander-Walker OVER PTS 16.5 (GOBLIN) [id:9802077] | Scoot Henderson OVER PA 15.5 (STANDARD) [id:9801389] | Lauri Markkanen OVER REB 5.5 (STANDARD) [id:9798105] | Christian Braun OVER AST 3.5 (DEMON) [id:9795936],0.17710393972482627,1.7710393972482628,0.6966436712657469,0.0,Nickeil Alexander-Walker OVER PTS 16.5 (GOBLIN) [id:9802077] | Scoot Henderson OVER PA 15.5 (STANDARD) [id:9801389] | Lauri Markkanen OVER REB 5.5 (STANDARD) [id:9798105] | Christian Braun OVER AST 3.5 (DEMON) [id:9795936],Nickeil Alexander-Walker OVER PTS 16.5 (GOBLIN) [id:9802077],Scoot Henderson OVER PA 15.5 (STANDARD) [id:9801389],Lauri Markkanen OVER REB 5.5 (STANDARD) [id:9798105],Christian Braun OVER AST 3.5 (DEMON) [id:9795936]
4,Cade Cunningham OVER REB 3.5 (GOBLIN) [id:9795142] | Jake LaRavia OVER PA 11.5 (STANDARD) [id:9802231] | Scoot Henderson OVER REB 2.5 (STANDARD) [id:9802121] | Isaiah Stewart OVER PRA 15.5 (DEMON) [id:9800698],0.1769444467103326,1.769444467103326,0.676865626874625,0.0,Cade Cunningham OVER REB 3.5 (GOBLIN) [id:9795142] | Jake LaRavia OVER PA 11.5 (STANDARD) [id:9802231] | Scoot Henderson OVER REB 2.5 (STANDARD) [id:9802121] | Isaiah Stewart OVER PRA 15.5 (DEMON) [id:9800698],Cade Cunningham OVER REB 3.5 (GOBLIN) [id:9795142],Jake LaRavia OVER PA 11.5 (STANDARD) [id:9802231],Scoot Henderson OVER REB 2.5 (STANDARD) [id:9802121],Isaiah Stewart OVER PRA 15.5 (DEMON) [id:9800698]
4,Franz Wagner OVER PTS 14.5 (GOBLIN) [id:9801911] | Lauri Markkanen OVER REB 5.5 (STANDARD) [id:9798105] | Gui Santos UNDER FG3M 1.5 (STANDARD) [id:9797242] | Deni Avdija OVER PRA 39.5 (DEMON) [id:9799254],0.17478077305550113,1.7478077305550113,0.6640126974605078,0.00389109701411929,Franz Wagner OVER PTS 14.5 (GOBLIN) [id:9801911] | Lauri Markkanen OVER REB 5.5 (STANDARD) [id:9798105] | Gui Santos UNDER FG3M 1.5 (STANDARD) [id:9797242] | Deni Avdija OVER PRA 39.5 (DEMON) [id:9799254],Franz Wagner OVER PTS 14.5 (GOBLIN) [id:9801911],Lauri Markkanen OVER REB 5.5 (STANDARD) [id:9798105],Gui Santos UNDER FG3M 1.5 (STANDARD) [id:9797242],Deni Avdija OVER PRA 39.5 (DEMON) [id:9799254]
4,Davion Mitchell OVER AST 4.5 (GOBLIN) [id:9800010] | De'Anthony Melton UNDER PR 19.5 (STANDARD) [id:9800015] | Scoot Henderson OVER PRA 18 (STANDARD) [id:9801894] | Brandon Miller OVER PTS 23.5 (DEMON) [id:9800640],0.17280443784566152,1.728044378456615,0.6844706058788241,0.0051666039485698916,Davion Mitchell OVER AST 4.5 (GOBLIN) [id:9800010] | De'Anthony Melton UNDER PR 19.5 (STANDARD) [id:9800015] | Scoot Henderson OVER PRA 18 (STANDARD) [id:9801894] | Brandon Miller OVER PTS 23.5 (DEMON) [id:9800640],Davion Mitchell OVER AST 4.5 (GOBLIN) [id:9800010],De'Anthony Melton UNDER PR 19.5 (STANDARD) [id:9800015],Scoot Henderson OVER PRA 18 (STANDARD) [id:9801894],Brandon Miller OVER PTS 23.5 (DEMON) [id:9800640]
4,Ryan Rollins OVER FG3M 1.5 (GOBLIN) [id:9798944] | Jarrett Allen OVER PA 16.5 (STANDARD) [id:9796150] | Lauri Markkanen OVER PR 28 (STANDARD) [id:9798103] | Deni Avdija OVER RA 13.5 (DEMON) [id:9799262],0.17222586331888357,1.7222586331888357,0.654384373125375,0.0010685103708359767,Ryan Rollins OVER FG3M 1.5 (GOBLIN) [id:9798944] | Jarrett Allen OVER PA 16.5 (STANDARD) [id:9796150] | Lauri Markkanen OVER PR 28 (STANDARD) [id:9798103] | Deni Avdija OVER RA 13.5 (DEMON) [id:9799262],Ryan Rollins OVER FG3M 1.5 (GOBLIN) [id:9798944],Jarrett Allen OVER PA 16.5 (STANDARD) [id:9796150],Lauri Markkanen OVER PR 28 (STANDARD) [id:9798103],Deni Avdija OVER RA 13.5 (DEMON) [id:9799262]
4,Davion Mitchell OVER AST 4.5 (GOBLIN) [id:9800010] | Pat Spencer UNDER PA 20.5 (STANDARD) [id:9797300] | Keon Ellis UNDER PR 6.5 (STANDARD) [id:9799155] | Cameron Johnson OVER RA 6.5 (DEMON) [id:9795924],0.17023114191819408,1.7023114191819408,0.6594861027794441,0.001491106614122897,Davion Mitchell OVER AST 4.5 (GOBLIN) [id:9800010] | Pat Spencer UNDER PA 20.5 (STANDARD) [id:9797300] | Keon Ellis UNDER PR 6.5 (STANDARD) [id:9799155] | Cameron Johnson OVER RA 6.5 (DEMON) [id:9795924],Davion Mitchell OVER AST 4.5 (GOBLIN) [id:9800010],Pat Spencer UNDER PA 20.5 (STANDARD) [id:9797300],Keon Ellis UNDER PR 6.5 (STANDARD) [id:9799155],Cameron Johnson OVER RA 6.5 (DEMON) [id:9795924]
4,Sion James OVER PR 4.5 (GOBLIN) [id:9800519] | Sam Merrill OVER PA 11.5 (STANDARD) [id:9796313] | Gui Santos UNDER PTS 12 (STANDARD) [id:9797249] | Miles Bridges OVER RA 9.5 (DEMON) [id:9800742],0.16968474241757742,1.696847424175774,0.6587027594481104,0.001514967882680892,Sion James OVER PR 4.5 (GOBLIN) [id:9800519] | Sam Merrill OVER PA 11.5 (STANDARD) [id:9796313] | Gui Santos UNDER PTS 12 (STANDARD) [id:9797249] | Miles Bridges OVER RA 9.5 (DEMON) [id:9800742],Sion James OVER PR 4.5 (GOBLIN) [id:9800519],Sam Merrill OVER PA 11.5 (STANDARD) [id:9796313],Gui Santos UNDER PTS 12 (STANDARD) [id:9797249],Miles Bridges OVER RA 9.5 (DEMON) [id:9800742]
4,Sion James OVER RA 4.5 (GOBLIN) [id:9800773] | Aaron Wiggins UNDER PA 17.5 (STANDARD) [id:9799169] | Isaac Okoro UNDER PRA 15.5 (STANDARD) [id:9795675] | Isaiah Stewart OVER PRA 15.5 (DEMON) [id:9800698],0.1691035399924792,1.691035399924792,0.6500809838032393,0.0031669617132963797,Sion James OVER RA 4.5 (GOBLIN) [id:9800773] | Aaron Wiggins UNDER PA 17.5 (STANDARD) [id:9799169] | Isaac Okoro UNDER PRA 15.5 (STANDARD) [id:9795675] | Isaiah Stewart OVER PRA 15.5 (DEMON) [id:9800698],Sion James OVER RA 4.5 (GOBLIN) [id:9800773],Aaron Wiggins UNDER PA 17.5 (STANDARD) [id:9799169],Isaac Okoro UNDER PRA 15.5 (STANDARD) [id:9795675],Isaiah Stewart OVER PRA 15.5 (DEMON) [id:9800698]
4,VJ Edgecombe OVER AST 2.5 (GOBLIN) [id:9799452] | Jaylon Tyson OVER PR 17 (STANDARD) [id:9796193] | Moses Moody UNDER PRA 23.5 (STANDARD) [id:9800039] | Anthony Edwards OVER PTS 32.5 (DEMON) [id:9801121],0.16888552264752066,1.6888552264752066,0.6602704459108178,0.0026772203468746385,VJ Edgecombe OVER AST 2.5 (GOBLIN) [id:9799452] | Jaylon Tyson OVER PR 17 (STANDARD) [id:9796193] | Moses Moody UNDER PRA 23.5 (STANDARD) [id:9800039] | Anthony Edwards OVER PTS 32.5 (DEMON) [id:9801121],VJ Edgecombe OVER AST 2.5 (GOBLIN) [id:9799452],Jaylon Tyson OVER PR 17 (STANDARD) [id:9796193],Moses Moody UNDER PRA 23.5 (STANDARD) [id:9800039],Anthony Edwards OVER PTS 32.5 (DEMON) [id:9801121]
4,James Harden OVER PA 24.5 (GOBLIN) [id:9799692] | Kelly Oubre UNDER PTS 14.5 (STANDARD) [id:9798563] | LaMelo Ball UNDER PRA 31 (STANDARD) [id:9795262] | Jusuf Nurkić OVER PRA 29.5 (DEMON) [id:9798373],0.16731213234677184,1.6731213234677185,0.6584283143371326,0.0034540753332696376,James Harden OVER PA 24.5 (GOBLIN) [id:9799692] | Kelly Oubre UNDER PTS 14.5 (STANDARD) [id:9798563] | LaMelo Ball UNDER PRA 31 (STANDARD) [id:9795262] | Jusuf Nurkić OVER PRA 29.5 (DEMON) [id:9798373],James Harden OVER PA 24.5 (GOBLIN) [id:9799692],Kelly Oubre UNDER PTS 14.5 (STANDARD) [id:9798563],LaMelo Ball UNDER PRA 31 (STANDARD) [id:9795262],Jusuf Nurkić OVER PRA 29.5 (DEMON) [id:9798373]
4,Toumani Camara OVER REB 3.5 (GOBLIN) [id:9800050] | Bobby Portis OVER FG3M 1.5 (STANDARD) [id:9801486] | Aaron Wiggins UNDER PR 18.5 (STANDARD) [id:9799170] | Desmond Bane OVER PTS 20.5 (DEMON) [id:9801530],0.16619599152688122,1.6619599152688123,0.6545315936812638,6.564264145988527e-05,Toumani Camara OVER REB 3.5 (GOBLIN) [id:9800050] | Bobby Portis OVER FG3M 1.5 (STANDARD) [id:9801486] | Aaron Wiggins UNDER PR 18.5 (STANDARD) [id:9799170] | Desmond Bane OVER PTS 20.5 (DEMON) [id:9801530],Toumani Camara OVER REB 3.5 (GOBLIN) [id:9800050],Bobby Portis OVER FG3M 1.5 (STANDARD) [id:9801486],Aaron Wiggins UNDER PR 18.5 (STANDARD) [id:9799170],Desmond Bane OVER PTS 20.5 (DEMON) [id:9801530]
4,Austin Reaves OVER PTS 19.5 (GOBLIN) [id:9800824] | De'Anthony Melton UNDER PTS 15.5 (STANDARD) [id:9797207] | James Harden OVER PTS 21.5 (STANDARD) [id:9796108] | Sam Merrill OVER PRA 14.5 (DEMON) [id:9796318],0.16457864331397976,1.6457864331397976,0.6395175964807038,0.004146069207462921,Austin Reaves OVER PTS 19.5 (GOBLIN) [id:9800824] | De'Anthony Melton UNDER PTS 15.5 (STANDARD) [id:9797207] | James Harden OVER PTS 21.5 (STANDARD) [id:9796108] | Sam Merrill OVER PRA 14.5 (DEMON) [id:9796318],Austin Reaves OVER PTS 19.5 (GOBLIN) [id:9800824],De'Anthony Melton UNDER PTS 15.5 (STANDARD) [id:9797207],James Harden OVER PTS 21.5 (STANDARD) [id:9796108],Sam Merrill OVER PRA 14.5 (DEMON) [id:9796318]
