n_legs,legs,hit_prob,payout_mult,kernel_mult,payout_mult_eff,ev_mult,atlas_power_mult,pricing_engine,avg_p,avg_fragility,slip_key,pen_team,pen_family,pen_frag,pen_role_ctx,pen_total,role_ctx_bonus,role_ctx_on_legs,role_ctx_on_share,score_adj,players,rank_ev,beam_selected,leg_1,leg_2,leg_3,leg_4,q_leg_count,q_players
4,Jaden McDaniels OVER AST 1.5 (GOBLIN) [id:10649284] | Ryan Kalkbrenner OVER PR 7.5 (GOBLIN) [id:10650594] | Tristan Silva UNDER PA 12.5 (STANDARD) [id:10648740] | Cameron Payne UNDER PTS 10 (STANDARD) [id:10647560],0.31054529418540483,10.0,0.4541143750281509,4.541143750281509,1.4102308218693838,10.0,pp_kernel,0.7489861405839562,0.032421148488923336,Jaden McDaniels OVER AST 1.5 (GOBLIN) [id:10649284] | Ryan Kalkbrenner OVER PR 7.5 (GOBLIN) [id:10650594] | Tristan Silva UNDER PA 12.5 (STANDARD) [id:10648740] | Cameron Payne UNDER PTS 10 (STANDARD) [id:10647560],0.0,0.0,0.0,0.0,0.0,0.0,1,0.25,1.5602308218693837,"['jaden mcdaniels', 'ryan kalkbrenner', 'tristan silva', 'cameron payne']",1.4102308218693838,1,Jaden McDaniels OVER AST 1.5 (GOBLIN) [id:10649284],Ryan Kalkbrenner OVER PR 7.5 (GOBLIN) [id:10650594],Tristan Silva UNDER PA 12.5 (STANDARD) [id:10648740],Cameron Payne UNDER PTS 10 (STANDARD) [id:10647560],0,
4,Jaime Jaquez OVER PA 14.5 (GOBLIN) [id:10644501] | Coby White OVER PA 14.5 (GOBLIN) [id:10644471] | Jordan Goodwin OVER PTS 5.5 (STANDARD) [id:10652151] | Adem Bona UNDER PTS 6.5 (STANDARD) [id:10644808],0.19672578364563767,10.0,0.703506706826033,7.0350670682603305,1.3839790820031324,10.0,pp_kernel,0.6705362573091976,0.05612655791743446,Jaime Jaquez OVER PA 14.5 (GOBLIN) [id:10644501] | Coby White OVER PA 14.5 (GOBLIN) [id:10644471] | Jordan Goodwin OVER PTS 5.5 (STANDARD) [id:10652151] | Adem Bona UNDER PTS 6.5 (STANDARD) [id:10644808],0.0,0.0,0.0,0.0,0.0,0.0,1,0.25,1.5339790820031323,"['jaime jaquez', 'coby white', 'jordan goodwin', 'adem bona']",1.3839790820031324,1,Jaime Jaquez OVER PA 14.5 (GOBLIN) [id:10644501],Coby White OVER PA 14.5 (GOBLIN) [id:10644471],Jordan Goodwin OVER PTS 5.5 (STANDARD) [id:10652151],Adem Bona UNDER PTS 6.5 (STANDARD) [id:10644808],0,
4,Coby White OVER PTS 11.5 (GOBLIN) [id:10644469] | Ivica Zubac OVER REB 4.5 (GOBLIN) [id:10653968] | Jordan Goodwin OVER PTS 5.5 (STANDARD) [id:10652151] | Myles Turner OVER FG3M 1.5 (STANDARD) [id:10645229],0.18405154023214904,10.0,0.7380564889767707,7.380564889767706,1.3584043357450677,10.0,pp_kernel,0.6582069211421802,0.08478461453940972,Coby White OVER PTS 11.5 (GOBLIN) [id:10644469] | Ivica Zubac OVER REB 4.5 (GOBLIN) [id:10653968] | Jordan Goodwin OVER PTS 5.5 (STANDARD) [id:10652151] | Myles Turner OVER FG3M 1.5 (STANDARD) [id:10645229],0.0,0.0,0.0,0.0,0.0,0.0,1,0.25,1.5084043357450676,"['coby white', 'ivica zubac', 'jordan goodwin', 'myles turner']",1.3584043357450677,1,Coby White OVER PTS 11.5 (GOBLIN) [id:10644469],Ivica Zubac OVER REB 4.5 (GOBLIN) [id:10653968],Jordan Goodwin OVER PTS 5.5 (STANDARD) [id:10652151],Myles Turner OVER FG3M 1.5 (STANDARD) [id:10645229],0,
4,Jaylon Tyson OVER PTS 5.5 (GOBLIN) [id:10652642] | Collin Gillespie OVER REB 2.5 (GOBLIN) [id:10649155] | Quentin Grimes UNDER PR 24.5 (STANDARD) [id:10644628] | Bam Adebayo UNDER PTS 20.5 (STANDARD) [id:10643796],0.16561598075892878,10.0,0.7407861508451266,7.407861508451266,1.226860249048474,10.0,pp_kernel,0.6462422865702644,0.03658314150586095,Jaylon Tyson OVER PTS 5.5 (GOBLIN) [id:10652642] | Collin Gillespie OVER REB 2.5 (GOBLIN) [id:10649155] | Quentin Grimes UNDER PR 24.5 (STANDARD) [id:10644628] | Bam Adebayo UNDER PTS 20.5 (STANDARD) [id:10643796],0.0,0.0,0.0,0.0,0.0,0.0,0,0.0,1.226860249048474,"['jaylon tyson', 'collin gillespie', 'quentin grimes', 'bam adebayo']",1.226860249048474,1,Jaylon Tyson OVER PTS 5.5 (GOBLIN) [id:10652642],Collin Gillespie OVER REB 2.5 (GOBLIN) [id:10649155],Quentin Grimes UNDER PR 24.5 (STANDARD) [id:10644628],Bam Adebayo UNDER PTS 20.5 (STANDARD) [id:10643796],0,
4,Jaden McDaniels OVER AST 1.5 (GOBLIN) [id:10649284] | Collin Gillespie OVER PTS 8.5 (GOBLIN) [id:10650223] | Davion Mitchell OVER RA 7.5 (STANDARD) [id:10643888] | Myles Turner OVER REB 4.5 (STANDARD) [id:10647826],0.1401852824440567,10.0,0.7870973708434124,7.870973708434123,1.103394672426582,10.0,pp_kernel,0.6226639425848939,0.06496208508374386,Jaden McDaniels OVER AST 1.5 (GOBLIN) [id:10649284] | Collin Gillespie OVER PTS 8.5 (GOBLIN) [id:10650223] | Davion Mitchell OVER RA 7.5 (STANDARD) [id:10643888] | Myles Turner OVER REB 4.5 (STANDARD) [id:10647826],0.0,0.0,0.0,0.0,0.0,0.0,0,0.0,1.103394672426582,"['jaden mcdaniels', 'collin gillespie', 'davion mitchell', 'myles turner']",1.103394672426582,1,Jaden McDaniels OVER AST 1.5 (GOBLIN) [id:10649284],Collin Gillespie OVER PTS 8.5 (GOBLIN) [id:10650223],Davion Mitchell OVER RA 7.5 (STANDARD) [id:10643888],Myles Turner OVER REB 4.5 (STANDARD) [id:10647826],0,
4,Alex Sarr OVER PTS 9.5 (GOBLIN) [id:10648087] | Davion Mitchell OVER AST 3.5 (GOBLIN) [id:10643873] | Royce O'Neale OVER PTS 7.5 (STANDARD) [id:10649509] | Thomas Bryant UNDER PR 11.5 (STANDARD) [id:10645259],0.15062511769080683,10.0,0.7316589830627859,7.3165898306278585,1.1020622043336816,10.0,pp_kernel,0.6294220801835512,0.052222803541793525,Alex Sarr OVER PTS 9.5 (GOBLIN) [id:10648087] | Davion Mitchell OVER AST 3.5 (GOBLIN) [id:10643873] | Royce O'Neale OVER PTS 7.5 (STANDARD) [id:10649509] | Thomas Bryant UNDER PR 11.5 (STANDARD) [id:10645259],0.0,0.0,0.0,0.0,0.0,0.0,0,0.0,1.1020622043336816,"['alex sarr', 'davion mitchell', ""royce o'neale"", 'thomas bryant']",1.1020622043336816,1,Alex Sarr OVER PTS 9.5 (GOBLIN) [id:10648087],Davion Mitchell OVER AST 3.5 (GOBLIN) [id:10643873],Royce O'Neale OVER PTS 7.5 (STANDARD) [id:10649509],Thomas Bryant UNDER PR 11.5 (STANDARD) [id:10645259],0,
