n_legs,legs,hit_prob,payout_mult,kernel_mult,payout_mult_eff,ev_mult,atlas_power_mult,pricing_engine,avg_p,avg_fragility,slip_key,pen_team,pen_family,pen_frag,pen_min_std,pen_role_ctx,pen_total,role_ctx_bonus,role_ctx_on_legs,role_ctx_on_share,score_adj,players,rank_ev,beam_selected,leg_1,leg_2,leg_3,leg_4,q_leg_count,q_players
4,OG Anunoby OVER FG3M 1.5 (GOBLIN) [id:11844146] | VJ Edgecombe OVER RA 8.5 (STANDARD) [id:11844874] | Victor Wembanyama OVER PA 30.5 (STANDARD) [id:11813662] | Jalen Brunson OVER AST 9.5 (DEMON) [id:11844012],0.20793277134341023,10.0,0.44725186393500327,4.4725186393500325,0.9299831955651106,10.0,pp_kernel,0.687751333437935,0.04572152246101917,OG Anunoby OVER FG3M 1.5 (GOBLIN) [id:11844146] | VJ Edgecombe OVER RA 8.5 (STANDARD) [id:11844874] | Victor Wembanyama OVER PA 30.5 (STANDARD) [id:11813662] | Jalen Brunson OVER AST 9.5 (DEMON) [id:11844012],0.0,0.0,0.0,0.0,0.0,0.0,0.0,0,0.0,0.9299831955651106,"['og anunoby', 'vj edgecombe', 'victor wembanyama', 'jalen brunson']",0.9299831955651106,1,OG Anunoby OVER FG3M 1.5 (GOBLIN) [id:11844146],VJ Edgecombe OVER RA 8.5 (STANDARD) [id:11844874],Victor Wembanyama OVER PA 30.5 (STANDARD) [id:11813662],Jalen Brunson OVER AST 9.5 (DEMON) [id:11844012],0,
4,Jordan Clarkson OVER PRA 4.5 (GOBLIN) [id:11869195] | Tyrese Maxey UNDER PR 29 (STANDARD) [id:11844200] | Victor Wembanyama OVER PTS 27.5 (STANDARD) [id:11813660] | Jalen Brunson OVER AST 9.5 (DEMON) [id:11844012],0.24122934381668867,10.0,0.3765237190374258,3.765237190374258,0.9082856967481747,10.0,pp_kernel,0.7137755747982324,0.0229622119553931,Jordan Clarkson OVER PRA 4.5 (GOBLIN) [id:11869195] | Tyrese Maxey UNDER PR 29 (STANDARD) [id:11844200] | Victor Wembanyama OVER PTS 27.5 (STANDARD) [id:11813660] | Jalen Brunson OVER AST 9.5 (DEMON) [id:11844012],0.0,0.0,0.0,0.0,0.0,0.0,0.0,0,0.0,0.9082856967481747,"['jordan clarkson', 'tyrese maxey', 'victor wembanyama', 'jalen brunson']",0.9082856967481747,1,Jordan Clarkson OVER PRA 4.5 (GOBLIN) [id:11869195],Tyrese Maxey UNDER PR 29 (STANDARD) [id:11844200],Victor Wembanyama OVER PTS 27.5 (STANDARD) [id:11813660],Jalen Brunson OVER AST 9.5 (DEMON) [id:11844012],0,
4,Dylan Harper OVER PTS 5.5 (GOBLIN) [id:11825820] | Karl-Anthony Towns OVER PRA 35.5 (STANDARD) [id:11844861] | Keldon Johnson UNDER RA 4.5 (STANDARD) [id:11833913] | Jalen Brunson OVER AST 9.5 (DEMON) [id:11844012],0.249669372598768,10.0,0.3571866747499671,3.571866747499671,0.891785729854645,10.0,pp_kernel,0.7187001759650218,0.04557904904085737,Dylan Harper OVER PTS 5.5 (GOBLIN) [id:11825820] | Karl-Anthony Towns OVER PRA 35.5 (STANDARD) [id:11844861] | Keldon Johnson UNDER RA 4.5 (STANDARD) [id:11833913] | Jalen Brunson OVER AST 9.5 (DEMON) [id:11844012],0.0,0.0,0.0,0.0,0.0,0.0,0.0,0,0.0,0.891785729854645,"['dylan harper', 'karl-anthony towns', 'keldon johnson', 'jalen brunson']",0.891785729854645,1,Dylan Harper OVER PTS 5.5 (GOBLIN) [id:11825820],Karl-Anthony Towns OVER PRA 35.5 (STANDARD) [id:11844861],Keldon Johnson UNDER RA 4.5 (STANDARD) [id:11833913],Jalen Brunson OVER AST 9.5 (DEMON) [id:11844012],0,
4,Dylan Harper OVER PTS 5.5 (GOBLIN) [id:11825820] | Jordan Clarkson OVER PTS 5.5 (STANDARD) [id:11854671] | Mikal Bridges UNDER PRA 15.5 (STANDARD) [id:11844890] | Jaden McDaniels OVER PRA 29.5 (DEMON) [id:11812688],0.2179739546362864,10.0,0.4141538866441842,4.1415388664418415,0.902747604998211,10.0,pp_kernel,0.6938059509500419,0.03988898571125901,Dylan Harper OVER PTS 5.5 (GOBLIN) [id:11825820] | Jordan Clarkson OVER PTS 5.5 (STANDARD) [id:11854671] | Mikal Bridges UNDER PRA 15.5 (STANDARD) [id:11844890] | Jaden McDaniels OVER PRA 29.5 (DEMON) [id:11812688],0.0,0.0044444444444444444,0.0,0.0,0.0,0.0044444444444444444,0.0,0,0.0,0.8983031605537666,"['dylan harper', 'jordan clarkson', 'mikal bridges', 'jaden mcdaniels']",0.902747604998211,1,Dylan Harper OVER PTS 5.5 (GOBLIN) [id:11825820],Jordan Clarkson OVER PTS 5.5 (STANDARD) [id:11854671],Mikal Bridges UNDER PRA 15.5 (STANDARD) [id:11844890],Jaden McDaniels OVER PRA 29.5 (DEMON) [id:11812688],0,
4,Joel Embiid OVER RA 12.5 (GOBLIN) [id:11847803] | Keldon Johnson UNDER REB 3.5 (STANDARD) [id:11813097] | Stephon Castle OVER AST 7 (STANDARD) [id:11813233] | Jaden McDaniels OVER PRA 29.5 (DEMON) [id:11812688],0.22503705608766073,10.0,0.39518570887341775,3.9518570887341777,0.8893142853278928,10.0,pp_kernel,0.6995865353491051,0.044555693438039765,Joel Embiid OVER RA 12.5 (GOBLIN) [id:11847803] | Keldon Johnson UNDER REB 3.5 (STANDARD) [id:11813097] | Stephon Castle OVER AST 7 (STANDARD) [id:11813233] | Jaden McDaniels OVER PRA 29.5 (DEMON) [id:11812688],0.0,0.0,0.0,0.0,0.0,0.0,0.0,0,0.0,0.8893142853278928,"['joel embiid', 'keldon johnson', 'stephon castle', 'jaden mcdaniels']",0.8893142853278928,1,Joel Embiid OVER RA 12.5 (GOBLIN) [id:11847803],Keldon Johnson UNDER REB 3.5 (STANDARD) [id:11813097],Stephon Castle OVER AST 7 (STANDARD) [id:11813233],Jaden McDaniels OVER PRA 29.5 (DEMON) [id:11812688],0,
4,Mike Conley OVER PTS 3.5 (GOBLIN) [id:11813633] | Dylan Harper OVER PTS 9.5 (STANDARD) [id:11812962] | Miles McBride UNDER REB 1.5 (STANDARD) [id:11847647] | Joel Embiid OVER REB 10.5 (DEMON) [id:11844064],0.25018771269038126,10.0,0.3593258506806374,3.593258506806374,0.8989891269231414,10.0,pp_kernel,0.7192274940074093,0.03052788596139276,Mike Conley OVER PTS 3.5 (GOBLIN) [id:11813633] | Dylan Harper OVER PTS 9.5 (STANDARD) [id:11812962] | Miles McBride UNDER REB 1.5 (STANDARD) [id:11847647] | Joel Embiid OVER REB 10.5 (DEMON) [id:11844064],0.0,0.0044444444444444444,0.0,0.0,0.0,0.0044444444444444444,0.0,0,0.0,0.8945446824786969,"['mike conley', 'dylan harper', 'miles mcbride', 'joel embiid']",0.8989891269231414,1,Mike Conley OVER PTS 3.5 (GOBLIN) [id:11813633],Dylan Harper OVER PTS 9.5 (STANDARD) [id:11812962],Miles McBride UNDER REB 1.5 (STANDARD) [id:11847647],Joel Embiid OVER REB 10.5 (DEMON) [id:11844064],0,
