n_legs,legs,hit_prob,payout_mult,kernel_mult,payout_mult_eff,ev_mult,atlas_power_mult,pricing_engine,avg_p,avg_fragility,slip_key,pen_team,pen_family,pen_frag,pen_total,role_ctx_bonus,role_ctx_on_legs,role_ctx_on_share,score_adj,players,rank_ev,beam_selected,leg_1,leg_2,leg_3,leg_4,leg_5,q_leg_count,q_players
5,Ryan Kalkbrenner OVER PA 5.5 (GOBLIN) [id:10655296] | Coby White OVER RA 4.5 (GOBLIN) [id:10645584] | Grant Williams OVER PA 7.5 (STANDARD) [id:10643910] | Brandon Miller UNDER PA 24.5 (STANDARD) [id:10643827] | LaMelo Ball OVER PRA 34.5 (DEMON) [id:10644531],0.060568742177332865,20.0,1.1564754656900746,23.129509313801492,1.4009252863158617,20.0,pp_kernel,0.601969803019698,0.07168365327305504,Ryan Kalkbrenner OVER PA 5.5 (GOBLIN) [id:10655296] | Coby White OVER RA 4.5 (GOBLIN) [id:10645584] | Grant Williams OVER PA 7.5 (STANDARD) [id:10643910] | Brandon Miller UNDER PA 24.5 (STANDARD) [id:10643827] | LaMelo Ball OVER PRA 34.5 (DEMON) [id:10644531],0.0,0.0,0.0,0.0,0.0,5,1.0,2.1509252863158617,"['ryan kalkbrenner', 'coby white', 'grant williams', 'brandon miller', 'lamelo ball']",1.4009252863158617,1,Ryan Kalkbrenner OVER PA 5.5 (GOBLIN) [id:10655296],Coby White OVER RA 4.5 (GOBLIN) [id:10645584],Grant Williams OVER PA 7.5 (STANDARD) [id:10643910],Brandon Miller UNDER PA 24.5 (STANDARD) [id:10643827],LaMelo Ball OVER PRA 34.5 (DEMON) [id:10644531],0,
5,Coby White OVER PR 11.5 (GOBLIN) [id:10653363] | Ryan Kalkbrenner OVER PA 4.5 (GOBLIN) [id:10644578] | LaMelo Ball UNDER PR 25.5 (STANDARD) [id:10644002] | Kon Knueppel OVER RA 8.5 (STANDARD) [id:10643976] | Grant Williams OVER PR 14.5 (DEMON) [id:10644495],0.07393701044059084,20.0,0.9086055041965806,18.172110083931614,1.3435914930032178,20.0,pp_kernel,0.6277872212778723,0.07590511455376536,Coby White OVER PR 11.5 (GOBLIN) [id:10653363] | Ryan Kalkbrenner OVER PA 4.5 (GOBLIN) [id:10644578] | LaMelo Ball UNDER PR 25.5 (STANDARD) [id:10644002] | Kon Knueppel OVER RA 8.5 (STANDARD) [id:10643976] | Grant Williams OVER PR 14.5 (DEMON) [id:10644495],0.0,0.0,0.0,0.0,0.0,5,1.0,2.093591493003218,"['coby white', 'ryan kalkbrenner', 'lamelo ball', 'kon knueppel', 'grant williams']",1.3435914930032178,1,Coby White OVER PR 11.5 (GOBLIN) [id:10653363],Ryan Kalkbrenner OVER PA 4.5 (GOBLIN) [id:10644578],LaMelo Ball UNDER PR 25.5 (STANDARD) [id:10644002],Kon Knueppel OVER RA 8.5 (STANDARD) [id:10643976],Grant Williams OVER PR 14.5 (DEMON) [id:10644495],0,
5,Coby White OVER PRA 17.5 (GOBLIN) [id:10645581] | Ryan Kalkbrenner OVER PR 8.5 (GOBLIN) [id:10652267] | Grant Williams OVER PA 7.5 (STANDARD) [id:10643910] | LaMelo Ball UNDER PRA 33 (STANDARD) [id:10644003] | Brandon Miller OVER PRA 32.5 (DEMON) [id:10645573],0.07623171160211976,20.0,0.8297592787565249,16.595185575130497,1.265079400747006,20.0,pp_kernel,0.6226477352264773,0.07276044880562715,Coby White OVER PRA 17.5 (GOBLIN) [id:10645581] | Ryan Kalkbrenner OVER PR 8.5 (GOBLIN) [id:10652267] | Grant Williams OVER PA 7.5 (STANDARD) [id:10643910] | LaMelo Ball UNDER PRA 33 (STANDARD) [id:10644003] | Brandon Miller OVER PRA 32.5 (DEMON) [id:10645573],0.0,0.0,0.0,0.0,0.0,5,1.0,2.0150794007470063,"['coby white', 'ryan kalkbrenner', 'grant williams', 'lamelo ball', 'brandon miller']",1.265079400747006,1,Coby White OVER PRA 17.5 (GOBLIN) [id:10645581],Ryan Kalkbrenner OVER PR 8.5 (GOBLIN) [id:10652267],Grant Williams OVER PA 7.5 (STANDARD) [id:10643910],LaMelo Ball UNDER PRA 33 (STANDARD) [id:10644003],Brandon Miller OVER PRA 32.5 (DEMON) [id:10645573],0,
5,Kon Knueppel OVER PA 19.5 (GOBLIN) [id:10644511] | Coby White OVER AST 1.5 (GOBLIN) [id:10661295] | Brandon Miller UNDER PA 24.5 (STANDARD) [id:10643827] | Miles Bridges OVER PTS 15.5 (STANDARD) [id:10644026] | LaMelo Ball OVER PRA 34.5 (DEMON) [id:10644531],0.05308654175073815,20.0,1.186414751414162,23.72829502828324,1.259653124692791,20.0,pp_kernel,0.5906109389061094,0.05581759899676649,Kon Knueppel OVER PA 19.5 (GOBLIN) [id:10644511] | Coby White OVER AST 1.5 (GOBLIN) [id:10661295] | Brandon Miller UNDER PA 24.5 (STANDARD) [id:10643827] | Miles Bridges OVER PTS 15.5 (STANDARD) [id:10644026] | LaMelo Ball OVER PRA 34.5 (DEMON) [id:10644531],0.0,0.0,0.0,0.0,0.0,5,1.0,2.009653124692791,"['kon knueppel', 'coby white', 'brandon miller', 'miles bridges', 'lamelo ball']",1.259653124692791,1,Kon Knueppel OVER PA 19.5 (GOBLIN) [id:10644511],Coby White OVER AST 1.5 (GOBLIN) [id:10661295],Brandon Miller UNDER PA 24.5 (STANDARD) [id:10643827],Miles Bridges OVER PTS 15.5 (STANDARD) [id:10644026],LaMelo Ball OVER PRA 34.5 (DEMON) [id:10644531],0,
5,Collin Gillespie OVER PTS 10.5 (GOBLIN) [id:10650224] | Josh Hart OVER REB 5.5 (GOBLIN) [id:10649950] | Tyler Herro UNDER PRA 32.5 (STANDARD) [id:10644163] | Kel'el Ware UNDER REB 11.5 (STANDARD) [id:10659144] | Dennis Schröder OVER AST 5.5 (DEMON) [id:10645057],0.030803363150492976,20.0,0.916314471940975,18.3262894388195,0.5645113487850012,20.0,pp_kernel,0.5194565273281626,0.06252425095668916,Collin Gillespie OVER PTS 10.5 (GOBLIN) [id:10650224] | Josh Hart OVER REB 5.5 (GOBLIN) [id:10649950] | Tyler Herro UNDER PRA 32.5 (STANDARD) [id:10644163] | Kel'el Ware UNDER REB 11.5 (STANDARD) [id:10659144] | Dennis Schröder OVER AST 5.5 (DEMON) [id:10645057],0.0,0.0,0.0,0.0,0.0,0,0.0,0.5645113487850012,"['collin gillespie', 'josh hart', 'tyler herro', ""kel'el ware"", 'dennis schröder']",0.5645113487850012,1,Collin Gillespie OVER PTS 10.5 (GOBLIN) [id:10650224],Josh Hart OVER REB 5.5 (GOBLIN) [id:10649950],Tyler Herro UNDER PRA 32.5 (STANDARD) [id:10644163],Kel'el Ware UNDER REB 11.5 (STANDARD) [id:10659144],Dennis Schröder OVER AST 5.5 (DEMON) [id:10645057],0,
5,Jaden McDaniels OVER AST 1.5 (GOBLIN) [id:10649284] | Russell Westbrook OVER PTS 11.5 (GOBLIN) [id:10653975] | Ivica Zubac OVER REB 7.5 (STANDARD) [id:10650937] | Donte DiVincenzo UNDER PRA 23.5 (STANDARD) [id:10649234] | Ajay Mitchell OVER REB 3.5 (DEMON) [id:10644954],0.04349291968072614,20.0,0.6077027928659726,12.154055857319452,0.528615375197454,20.0,pp_kernel,0.5485766630731304,0.0847004716108406,Jaden McDaniels OVER AST 1.5 (GOBLIN) [id:10649284] | Russell Westbrook OVER PTS 11.5 (GOBLIN) [id:10653975] | Ivica Zubac OVER REB 7.5 (STANDARD) [id:10650937] | Donte DiVincenzo UNDER PRA 23.5 (STANDARD) [id:10649234] | Ajay Mitchell OVER REB 3.5 (DEMON) [id:10644954],0.0,0.0,0.0,0.0,0.0,0,0.0,0.528615375197454,"['jaden mcdaniels', 'russell westbrook', 'ivica zubac', 'donte divincenzo', 'ajay mitchell']",0.528615375197454,1,Jaden McDaniels OVER AST 1.5 (GOBLIN) [id:10649284],Russell Westbrook OVER PTS 11.5 (GOBLIN) [id:10653975],Ivica Zubac OVER REB 7.5 (STANDARD) [id:10650937],Donte DiVincenzo UNDER PRA 23.5 (STANDARD) [id:10649234],Ajay Mitchell OVER REB 3.5 (DEMON) [id:10644954],0,
5,Jordan Goodwin OVER PRA 9.5 (GOBLIN) [id:10661651] | Julius Randle OVER FG3M 0.5 (GOBLIN) [id:10659718] | Jaime Jaquez UNDER RA 9.5 (STANDARD) [id:10656123] | Thomas Bryant UNDER PTS 6.5 (STANDARD) [id:10653223] | Cameron Johnson OVER AST 2.5 (DEMON) [id:10647053],0.0329690961189504,20.0,0.7974539771449479,15.949079542898959,0.5258267364586213,20.0,pp_kernel,0.5336460056701899,0.05979566498526059,Jordan Goodwin OVER PRA 9.5 (GOBLIN) [id:10661651] | Julius Randle OVER FG3M 0.5 (GOBLIN) [id:10659718] | Jaime Jaquez UNDER RA 9.5 (STANDARD) [id:10656123] | Thomas Bryant UNDER PTS 6.5 (STANDARD) [id:10653223] | Cameron Johnson OVER AST 2.5 (DEMON) [id:10647053],0.0,0.0,0.0,0.0,0.0,0,0.0,0.5258267364586213,"['jordan goodwin', 'julius randle', 'jaime jaquez', 'thomas bryant', 'cameron johnson']",0.5258267364586213,1,Jordan Goodwin OVER PRA 9.5 (GOBLIN) [id:10661651],Julius Randle OVER FG3M 0.5 (GOBLIN) [id:10659718],Jaime Jaquez UNDER RA 9.5 (STANDARD) [id:10656123],Thomas Bryant UNDER PTS 6.5 (STANDARD) [id:10653223],Cameron Johnson OVER AST 2.5 (DEMON) [id:10647053],0,
5,Kel'el Ware OVER REB 7.5 (GOBLIN) [id:10652727] | Moritz Wagner OVER PTS 5.5 (GOBLIN) [id:10665753] | James Harden OVER PTS 19.5 (STANDARD) [id:10645153] | Ayo Dosunmu UNDER PTS 15.5 (STANDARD) [id:10649095] | Dean Wade OVER FG3M 1.5 (DEMON) [id:10645036],0.028642084081585653,20.0,0.9152591987910941,18.305183975821883,0.5242986185643848,20.0,pp_kernel,0.5068261763412873,0.08565968686142442,Kel'el Ware OVER REB 7.5 (GOBLIN) [id:10652727] | Moritz Wagner OVER PTS 5.5 (GOBLIN) [id:10665753] | James Harden OVER PTS 19.5 (STANDARD) [id:10645153] | Ayo Dosunmu UNDER PTS 15.5 (STANDARD) [id:10649095] | Dean Wade OVER FG3M 1.5 (DEMON) [id:10645036],0.0,0.0,0.0,0.0,0.0,0,0.0,0.5242986185643848,"[""kel'el ware"", 'moritz wagner', 'james harden', 'ayo dosunmu', 'dean wade']",0.5242986185643848,1,Kel'el Ware OVER REB 7.5 (GOBLIN) [id:10652727],Moritz Wagner OVER PTS 5.5 (GOBLIN) [id:10665753],James Harden OVER PTS 19.5 (STANDARD) [id:10645153],Ayo Dosunmu UNDER PTS 15.5 (STANDARD) [id:10649095],Dean Wade OVER FG3M 1.5 (DEMON) [id:10645036],0,
5,Collin Gillespie OVER FG3M 1.5 (GOBLIN) [id:10649127] | Ayo Dosunmu OVER AST 2.5 (GOBLIN) [id:10664232] | Dylan Harper UNDER PA 16.5 (STANDARD) [id:10650454] | Tyler Herro UNDER PA 27.5 (STANDARD) [id:10644161] | Jaime Jaquez OVER AST 5.5 (DEMON) [id:10643925],0.02782613511762969,20.0,0.907614614619612,18.15229229239224,0.5051081380228144,20.0,pp_kernel,0.5174147861640424,0.026724963094020338,Collin Gillespie OVER FG3M 1.5 (GOBLIN) [id:10649127] | Ayo Dosunmu OVER AST 2.5 (GOBLIN) [id:10664232] | Dylan Harper UNDER PA 16.5 (STANDARD) [id:10650454] | Tyler Herro UNDER PA 27.5 (STANDARD) [id:10644161] | Jaime Jaquez OVER AST 5.5 (DEMON) [id:10643925],0.0,0.0,0.0,0.0,0.0,0,0.0,0.5051081380228144,"['collin gillespie', 'ayo dosunmu', 'dylan harper', 'tyler herro', 'jaime jaquez']",0.5051081380228144,1,Collin Gillespie OVER FG3M 1.5 (GOBLIN) [id:10649127],Ayo Dosunmu OVER AST 2.5 (GOBLIN) [id:10664232],Dylan Harper UNDER PA 16.5 (STANDARD) [id:10650454],Tyler Herro UNDER PA 27.5 (STANDARD) [id:10644161],Jaime Jaquez OVER AST 5.5 (DEMON) [id:10643925],0,
5,Pelle Larsson OVER AST 2.5 (GOBLIN) [id:10644101] | Luguentz Dort OVER PTS 5.5 (GOBLIN) [id:10646680] | Ayo Dosunmu UNDER PRA 23.5 (STANDARD) [id:10649103] | Rudy Gobert UNDER PA 13.5 (STANDARD) [id:10649550] | Jaime Jaquez OVER AST 5.5 (DEMON) [id:10643925],0.02763571318554145,20.0,0.908025798029039,18.16051596058078,0.5018788103880583,20.0,pp_kernel,0.5062461229082681,0.04231337249048381,Pelle Larsson OVER AST 2.5 (GOBLIN) [id:10644101] | Luguentz Dort OVER PTS 5.5 (GOBLIN) [id:10646680] | Ayo Dosunmu UNDER PRA 23.5 (STANDARD) [id:10649103] | Rudy Gobert UNDER PA 13.5 (STANDARD) [id:10649550] | Jaime Jaquez OVER AST 5.5 (DEMON) [id:10643925],0.0,0.0,0.0,0.0,0.0,0,0.0,0.5018788103880583,"['pelle larsson', 'luguentz dort', 'ayo dosunmu', 'rudy gobert', 'jaime jaquez']",0.5018788103880583,1,Pelle Larsson OVER AST 2.5 (GOBLIN) [id:10644101],Luguentz Dort OVER PTS 5.5 (GOBLIN) [id:10646680],Ayo Dosunmu UNDER PRA 23.5 (STANDARD) [id:10649103],Rudy Gobert UNDER PA 13.5 (STANDARD) [id:10649550],Jaime Jaquez OVER AST 5.5 (DEMON) [id:10643925],0,
