n_legs,legs,hit_prob,payout_mult,kernel_mult,payout_mult_eff,ev_mult,atlas_power_mult,pricing_engine,avg_p,avg_fragility,slip_key,pen_team,pen_family,pen_frag,pen_total,role_ctx_bonus,role_ctx_on_legs,role_ctx_on_share,score_adj,players,beam_selected,leg_1,leg_2,leg_3,leg_4,q_leg_count,q_players
4,Tyler Herro OVER PTS 19.5 (GOBLIN) [id:10644160] | Coby White OVER PA 14.5 (GOBLIN) [id:10644471] | Kel'el Ware UNDER RA 11.5 (STANDARD) [id:10653551] | Tristan Silva UNDER PR 16.5 (STANDARD) [id:10646713],0.12409476786955644,10.0,1.0,10.0,1.2409476786955644,10.0,atlas,0.5972436138469576,0.03174887980879515,Tyler Herro OVER PTS 19.5 (GOBLIN) [id:10644160] | Coby White OVER PA 14.5 (GOBLIN) [id:10644471] | Kel'el Ware UNDER RA 11.5 (STANDARD) [id:10653551] | Tristan Silva UNDER PR 16.5 (STANDARD) [id:10646713],0.0,0.0,0.0,0.0,0.0,0,0.0,1.2409476786955644,"['tyler herro', 'coby white', ""kel'el ware"", 'tristan silva']",1,Tyler Herro OVER PTS 19.5 (GOBLIN) [id:10644160],Coby White OVER PA 14.5 (GOBLIN) [id:10644471],Kel'el Ware UNDER RA 11.5 (STANDARD) [id:10653551],Tristan Silva UNDER PR 16.5 (STANDARD) [id:10646713],0,
4,Jalen Green OVER RA 5.5 (GOBLIN) [id:10649354] | Ryan Kalkbrenner OVER PR 8.5 (GOBLIN) [id:10652267] | Moussa Diabaté UNDER PR 19 (STANDARD) [id:10644055] | Tristan Silva UNDER PR 16.5 (STANDARD) [id:10646713],0.12227911238975452,10.0,1.0,10.0,1.222791123897545,10.0,atlas,0.5957688686242367,0.03990598726823182,Jalen Green OVER RA 5.5 (GOBLIN) [id:10649354] | Ryan Kalkbrenner OVER PR 8.5 (GOBLIN) [id:10652267] | Moussa Diabaté UNDER PR 19 (STANDARD) [id:10644055] | Tristan Silva UNDER PR 16.5 (STANDARD) [id:10646713],0.0,0.0,0.0,0.0,0.0,0,0.0,1.222791123897545,"['jalen green', 'ryan kalkbrenner', 'moussa diabaté', 'tristan silva']",1,Jalen Green OVER RA 5.5 (GOBLIN) [id:10649354],Ryan Kalkbrenner OVER PR 8.5 (GOBLIN) [id:10652267],Moussa Diabaté UNDER PR 19 (STANDARD) [id:10644055],Tristan Silva UNDER PR 16.5 (STANDARD) [id:10646713],0,
4,Davion Mitchell OVER PRA 14.5 (GOBLIN) [id:10644489] | Brandon Miller OVER PRA 24.5 (GOBLIN) [id:10644465] | Tristan Silva UNDER PA 12.5 (STANDARD) [id:10648740] | Trendon Watford UNDER REB 3.5 (STANDARD) [id:10644896],0.10859183249497743,10.0,1.0,10.0,1.0859183249497744,10.0,atlas,0.5779447565065803,0.04017062040259921,Davion Mitchell OVER PRA 14.5 (GOBLIN) [id:10644489] | Brandon Miller OVER PRA 24.5 (GOBLIN) [id:10644465] | Tristan Silva UNDER PA 12.5 (STANDARD) [id:10648740] | Trendon Watford UNDER REB 3.5 (STANDARD) [id:10644896],0.0,0.0,0.0,0.0,0.0,0,0.0,1.0859183249497744,"['davion mitchell', 'brandon miller', 'tristan silva', 'trendon watford']",1,Davion Mitchell OVER PRA 14.5 (GOBLIN) [id:10644489],Brandon Miller OVER PRA 24.5 (GOBLIN) [id:10644465],Tristan Silva UNDER PA 12.5 (STANDARD) [id:10648740],Trendon Watford UNDER REB 3.5 (STANDARD) [id:10644896],0,
4,LaMelo Ball OVER PR 23.5 (GOBLIN) [id:10653807] | Miles Bridges OVER PTS 11.5 (GOBLIN) [id:10644534] | Jaime Jaquez OVER PTS 14 (STANDARD) [id:10643937] | Tristan Silva UNDER RA 6.5 (STANDARD) [id:10648747],0.10223641694427885,10.0,1.0,10.0,1.0223641694427885,10.0,atlas,0.5698088141694705,0.0442599854067279,LaMelo Ball OVER PR 23.5 (GOBLIN) [id:10653807] | Miles Bridges OVER PTS 11.5 (GOBLIN) [id:10644534] | Jaime Jaquez OVER PTS 14 (STANDARD) [id:10643937] | Tristan Silva UNDER RA 6.5 (STANDARD) [id:10648747],0.0,0.0,0.0,0.0,0.0,0,0.0,1.0223641694427885,"['lamelo ball', 'miles bridges', 'jaime jaquez', 'tristan silva']",1,LaMelo Ball OVER PR 23.5 (GOBLIN) [id:10653807],Miles Bridges OVER PTS 11.5 (GOBLIN) [id:10644534],Jaime Jaquez OVER PTS 14 (STANDARD) [id:10643937],Tristan Silva UNDER RA 6.5 (STANDARD) [id:10648747],0,
4,Coby White OVER PR 11.5 (GOBLIN) [id:10653363] | Grant Williams OVER PR 8.5 (GOBLIN) [id:10652259] | Kon Knueppel OVER PR 24.5 (STANDARD) [id:10643969] | Tristan Silva UNDER RA 6.5 (STANDARD) [id:10648747],0.09916455475722392,10.0,1.0,10.0,0.9916455475722392,10.0,atlas,0.5658358804219559,0.06065565081357445,Coby White OVER PR 11.5 (GOBLIN) [id:10653363] | Grant Williams OVER PR 8.5 (GOBLIN) [id:10652259] | Kon Knueppel OVER PR 24.5 (STANDARD) [id:10643969] | Tristan Silva UNDER RA 6.5 (STANDARD) [id:10648747],0.0,0.0,0.0,0.0,0.0,0,0.0,0.9916455475722392,"['coby white', 'grant williams', 'kon knueppel', 'tristan silva']",1,Coby White OVER PR 11.5 (GOBLIN) [id:10653363],Grant Williams OVER PR 8.5 (GOBLIN) [id:10652259],Kon Knueppel OVER PR 24.5 (STANDARD) [id:10643969],Tristan Silva UNDER RA 6.5 (STANDARD) [id:10648747],0,
4,Jordan Goodwin OVER PTS 4.5 (GOBLIN) [id:10652150] | Coby White OVER PR 14.5 (GOBLIN) [id:10644474] | Royce O'Neale UNDER PRA 15.5 (STANDARD) [id:10650250] | Moussa Diabaté UNDER PRA 20.5 (STANDARD) [id:10644056],0.09880692066642348,10.0,1.0,10.0,0.9880692066642348,10.0,atlas,0.5618709917737116,0.031624440536441714,Jordan Goodwin OVER PTS 4.5 (GOBLIN) [id:10652150] | Coby White OVER PR 14.5 (GOBLIN) [id:10644474] | Royce O'Neale UNDER PRA 15.5 (STANDARD) [id:10650250] | Moussa Diabaté UNDER PRA 20.5 (STANDARD) [id:10644056],0.0,0.0,0.0,0.0,0.0,0,0.0,0.9880692066642348,"['jordan goodwin', 'coby white', ""royce o'neale"", 'moussa diabaté']",1,Jordan Goodwin OVER PTS 4.5 (GOBLIN) [id:10652150],Coby White OVER PR 14.5 (GOBLIN) [id:10644474],Royce O'Neale UNDER PRA 15.5 (STANDARD) [id:10650250],Moussa Diabaté UNDER PRA 20.5 (STANDARD) [id:10644056],0,
4,Kon Knueppel OVER PRA 26.5 (GOBLIN) [id:10653804] | Grant Williams OVER PTS 4.5 (GOBLIN) [id:10643909] | Kel'el Ware UNDER PR 22.5 (STANDARD) [id:10650504] | Trendon Watford UNDER PRA 16.5 (STANDARD) [id:10644893],0.09423025356648501,10.0,1.0,10.0,0.9423025356648501,10.0,atlas,0.5551601443566956,0.03322338297804722,Kon Knueppel OVER PRA 26.5 (GOBLIN) [id:10653804] | Grant Williams OVER PTS 4.5 (GOBLIN) [id:10643909] | Kel'el Ware UNDER PR 22.5 (STANDARD) [id:10650504] | Trendon Watford UNDER PRA 16.5 (STANDARD) [id:10644893],0.0,0.0,0.0,0.0,0.0,0,0.0,0.9423025356648501,"['kon knueppel', 'grant williams', ""kel'el ware"", 'trendon watford']",1,Kon Knueppel OVER PRA 26.5 (GOBLIN) [id:10653804],Grant Williams OVER PTS 4.5 (GOBLIN) [id:10643909],Kel'el Ware UNDER PR 22.5 (STANDARD) [id:10650504],Trendon Watford UNDER PRA 16.5 (STANDARD) [id:10644893],0,
4,Bam Adebayo OVER RA 10.5 (GOBLIN) [id:10645565] | Brandon Miller OVER PTS 18.5 (GOBLIN) [id:10645676] | Kel'el Ware UNDER PR 22.5 (STANDARD) [id:10650504] | De'Aaron Fox UNDER PR 22.5 (STANDARD) [id:10649863],0.09384354349708879,10.0,1.0,10.0,0.9384354349708879,10.0,atlas,0.5544816972208815,0.03220781781632569,Bam Adebayo OVER RA 10.5 (GOBLIN) [id:10645565] | Brandon Miller OVER PTS 18.5 (GOBLIN) [id:10645676] | Kel'el Ware UNDER PR 22.5 (STANDARD) [id:10650504] | De'Aaron Fox UNDER PR 22.5 (STANDARD) [id:10649863],0.0,0.0,0.0,0.0,0.0,0,0.0,0.9384354349708879,"['bam adebayo', 'brandon miller', ""kel'el ware"", ""de'aaron fox""]",1,Bam Adebayo OVER RA 10.5 (GOBLIN) [id:10645565],Brandon Miller OVER PTS 18.5 (GOBLIN) [id:10645676],Kel'el Ware UNDER PR 22.5 (STANDARD) [id:10650504],De'Aaron Fox UNDER PR 22.5 (STANDARD) [id:10649863],0,
4,Naz Reid OVER REB 5.5 (GOBLIN) [id:10649440] | Giannis Antetokounmpo OVER PTS 24.5 (GOBLIN) [id:10645127] | Trendon Watford UNDER REB 3.5 (STANDARD) [id:10644896] | Moussa Diabaté UNDER PA 10.5 (STANDARD) [id:10644054],0.09185784337198878,10.0,1.0,10.0,0.9185784337198878,10.0,atlas,0.5518716802311225,0.03678601817637608,Naz Reid OVER REB 5.5 (GOBLIN) [id:10649440] | Giannis Antetokounmpo OVER PTS 24.5 (GOBLIN) [id:10645127] | Trendon Watford UNDER REB 3.5 (STANDARD) [id:10644896] | Moussa Diabaté UNDER PA 10.5 (STANDARD) [id:10644054],0.0,0.0,0.0,0.0,0.0,0,0.0,0.9185784337198878,"['naz reid', 'giannis antetokounmpo', 'trendon watford', 'moussa diabaté']",1,Naz Reid OVER REB 5.5 (GOBLIN) [id:10649440],Giannis Antetokounmpo OVER PTS 24.5 (GOBLIN) [id:10645127],Trendon Watford UNDER REB 3.5 (STANDARD) [id:10644896],Moussa Diabaté UNDER PA 10.5 (STANDARD) [id:10644054],0,
4,LaMelo Ball OVER PTS 16.5 (GOBLIN) [id:10646664] | Davion Mitchell OVER PRA 14.5 (GOBLIN) [id:10644489] | Jaime Jaquez OVER PR 18.5 (STANDARD) [id:10643939] | Trendon Watford UNDER PTS 8.5 (STANDARD) [id:10648231],0.09118541745318325,10.0,1.0,10.0,0.9118541745318325,10.0,atlas,0.5507821500147552,0.05194276672953322,LaMelo Ball OVER PTS 16.5 (GOBLIN) [id:10646664] | Davion Mitchell OVER PRA 14.5 (GOBLIN) [id:10644489] | Jaime Jaquez OVER PR 18.5 (STANDARD) [id:10643939] | Trendon Watford UNDER PTS 8.5 (STANDARD) [id:10648231],0.0,0.0,0.0,0.0,0.0,0,0.0,0.9118541745318325,"['lamelo ball', 'davion mitchell', 'jaime jaquez', 'trendon watford']",1,LaMelo Ball OVER PTS 16.5 (GOBLIN) [id:10646664],Davion Mitchell OVER PRA 14.5 (GOBLIN) [id:10644489],Jaime Jaquez OVER PR 18.5 (STANDARD) [id:10643939],Trendon Watford UNDER PTS 8.5 (STANDARD) [id:10648231],0,
4,Davion Mitchell OVER PR 7.5 (GOBLIN) [id:10650527] | Kon Knueppel OVER PTS 14.5 (GOBLIN) [id:10643967] | Coby White OVER PA 16.5 (STANDARD) [id:10643854] | Moussa Diabaté UNDER PA 10.5 (STANDARD) [id:10644054],0.09106126149211285,10.0,1.0,10.0,0.9106126149211285,10.0,atlas,0.5504981476909556,0.052283611762183116,Davion Mitchell OVER PR 7.5 (GOBLIN) [id:10650527] | Kon Knueppel OVER PTS 14.5 (GOBLIN) [id:10643967] | Coby White OVER PA 16.5 (STANDARD) [id:10643854] | Moussa Diabaté UNDER PA 10.5 (STANDARD) [id:10644054],0.0,0.0,0.0,0.0,0.0,0,0.0,0.9106126149211285,"['davion mitchell', 'kon knueppel', 'coby white', 'moussa diabaté']",1,Davion Mitchell OVER PR 7.5 (GOBLIN) [id:10650527],Kon Knueppel OVER PTS 14.5 (GOBLIN) [id:10643967],Coby White OVER PA 16.5 (STANDARD) [id:10643854],Moussa Diabaté UNDER PA 10.5 (STANDARD) [id:10644054],0,
4,Coby White OVER PR 11.5 (GOBLIN) [id:10653363] | Davion Mitchell OVER PRA 14.5 (GOBLIN) [id:10644489] | Shai Gilgeous-Alexander UNDER PRA 43.5 (STANDARD) [id:10645030] | De'Aaron Fox UNDER RA 10.5 (STANDARD) [id:10649865],0.09062398163437332,10.0,1.0,10.0,0.9062398163437333,10.0,atlas,0.5489760694331777,0.039964488918954856,Coby White OVER PR 11.5 (GOBLIN) [id:10653363] | Davion Mitchell OVER PRA 14.5 (GOBLIN) [id:10644489] | Shai Gilgeous-Alexander UNDER PRA 43.5 (STANDARD) [id:10645030] | De'Aaron Fox UNDER RA 10.5 (STANDARD) [id:10649865],0.0,0.0,0.0,0.0,0.0,0,0.0,0.9062398163437333,"['coby white', 'davion mitchell', 'shai gilgeous-alexander', ""de'aaron fox""]",1,Coby White OVER PR 11.5 (GOBLIN) [id:10653363],Davion Mitchell OVER PRA 14.5 (GOBLIN) [id:10644489],Shai Gilgeous-Alexander UNDER PRA 43.5 (STANDARD) [id:10645030],De'Aaron Fox UNDER RA 10.5 (STANDARD) [id:10649865],0,
4,Rudy Gobert OVER REB 9.5 (GOBLIN) [id:10652125] | Grant Williams OVER PRA 9.5 (GOBLIN) [id:10644496] | Nikola Jokić UNDER RA 24 (STANDARD) [id:10644406] | Kel'el Ware UNDER PTS 12 (STANDARD) [id:10650500],0.09053877589844417,10.0,1.0,10.0,0.9053877589844417,10.0,atlas,0.5494859590064253,0.03127958694064625,Rudy Gobert OVER REB 9.5 (GOBLIN) [id:10652125] | Grant Williams OVER PRA 9.5 (GOBLIN) [id:10644496] | Nikola Jokić UNDER RA 24 (STANDARD) [id:10644406] | Kel'el Ware UNDER PTS 12 (STANDARD) [id:10650500],0.0,0.0,0.0,0.0,0.0,0,0.0,0.9053877589844417,"['rudy gobert', 'grant williams', 'nikola jokić', ""kel'el ware""]",1,Rudy Gobert OVER REB 9.5 (GOBLIN) [id:10652125],Grant Williams OVER PRA 9.5 (GOBLIN) [id:10644496],Nikola Jokić UNDER RA 24 (STANDARD) [id:10644406],Kel'el Ware UNDER PTS 12 (STANDARD) [id:10650500],0,
4,Kon Knueppel OVER PRA 25.5 (GOBLIN) [id:10645615] | Devin Booker OVER PTS 23.5 (GOBLIN) [id:10652321] | Jett Howard UNDER PA 6.5 (STANDARD) [id:10648860] | Trendon Watford UNDER PR 12.5 (STANDARD) [id:10644892],0.08986922525578243,10.0,1.0,10.0,0.8986922525578244,10.0,atlas,0.5481058330589744,0.03306364879929208,Kon Knueppel OVER PRA 25.5 (GOBLIN) [id:10645615] | Devin Booker OVER PTS 23.5 (GOBLIN) [id:10652321] | Jett Howard UNDER PA 6.5 (STANDARD) [id:10648860] | Trendon Watford UNDER PR 12.5 (STANDARD) [id:10644892],0.0,0.0,0.0,0.0,0.0,0,0.0,0.8986922525578244,"['kon knueppel', 'devin booker', 'jett howard', 'trendon watford']",1,Kon Knueppel OVER PRA 25.5 (GOBLIN) [id:10645615],Devin Booker OVER PTS 23.5 (GOBLIN) [id:10652321],Jett Howard UNDER PA 6.5 (STANDARD) [id:10648860],Trendon Watford UNDER PR 12.5 (STANDARD) [id:10644892],0,
4,Miles Bridges OVER PRA 22.5 (GOBLIN) [id:10645714] | Collin Gillespie OVER PTS 8.5 (GOBLIN) [id:10650223] | Royce O'Neale UNDER AST 2.5 (STANDARD) [id:10649496] | De'Aaron Fox UNDER RA 10.5 (STANDARD) [id:10649865],0.08859174261881768,10.0,1.0,10.0,0.8859174261881768,10.0,atlas,0.546021520172749,0.03205226912144065,Miles Bridges OVER PRA 22.5 (GOBLIN) [id:10645714] | Collin Gillespie OVER PTS 8.5 (GOBLIN) [id:10650223] | Royce O'Neale UNDER AST 2.5 (STANDARD) [id:10649496] | De'Aaron Fox UNDER RA 10.5 (STANDARD) [id:10649865],0.0,0.0,0.0,0.0,0.0,0,0.0,0.8859174261881768,"['miles bridges', 'collin gillespie', ""royce o'neale"", ""de'aaron fox""]",1,Miles Bridges OVER PRA 22.5 (GOBLIN) [id:10645714],Collin Gillespie OVER PTS 8.5 (GOBLIN) [id:10650223],Royce O'Neale UNDER AST 2.5 (STANDARD) [id:10649496],De'Aaron Fox UNDER RA 10.5 (STANDARD) [id:10649865],0,
4,Devin Booker OVER PRA 29.5 (GOBLIN) [id:10652479] | Jaime Jaquez OVER PR 17.5 (GOBLIN) [id:10654221] | Jaden McDaniels UNDER PA 18.5 (STANDARD) [id:10649300] | Kel'el Ware UNDER REB 10.5 (STANDARD) [id:10650505],0.08802721821911637,10.0,1.0,10.0,0.8802721821911637,10.0,atlas,0.5468512876504981,0.040267795449608054,Devin Booker OVER PRA 29.5 (GOBLIN) [id:10652479] | Jaime Jaquez OVER PR 17.5 (GOBLIN) [id:10654221] | Jaden McDaniels UNDER PA 18.5 (STANDARD) [id:10649300] | Kel'el Ware UNDER REB 10.5 (STANDARD) [id:10650505],0.0,0.0,0.0,0.0,0.0,0,0.0,0.8802721821911637,"['devin booker', 'jaime jaquez', 'jaden mcdaniels', ""kel'el ware""]",1,Devin Booker OVER PRA 29.5 (GOBLIN) [id:10652479],Jaime Jaquez OVER PR 17.5 (GOBLIN) [id:10654221],Jaden McDaniels UNDER PA 18.5 (STANDARD) [id:10649300],Kel'el Ware UNDER REB 10.5 (STANDARD) [id:10650505],0,
4,Kon Knueppel OVER PRA 24.5 (GOBLIN) [id:10644517] | Jaime Jaquez OVER PR 14.5 (GOBLIN) [id:10644503] | Royce O'Neale UNDER AST 2.5 (STANDARD) [id:10649496] | Karl-Anthony Towns UNDER PRA 35.5 (STANDARD) [id:10650141],0.08682317613716078,10.0,1.0,10.0,0.8682317613716078,10.0,atlas,0.5431603690435414,0.04016746707352999,Kon Knueppel OVER PRA 24.5 (GOBLIN) [id:10644517] | Jaime Jaquez OVER PR 14.5 (GOBLIN) [id:10644503] | Royce O'Neale UNDER AST 2.5 (STANDARD) [id:10649496] | Karl-Anthony Towns UNDER PRA 35.5 (STANDARD) [id:10650141],0.0,0.0,0.0,0.0,0.0,0,0.0,0.8682317613716078,"['kon knueppel', 'jaime jaquez', ""royce o'neale"", 'karl-anthony towns']",1,Kon Knueppel OVER PRA 24.5 (GOBLIN) [id:10644517],Jaime Jaquez OVER PR 14.5 (GOBLIN) [id:10644503],Royce O'Neale UNDER AST 2.5 (STANDARD) [id:10649496],Karl-Anthony Towns UNDER PRA 35.5 (STANDARD) [id:10650141],0,
4,Brandon Miller OVER PR 24.5 (GOBLIN) [id:10644462] | Grayson Allen OVER PTS 11.5 (GOBLIN) [id:10650230] | Moussa Diabaté UNDER PA 10.5 (STANDARD) [id:10644054] | Ayo Dosunmu OVER PTS 15.5 (STANDARD) [id:10649095],0.08534346674092547,10.0,1.0,10.0,0.8534346674092547,10.0,atlas,0.5420275566666635,0.04675529515348613,Brandon Miller OVER PR 24.5 (GOBLIN) [id:10644462] | Grayson Allen OVER PTS 11.5 (GOBLIN) [id:10650230] | Moussa Diabaté UNDER PA 10.5 (STANDARD) [id:10644054] | Ayo Dosunmu OVER PTS 15.5 (STANDARD) [id:10649095],0.0,0.0,0.0,0.0,0.0,0,0.0,0.8534346674092547,"['brandon miller', 'grayson allen', 'moussa diabaté', 'ayo dosunmu']",1,Brandon Miller OVER PR 24.5 (GOBLIN) [id:10644462],Grayson Allen OVER PTS 11.5 (GOBLIN) [id:10650230],Moussa Diabaté UNDER PA 10.5 (STANDARD) [id:10644054],Ayo Dosunmu OVER PTS 15.5 (STANDARD) [id:10649095],0,
4,Tyler Herro OVER PTS 17.5 (GOBLIN) [id:10644585] | Davion Mitchell OVER AST 3.5 (GOBLIN) [id:10643873] | Rudy Gobert OVER REB 11.5 (STANDARD) [id:10649561] | Royce O'Neale UNDER AST 2.5 (STANDARD) [id:10649496],0.08525395883845381,10.0,1.0,10.0,0.8525395883845381,10.0,atlas,0.5408365058472724,0.03515318107788445,Tyler Herro OVER PTS 17.5 (GOBLIN) [id:10644585] | Davion Mitchell OVER AST 3.5 (GOBLIN) [id:10643873] | Rudy Gobert OVER REB 11.5 (STANDARD) [id:10649561] | Royce O'Neale UNDER AST 2.5 (STANDARD) [id:10649496],0.0,0.0,0.0,0.0,0.0,0,0.0,0.8525395883845381,"['tyler herro', 'davion mitchell', 'rudy gobert', ""royce o'neale""]",1,Tyler Herro OVER PTS 17.5 (GOBLIN) [id:10644585],Davion Mitchell OVER AST 3.5 (GOBLIN) [id:10643873],Rudy Gobert OVER REB 11.5 (STANDARD) [id:10649561],Royce O'Neale UNDER AST 2.5 (STANDARD) [id:10649496],0,
4,Ryan Kalkbrenner OVER REB 3.5 (GOBLIN) [id:10644137] | Jalen Green OVER REB 3.5 (GOBLIN) [id:10649350] | Nikola Jokić UNDER RA 24 (STANDARD) [id:10644406] | Karl-Anthony Towns UNDER PTS 20.5 (STANDARD) [id:10650134],0.08505040493141698,10.0,1.0,10.0,0.8505040493141698,10.0,atlas,0.5402941409452524,0.022399323827302274,Ryan Kalkbrenner OVER REB 3.5 (GOBLIN) [id:10644137] | Jalen Green OVER REB 3.5 (GOBLIN) [id:10649350] | Nikola Jokić UNDER RA 24 (STANDARD) [id:10644406] | Karl-Anthony Towns UNDER PTS 20.5 (STANDARD) [id:10650134],0.0,0.0,0.0,0.0,0.0,0,0.0,0.8505040493141698,"['ryan kalkbrenner', 'jalen green', 'nikola jokić', 'karl-anthony towns']",1,Ryan Kalkbrenner OVER REB 3.5 (GOBLIN) [id:10644137],Jalen Green OVER REB 3.5 (GOBLIN) [id:10649350],Nikola Jokić UNDER RA 24 (STANDARD) [id:10644406],Karl-Anthony Towns UNDER PTS 20.5 (STANDARD) [id:10650134],0,
4,Julius Randle OVER PTS 17.5 (GOBLIN) [id:10652122] | LaMelo Ball OVER PRA 24.5 (GOBLIN) [id:10644529] | Oso Ighodaro OVER RA 8 (STANDARD) [id:10649482] | Jett Howard UNDER PRA 9 (STANDARD) [id:10648866],0.08265335411226338,10.0,1.0,10.0,0.8265335411226338,10.0,atlas,0.5372920600845544,0.05425420709581838,Julius Randle OVER PTS 17.5 (GOBLIN) [id:10652122] | LaMelo Ball OVER PRA 24.5 (GOBLIN) [id:10644529] | Oso Ighodaro OVER RA 8 (STANDARD) [id:10649482] | Jett Howard UNDER PRA 9 (STANDARD) [id:10648866],0.0,0.0,0.0,0.0,0.0,0,0.0,0.8265335411226338,"['julius randle', 'lamelo ball', 'oso ighodaro', 'jett howard']",1,Julius Randle OVER PTS 17.5 (GOBLIN) [id:10652122],LaMelo Ball OVER PRA 24.5 (GOBLIN) [id:10644529],Oso Ighodaro OVER RA 8 (STANDARD) [id:10649482],Jett Howard UNDER PRA 9 (STANDARD) [id:10648866],0,
4,Brandon Miller OVER PTS 14.5 (GOBLIN) [id:10643826] | Jaime Jaquez OVER RA 7.5 (GOBLIN) [id:10650536] | Shai Gilgeous-Alexander UNDER PTS 31.5 (STANDARD) [id:10645531] | Ajay Mitchell OVER PTS 13.5 (STANDARD) [id:10644949],0.08081632764964948,10.0,1.0,10.0,0.8081632764964948,10.0,atlas,0.5338944825000608,0.05629486559077789,Brandon Miller OVER PTS 14.5 (GOBLIN) [id:10643826] | Jaime Jaquez OVER RA 7.5 (GOBLIN) [id:10650536] | Shai Gilgeous-Alexander UNDER PTS 31.5 (STANDARD) [id:10645531] | Ajay Mitchell OVER PTS 13.5 (STANDARD) [id:10644949],0.0,0.0,0.0,0.0,0.0,0,0.0,0.8081632764964948,"['brandon miller', 'jaime jaquez', 'shai gilgeous-alexander', 'ajay mitchell']",1,Brandon Miller OVER PTS 14.5 (GOBLIN) [id:10643826],Jaime Jaquez OVER RA 7.5 (GOBLIN) [id:10650536],Shai Gilgeous-Alexander UNDER PTS 31.5 (STANDARD) [id:10645531],Ajay Mitchell OVER PTS 13.5 (STANDARD) [id:10644949],0,
4,Grant Williams OVER RA 3.5 (GOBLIN) [id:10645599] | Bam Adebayo OVER PTS 17.5 (GOBLIN) [id:10644443] | Norman Powell OVER PR 25 (STANDARD) [id:10644082] | Shai Gilgeous-Alexander UNDER PRA 43.5 (STANDARD) [id:10645030],0.08037839456905173,10.0,1.0,10.0,0.8037839456905173,10.0,atlas,0.532986297636479,0.054240238566219026,Grant Williams OVER RA 3.5 (GOBLIN) [id:10645599] | Bam Adebayo OVER PTS 17.5 (GOBLIN) [id:10644443] | Norman Powell OVER PR 25 (STANDARD) [id:10644082] | Shai Gilgeous-Alexander UNDER PRA 43.5 (STANDARD) [id:10645030],0.0,0.0,0.0,0.0,0.0,0,0.0,0.8037839456905173,"['grant williams', 'bam adebayo', 'norman powell', 'shai gilgeous-alexander']",1,Grant Williams OVER RA 3.5 (GOBLIN) [id:10645599],Bam Adebayo OVER PTS 17.5 (GOBLIN) [id:10644443],Norman Powell OVER PR 25 (STANDARD) [id:10644082],Shai Gilgeous-Alexander UNDER PRA 43.5 (STANDARD) [id:10645030],0,
4,Ayo Dosunmu OVER PRA 19.5 (GOBLIN) [id:10652198] | Jalen Green OVER RA 5.5 (GOBLIN) [id:10649354] | Tyler Herro OVER PA 25.5 (STANDARD) [id:10644161] | Nikola Jokić UNDER AST 10.5 (STANDARD) [id:10644401],0.07952284455633297,10.0,1.0,10.0,0.7952284455633297,10.0,atlas,0.5312584840743746,0.060304854350941836,Ayo Dosunmu OVER PRA 19.5 (GOBLIN) [id:10652198] | Jalen Green OVER RA 5.5 (GOBLIN) [id:10649354] | Tyler Herro OVER PA 25.5 (STANDARD) [id:10644161] | Nikola Jokić UNDER AST 10.5 (STANDARD) [id:10644401],0.0,0.0,0.0,0.0,0.0,0,0.0,0.7952284455633297,"['ayo dosunmu', 'jalen green', 'tyler herro', 'nikola jokić']",1,Ayo Dosunmu OVER PRA 19.5 (GOBLIN) [id:10652198],Jalen Green OVER RA 5.5 (GOBLIN) [id:10649354],Tyler Herro OVER PA 25.5 (STANDARD) [id:10644161],Nikola Jokić UNDER AST 10.5 (STANDARD) [id:10644401],0,
4,Bam Adebayo OVER REB 7.5 (GOBLIN) [id:10644454] | LaMelo Ball OVER PTS 14.5 (GOBLIN) [id:10644000] | Karl-Anthony Towns UNDER RA 14.5 (STANDARD) [id:10650152] | Dennis Schröder UNDER PTS 8.5 (STANDARD) [id:10645063],0.07943474610527794,10.0,1.0,10.0,0.7943474610527794,10.0,atlas,0.5309130056137358,0.023062304334779963,Bam Adebayo OVER REB 7.5 (GOBLIN) [id:10644454] | LaMelo Ball OVER PTS 14.5 (GOBLIN) [id:10644000] | Karl-Anthony Towns UNDER RA 14.5 (STANDARD) [id:10650152] | Dennis Schröder UNDER PTS 8.5 (STANDARD) [id:10645063],0.0,0.0,0.0,0.0,0.0,0,0.0,0.7943474610527794,"['bam adebayo', 'lamelo ball', 'karl-anthony towns', 'dennis schröder']",1,Bam Adebayo OVER REB 7.5 (GOBLIN) [id:10644454],LaMelo Ball OVER PTS 14.5 (GOBLIN) [id:10644000],Karl-Anthony Towns UNDER RA 14.5 (STANDARD) [id:10650152],Dennis Schröder UNDER PTS 8.5 (STANDARD) [id:10645063],0,
