n_legs,legs,hit_prob,payout_mult,kernel_mult,payout_mult_eff,ev_mult,atlas_power_mult,pricing_engine,avg_p,avg_fragility,slip_key,pen_team,pen_family,pen_frag,pen_total,role_ctx_bonus,role_ctx_on_legs,role_ctx_on_share,score_adj,players,rank_ev,beam_selected,leg_1,leg_2,leg_3,leg_4,leg_5,q_leg_count,q_players
5,Norman Powell OVER PTS 19.5 (GOBLIN) [id:10644383] | Davion Mitchell OVER PA 11.5 (GOBLIN) [id:10650767] | Naz Reid OVER REB 4.5 (GOBLIN) [id:10652124] | Tristan Silva UNDER PA 12.5 (STANDARD) [id:10648740] | Trendon Watford UNDER REB 3.5 (STANDARD) [id:10644896],0.06038515823700748,20.0,1.0,20.0,1.2077031647401495,20.0,atlas,0.5740912792988817,0.03465921118367146,Norman Powell OVER PTS 19.5 (GOBLIN) [id:10644383] | Davion Mitchell OVER PA 11.5 (GOBLIN) [id:10650767] | Naz Reid OVER REB 4.5 (GOBLIN) [id:10652124] | Tristan Silva UNDER PA 12.5 (STANDARD) [id:10648740] | Trendon Watford UNDER REB 3.5 (STANDARD) [id:10644896],0.0,0.0,0.0,0.0,0.0,0,0.0,1.2077031647401495,"['norman powell', 'davion mitchell', 'naz reid', 'tristan silva', 'trendon watford']",1.2077031647401495,1,Norman Powell OVER PTS 19.5 (GOBLIN) [id:10644383],Davion Mitchell OVER PA 11.5 (GOBLIN) [id:10650767],Naz Reid OVER REB 4.5 (GOBLIN) [id:10652124],Tristan Silva UNDER PA 12.5 (STANDARD) [id:10648740],Trendon Watford UNDER REB 3.5 (STANDARD) [id:10644896],0,
5,Davion Mitchell OVER PRA 14.5 (GOBLIN) [id:10644489] | Norman Powell OVER PTS 19.5 (GOBLIN) [id:10644383] | Jaime Jaquez OVER RA 7.5 (GOBLIN) [id:10650536] | Tristan Silva UNDER PA 12.5 (STANDARD) [id:10648740] | Quentin Grimes UNDER PTS 20.5 (STANDARD) [id:10644625],0.05863788605045995,20.0,1.0,20.0,1.172757721009199,20.0,atlas,0.5709700333193163,0.04159391435521126,Davion Mitchell OVER PRA 14.5 (GOBLIN) [id:10644489] | Norman Powell OVER PTS 19.5 (GOBLIN) [id:10644383] | Jaime Jaquez OVER RA 7.5 (GOBLIN) [id:10650536] | Tristan Silva UNDER PA 12.5 (STANDARD) [id:10648740] | Quentin Grimes UNDER PTS 20.5 (STANDARD) [id:10644625],0.0,0.0,0.0,0.0,0.0,0,0.0,1.172757721009199,"['davion mitchell', 'norman powell', 'jaime jaquez', 'tristan silva', 'quentin grimes']",1.172757721009199,1,Davion Mitchell OVER PRA 14.5 (GOBLIN) [id:10644489],Norman Powell OVER PTS 19.5 (GOBLIN) [id:10644383],Jaime Jaquez OVER RA 7.5 (GOBLIN) [id:10650536],Tristan Silva UNDER PA 12.5 (STANDARD) [id:10648740],Quentin Grimes UNDER PTS 20.5 (STANDARD) [id:10644625],0,
5,Kon Knueppel OVER PR 19.5 (GOBLIN) [id:10644514] | Ayo Dosunmu OVER PTS 11.5 (GOBLIN) [id:10652117] | Collin Gillespie OVER PTS 8.5 (GOBLIN) [id:10650223] | Brandon Miller UNDER REB 5.5 (STANDARD) [id:10655096] | Tristan Silva UNDER PTS 10.5 (STANDARD) [id:10645979],0.05845534144172177,20.0,1.0,20.0,1.1691068288344355,20.0,atlas,0.5723089394576959,0.03540286447007404,Kon Knueppel OVER PR 19.5 (GOBLIN) [id:10644514] | Ayo Dosunmu OVER PTS 11.5 (GOBLIN) [id:10652117] | Collin Gillespie OVER PTS 8.5 (GOBLIN) [id:10650223] | Brandon Miller UNDER REB 5.5 (STANDARD) [id:10655096] | Tristan Silva UNDER PTS 10.5 (STANDARD) [id:10645979],0.0,0.0,0.0,0.0,0.0,0,0.0,1.1691068288344355,"['kon knueppel', 'ayo dosunmu', 'collin gillespie', 'brandon miller', 'tristan silva']",1.1691068288344355,1,Kon Knueppel OVER PR 19.5 (GOBLIN) [id:10644514],Ayo Dosunmu OVER PTS 11.5 (GOBLIN) [id:10652117],Collin Gillespie OVER PTS 8.5 (GOBLIN) [id:10650223],Brandon Miller UNDER REB 5.5 (STANDARD) [id:10655096],Tristan Silva UNDER PTS 10.5 (STANDARD) [id:10645979],0,
5,Naz Reid OVER PTS 11.5 (GOBLIN) [id:10652123] | Jaime Jaquez OVER PA 17.5 (GOBLIN) [id:10654220] | Donte DiVincenzo OVER RA 7.5 (GOBLIN) [id:10649247] | LaMelo Ball OVER PRA 32.5 (STANDARD) [id:10644003] | Tristan Silva UNDER PTS 10.5 (STANDARD) [id:10645979],0.057129498129510306,20.0,1.0,20.0,1.142589962590206,20.0,atlas,0.5698336874571197,0.058999077898642636,Naz Reid OVER PTS 11.5 (GOBLIN) [id:10652123] | Jaime Jaquez OVER PA 17.5 (GOBLIN) [id:10654220] | Donte DiVincenzo OVER RA 7.5 (GOBLIN) [id:10649247] | LaMelo Ball OVER PRA 32.5 (STANDARD) [id:10644003] | Tristan Silva UNDER PTS 10.5 (STANDARD) [id:10645979],0.0,0.0,0.0,0.0,0.0,0,0.0,1.142589962590206,"['naz reid', 'jaime jaquez', 'donte divincenzo', 'lamelo ball', 'tristan silva']",1.142589962590206,1,Naz Reid OVER PTS 11.5 (GOBLIN) [id:10652123],Jaime Jaquez OVER PA 17.5 (GOBLIN) [id:10654220],Donte DiVincenzo OVER RA 7.5 (GOBLIN) [id:10649247],LaMelo Ball OVER PRA 32.5 (STANDARD) [id:10644003],Tristan Silva UNDER PTS 10.5 (STANDARD) [id:10645979],0,
5,Ryan Kalkbrenner OVER PTS 4.5 (GOBLIN) [id:10649753] | Davion Mitchell OVER PA 11.5 (GOBLIN) [id:10650767] | Jaime Jaquez OVER PR 14.5 (GOBLIN) [id:10644503] | Brandon Miller OVER PR 26.5 (STANDARD) [id:10643828] | Tristan Silva UNDER PRA 17.5 (STANDARD) [id:10648741],0.056433680809059944,20.0,1.0,20.0,1.128673616181199,20.0,atlas,0.5668380701682967,0.058790511721294236,Ryan Kalkbrenner OVER PTS 4.5 (GOBLIN) [id:10649753] | Davion Mitchell OVER PA 11.5 (GOBLIN) [id:10650767] | Jaime Jaquez OVER PR 14.5 (GOBLIN) [id:10644503] | Brandon Miller OVER PR 26.5 (STANDARD) [id:10643828] | Tristan Silva UNDER PRA 17.5 (STANDARD) [id:10648741],0.0,0.0,0.0,0.0,0.0,0,0.0,1.128673616181199,"['ryan kalkbrenner', 'davion mitchell', 'jaime jaquez', 'brandon miller', 'tristan silva']",1.128673616181199,1,Ryan Kalkbrenner OVER PTS 4.5 (GOBLIN) [id:10649753],Davion Mitchell OVER PA 11.5 (GOBLIN) [id:10650767],Jaime Jaquez OVER PR 14.5 (GOBLIN) [id:10644503],Brandon Miller OVER PR 26.5 (STANDARD) [id:10643828],Tristan Silva UNDER PRA 17.5 (STANDARD) [id:10648741],0,
5,Jaime Jaquez OVER PA 14.5 (GOBLIN) [id:10644501] | Norman Powell OVER PRA 24.5 (GOBLIN) [id:10644562] | Brandon Miller OVER PRA 26.5 (GOBLIN) [id:10645572] | Kel'el Ware UNDER REB 10.5 (STANDARD) [id:10650505] | Jett Howard UNDER PA 6.5 (STANDARD) [id:10648860],0.05561103330243355,20.0,1.0,20.0,1.1122206660486709,20.0,atlas,0.5626795800965162,0.04842121819484193,Jaime Jaquez OVER PA 14.5 (GOBLIN) [id:10644501] | Norman Powell OVER PRA 24.5 (GOBLIN) [id:10644562] | Brandon Miller OVER PRA 26.5 (GOBLIN) [id:10645572] | Kel'el Ware UNDER REB 10.5 (STANDARD) [id:10650505] | Jett Howard UNDER PA 6.5 (STANDARD) [id:10648860],0.0,0.0,0.0,0.0,0.0,0,0.0,1.1122206660486709,"['jaime jaquez', 'norman powell', 'brandon miller', ""kel'el ware"", 'jett howard']",1.1122206660486709,1,Jaime Jaquez OVER PA 14.5 (GOBLIN) [id:10644501],Norman Powell OVER PRA 24.5 (GOBLIN) [id:10644562],Brandon Miller OVER PRA 26.5 (GOBLIN) [id:10645572],Kel'el Ware UNDER REB 10.5 (STANDARD) [id:10650505],Jett Howard UNDER PA 6.5 (STANDARD) [id:10648860],0,
5,Tyler Herro OVER PA 19.5 (GOBLIN) [id:10652729] | Devin Booker OVER PA 29.5 (GOBLIN) [id:10652322] | Coby White OVER PRA 17.5 (GOBLIN) [id:10645581] | Kel'el Ware UNDER RA 11.5 (STANDARD) [id:10653551] | Shai Gilgeous-Alexander UNDER PRA 43.5 (STANDARD) [id:10645030],0.055361592194534126,20.0,1.0,20.0,1.1072318438906825,20.0,atlas,0.5617982911744936,0.04749937440586671,Tyler Herro OVER PA 19.5 (GOBLIN) [id:10652729] | Devin Booker OVER PA 29.5 (GOBLIN) [id:10652322] | Coby White OVER PRA 17.5 (GOBLIN) [id:10645581] | Kel'el Ware UNDER RA 11.5 (STANDARD) [id:10653551] | Shai Gilgeous-Alexander UNDER PRA 43.5 (STANDARD) [id:10645030],0.0,0.0,0.0,0.0,0.0,0,0.0,1.1072318438906825,"['tyler herro', 'devin booker', 'coby white', ""kel'el ware"", 'shai gilgeous-alexander']",1.1072318438906825,1,Tyler Herro OVER PA 19.5 (GOBLIN) [id:10652729],Devin Booker OVER PA 29.5 (GOBLIN) [id:10652322],Coby White OVER PRA 17.5 (GOBLIN) [id:10645581],Kel'el Ware UNDER RA 11.5 (STANDARD) [id:10653551],Shai Gilgeous-Alexander UNDER PRA 43.5 (STANDARD) [id:10645030],0,
5,Norman Powell OVER PR 19.5 (GOBLIN) [id:10644559] | Bam Adebayo OVER PRA 29.5 (GOBLIN) [id:10644451] | Miles Bridges OVER PA 14.5 (GOBLIN) [id:10644536] | Kel'el Ware UNDER PR 22.5 (STANDARD) [id:10650504] | De'Aaron Fox UNDER PR 22.5 (STANDARD) [id:10649863],0.05202520834664079,20.0,1.0,20.0,1.0405041669328159,20.0,atlas,0.5545351502388941,0.04846673258252459,Norman Powell OVER PR 19.5 (GOBLIN) [id:10644559] | Bam Adebayo OVER PRA 29.5 (GOBLIN) [id:10644451] | Miles Bridges OVER PA 14.5 (GOBLIN) [id:10644536] | Kel'el Ware UNDER PR 22.5 (STANDARD) [id:10650504] | De'Aaron Fox UNDER PR 22.5 (STANDARD) [id:10649863],0.0,0.0,0.0,0.0,0.0,0,0.0,1.0405041669328159,"['norman powell', 'bam adebayo', 'miles bridges', ""kel'el ware"", ""de'aaron fox""]",1.0405041669328159,1,Norman Powell OVER PR 19.5 (GOBLIN) [id:10644559],Bam Adebayo OVER PRA 29.5 (GOBLIN) [id:10644451],Miles Bridges OVER PA 14.5 (GOBLIN) [id:10644536],Kel'el Ware UNDER PR 22.5 (STANDARD) [id:10650504],De'Aaron Fox UNDER PR 22.5 (STANDARD) [id:10649863],0,
5,Davion Mitchell OVER PR 7.5 (GOBLIN) [id:10650527] | Devin Booker OVER PRA 29.5 (GOBLIN) [id:10652479] | Grant Williams OVER PRA 8.5 (GOBLIN) [id:10645596] | Nikola Jokić UNDER PRA 53 (STANDARD) [id:10644622] | Moussa Diabaté UNDER PR 19 (STANDARD) [id:10644055],0.050617689260095466,20.0,1.0,20.0,1.0123537852019093,20.0,atlas,0.5523108881267887,0.04840550050699288,Davion Mitchell OVER PR 7.5 (GOBLIN) [id:10650527] | Devin Booker OVER PRA 29.5 (GOBLIN) [id:10652479] | Grant Williams OVER PRA 8.5 (GOBLIN) [id:10645596] | Nikola Jokić UNDER PRA 53 (STANDARD) [id:10644622] | Moussa Diabaté UNDER PR 19 (STANDARD) [id:10644055],0.0,0.0,0.0,0.0,0.0,0,0.0,1.0123537852019093,"['davion mitchell', 'devin booker', 'grant williams', 'nikola jokić', 'moussa diabaté']",1.0123537852019093,1,Davion Mitchell OVER PR 7.5 (GOBLIN) [id:10650527],Devin Booker OVER PRA 29.5 (GOBLIN) [id:10652479],Grant Williams OVER PRA 8.5 (GOBLIN) [id:10645596],Nikola Jokić UNDER PRA 53 (STANDARD) [id:10644622],Moussa Diabaté UNDER PR 19 (STANDARD) [id:10644055],0,
5,Grant Williams OVER PA 4.5 (GOBLIN) [id:10644493] | Rudy Gobert OVER REB 9.5 (GOBLIN) [id:10652125] | Coby White OVER PRA 17.5 (GOBLIN) [id:10645581] | Moussa Diabaté UNDER PRA 20.5 (STANDARD) [id:10644056] | Jaime Jaquez OVER PTS 14 (STANDARD) [id:10643937],0.05048824979908835,20.0,1.0,20.0,1.009764995981767,20.0,atlas,0.5516746945331616,0.05047073216727921,Grant Williams OVER PA 4.5 (GOBLIN) [id:10644493] | Rudy Gobert OVER REB 9.5 (GOBLIN) [id:10652125] | Coby White OVER PRA 17.5 (GOBLIN) [id:10645581] | Moussa Diabaté UNDER PRA 20.5 (STANDARD) [id:10644056] | Jaime Jaquez OVER PTS 14 (STANDARD) [id:10643937],0.0,0.0,0.0,0.0,0.0,0,0.0,1.009764995981767,"['grant williams', 'rudy gobert', 'coby white', 'moussa diabaté', 'jaime jaquez']",1.009764995981767,1,Grant Williams OVER PA 4.5 (GOBLIN) [id:10644493],Rudy Gobert OVER REB 9.5 (GOBLIN) [id:10652125],Coby White OVER PRA 17.5 (GOBLIN) [id:10645581],Moussa Diabaté UNDER PRA 20.5 (STANDARD) [id:10644056],Jaime Jaquez OVER PTS 14 (STANDARD) [id:10643937],0,
5,Grant Williams OVER PR 8.5 (GOBLIN) [id:10652259] | Davion Mitchell OVER PTS 4.5 (GOBLIN) [id:10643884] | Kon Knueppel OVER PR 23.5 (GOBLIN) [id:10652260] | Moussa Diabaté UNDER PR 19 (STANDARD) [id:10644055] | Jordan Goodwin OVER PTS 5.5 (STANDARD) [id:10652151],0.05026598091039176,20.0,1.0,20.0,1.0053196182078352,20.0,atlas,0.5515910710868424,0.05164610913421393,Grant Williams OVER PR 8.5 (GOBLIN) [id:10652259] | Davion Mitchell OVER PTS 4.5 (GOBLIN) [id:10643884] | Kon Knueppel OVER PR 23.5 (GOBLIN) [id:10652260] | Moussa Diabaté UNDER PR 19 (STANDARD) [id:10644055] | Jordan Goodwin OVER PTS 5.5 (STANDARD) [id:10652151],0.0,0.0,0.0,0.0,0.0,0,0.0,1.0053196182078352,"['grant williams', 'davion mitchell', 'kon knueppel', 'moussa diabaté', 'jordan goodwin']",1.0053196182078352,1,Grant Williams OVER PR 8.5 (GOBLIN) [id:10652259],Davion Mitchell OVER PTS 4.5 (GOBLIN) [id:10643884],Kon Knueppel OVER PR 23.5 (GOBLIN) [id:10652260],Moussa Diabaté UNDER PR 19 (STANDARD) [id:10644055],Jordan Goodwin OVER PTS 5.5 (STANDARD) [id:10652151],0,
5,Coby White OVER AST 2.5 (GOBLIN) [id:10643844] | Ayo Dosunmu OVER PRA 19.5 (GOBLIN) [id:10652198] | Jaylon Tyson OVER PTS 5.5 (GOBLIN) [id:10652642] | Trendon Watford UNDER REB 3.5 (STANDARD) [id:10644896] | Moussa Diabaté UNDER PA 10.5 (STANDARD) [id:10644054],0.049217080143370465,20.0,1.0,20.0,0.9843416028674092,20.0,atlas,0.5488408688310915,0.04539955739534081,Coby White OVER AST 2.5 (GOBLIN) [id:10643844] | Ayo Dosunmu OVER PRA 19.5 (GOBLIN) [id:10652198] | Jaylon Tyson OVER PTS 5.5 (GOBLIN) [id:10652642] | Trendon Watford UNDER REB 3.5 (STANDARD) [id:10644896] | Moussa Diabaté UNDER PA 10.5 (STANDARD) [id:10644054],0.0,0.0,0.0,0.0,0.0,0,0.0,0.9843416028674092,"['coby white', 'ayo dosunmu', 'jaylon tyson', 'trendon watford', 'moussa diabaté']",0.9843416028674092,1,Coby White OVER AST 2.5 (GOBLIN) [id:10643844],Ayo Dosunmu OVER PRA 19.5 (GOBLIN) [id:10652198],Jaylon Tyson OVER PTS 5.5 (GOBLIN) [id:10652642],Trendon Watford UNDER REB 3.5 (STANDARD) [id:10644896],Moussa Diabaté UNDER PA 10.5 (STANDARD) [id:10644054],0,
5,Devin Booker OVER PRA 33.5 (GOBLIN) [id:10649197] | Kon Knueppel OVER PA 19.5 (GOBLIN) [id:10644511] | Ryan Kalkbrenner OVER REB 2.5 (GOBLIN) [id:10644583] | De'Aaron Fox UNDER RA 10.5 (STANDARD) [id:10649865] | Trendon Watford UNDER PRA 16.5 (STANDARD) [id:10644893],0.048451998605130026,20.0,1.0,20.0,0.9690399721026005,20.0,atlas,0.5461050407421465,0.041267023691427755,Devin Booker OVER PRA 33.5 (GOBLIN) [id:10649197] | Kon Knueppel OVER PA 19.5 (GOBLIN) [id:10644511] | Ryan Kalkbrenner OVER REB 2.5 (GOBLIN) [id:10644583] | De'Aaron Fox UNDER RA 10.5 (STANDARD) [id:10649865] | Trendon Watford UNDER PRA 16.5 (STANDARD) [id:10644893],0.0,0.0,0.0,0.0,0.0,0,0.0,0.9690399721026005,"['devin booker', 'kon knueppel', 'ryan kalkbrenner', ""de'aaron fox"", 'trendon watford']",0.9690399721026005,1,Devin Booker OVER PRA 33.5 (GOBLIN) [id:10649197],Kon Knueppel OVER PA 19.5 (GOBLIN) [id:10644511],Ryan Kalkbrenner OVER REB 2.5 (GOBLIN) [id:10644583],De'Aaron Fox UNDER RA 10.5 (STANDARD) [id:10649865],Trendon Watford UNDER PRA 16.5 (STANDARD) [id:10644893],0,
5,LaMelo Ball OVER PTS 16.5 (GOBLIN) [id:10646664] | Ayo Dosunmu OVER PTS 13.5 (GOBLIN) [id:10649099] | Brandon Miller OVER PRA 27.5 (GOBLIN) [id:10645677] | Grayson Allen OVER PTS 13.5 (STANDARD) [id:10649268] | Moussa Diabaté UNDER PA 10.5 (STANDARD) [id:10644054],0.04836309677235929,20.0,1.0,20.0,0.9672619354471858,20.0,atlas,0.5468278036742138,0.04605216246404265,LaMelo Ball OVER PTS 16.5 (GOBLIN) [id:10646664] | Ayo Dosunmu OVER PTS 13.5 (GOBLIN) [id:10649099] | Brandon Miller OVER PRA 27.5 (GOBLIN) [id:10645677] | Grayson Allen OVER PTS 13.5 (STANDARD) [id:10649268] | Moussa Diabaté UNDER PA 10.5 (STANDARD) [id:10644054],0.0,0.0,0.0,0.0,0.0,0,0.0,0.9672619354471858,"['lamelo ball', 'ayo dosunmu', 'brandon miller', 'grayson allen', 'moussa diabaté']",0.9672619354471858,1,LaMelo Ball OVER PTS 16.5 (GOBLIN) [id:10646664],Ayo Dosunmu OVER PTS 13.5 (GOBLIN) [id:10649099],Brandon Miller OVER PRA 27.5 (GOBLIN) [id:10645677],Grayson Allen OVER PTS 13.5 (STANDARD) [id:10649268],Moussa Diabaté UNDER PA 10.5 (STANDARD) [id:10644054],0,
5,Coby White OVER PR 14.5 (GOBLIN) [id:10644474] | Norman Powell OVER PTS 14.5 (GOBLIN) [id:10644080] | Devin Booker OVER PRA 33.5 (GOBLIN) [id:10649197] | Jett Howard UNDER PRA 9 (STANDARD) [id:10648866] | Ryan Kalkbrenner UNDER AST 0.5 (STANDARD) [id:10644123],0.047550836854042294,20.0,1.0,20.0,0.9510167370808459,20.0,atlas,0.5445978874177824,0.04158903349482727,Coby White OVER PR 14.5 (GOBLIN) [id:10644474] | Norman Powell OVER PTS 14.5 (GOBLIN) [id:10644080] | Devin Booker OVER PRA 33.5 (GOBLIN) [id:10649197] | Jett Howard UNDER PRA 9 (STANDARD) [id:10648866] | Ryan Kalkbrenner UNDER AST 0.5 (STANDARD) [id:10644123],0.0,0.0,0.0,0.0,0.0,0,0.0,0.9510167370808459,"['coby white', 'norman powell', 'devin booker', 'jett howard', 'ryan kalkbrenner']",0.9510167370808459,1,Coby White OVER PR 14.5 (GOBLIN) [id:10644474],Norman Powell OVER PTS 14.5 (GOBLIN) [id:10644080],Devin Booker OVER PRA 33.5 (GOBLIN) [id:10649197],Jett Howard UNDER PRA 9 (STANDARD) [id:10648866],Ryan Kalkbrenner UNDER AST 0.5 (STANDARD) [id:10644123],0,
5,Ayo Dosunmu OVER PR 14.5 (GOBLIN) [id:10652195] | Devin Booker OVER PA 29.5 (GOBLIN) [id:10652322] | Tyler Herro OVER PTS 18.5 (GOBLIN) [id:10652268] | Trendon Watford UNDER PA 12.5 (STANDARD) [id:10644891] | LaMelo Ball OVER PRA 32.5 (STANDARD) [id:10644003],0.046871068035965614,20.0,1.0,20.0,0.9374213607193123,20.0,atlas,0.5425641409622703,0.057825353239267775,Ayo Dosunmu OVER PR 14.5 (GOBLIN) [id:10652195] | Devin Booker OVER PA 29.5 (GOBLIN) [id:10652322] | Tyler Herro OVER PTS 18.5 (GOBLIN) [id:10652268] | Trendon Watford UNDER PA 12.5 (STANDARD) [id:10644891] | LaMelo Ball OVER PRA 32.5 (STANDARD) [id:10644003],0.0,0.0,0.0,0.0,0.0,0,0.0,0.9374213607193123,"['ayo dosunmu', 'devin booker', 'tyler herro', 'trendon watford', 'lamelo ball']",0.9374213607193123,1,Ayo Dosunmu OVER PR 14.5 (GOBLIN) [id:10652195],Devin Booker OVER PA 29.5 (GOBLIN) [id:10652322],Tyler Herro OVER PTS 18.5 (GOBLIN) [id:10652268],Trendon Watford UNDER PA 12.5 (STANDARD) [id:10644891],LaMelo Ball OVER PRA 32.5 (STANDARD) [id:10644003],0,
5,Coby White OVER PRA 17.5 (GOBLIN) [id:10645581] | Miles Bridges OVER PRA 22.5 (GOBLIN) [id:10645714] | Brandon Miller OVER PTS 18.5 (GOBLIN) [id:10645676] | De'Aaron Fox UNDER PA 25.5 (STANDARD) [id:10649987] | Nikola Jokić UNDER PTS 28.5 (STANDARD) [id:10644402],0.04663258383752429,20.0,1.0,20.0,0.9326516767504858,20.0,atlas,0.5419286164021683,0.041380818820252976,Coby White OVER PRA 17.5 (GOBLIN) [id:10645581] | Miles Bridges OVER PRA 22.5 (GOBLIN) [id:10645714] | Brandon Miller OVER PTS 18.5 (GOBLIN) [id:10645676] | De'Aaron Fox UNDER PA 25.5 (STANDARD) [id:10649987] | Nikola Jokić UNDER PTS 28.5 (STANDARD) [id:10644402],0.0,0.0,0.0,0.0,0.0,0,0.0,0.9326516767504858,"['coby white', 'miles bridges', 'brandon miller', ""de'aaron fox"", 'nikola jokić']",0.9326516767504858,1,Coby White OVER PRA 17.5 (GOBLIN) [id:10645581],Miles Bridges OVER PRA 22.5 (GOBLIN) [id:10645714],Brandon Miller OVER PTS 18.5 (GOBLIN) [id:10645676],De'Aaron Fox UNDER PA 25.5 (STANDARD) [id:10649987],Nikola Jokić UNDER PTS 28.5 (STANDARD) [id:10644402],0,
5,Tyler Herro OVER PTS 19.5 (GOBLIN) [id:10644160] | LaMelo Ball OVER PRA 28.5 (GOBLIN) [id:10645623] | Grayson Allen OVER PR 14.5 (GOBLIN) [id:10652207] | Shai Gilgeous-Alexander UNDER PTS 31.5 (STANDARD) [id:10645531] | Rudy Gobert OVER RA 14 (STANDARD) [id:10649562],0.045496173232025865,20.0,1.0,20.0,0.9099234646405173,20.0,atlas,0.5395555181765144,0.05838194516691768,Tyler Herro OVER PTS 19.5 (GOBLIN) [id:10644160] | LaMelo Ball OVER PRA 28.5 (GOBLIN) [id:10645623] | Grayson Allen OVER PR 14.5 (GOBLIN) [id:10652207] | Shai Gilgeous-Alexander UNDER PTS 31.5 (STANDARD) [id:10645531] | Rudy Gobert OVER RA 14 (STANDARD) [id:10649562],0.0,0.0,0.0,0.0,0.0,0,0.0,0.9099234646405173,"['tyler herro', 'lamelo ball', 'grayson allen', 'shai gilgeous-alexander', 'rudy gobert']",0.9099234646405173,1,Tyler Herro OVER PTS 19.5 (GOBLIN) [id:10644160],LaMelo Ball OVER PRA 28.5 (GOBLIN) [id:10645623],Grayson Allen OVER PR 14.5 (GOBLIN) [id:10652207],Shai Gilgeous-Alexander UNDER PTS 31.5 (STANDARD) [id:10645531],Rudy Gobert OVER RA 14 (STANDARD) [id:10649562],0,
5,LaMelo Ball OVER PA 19.5 (GOBLIN) [id:10646873] | Miles Bridges OVER PRA 22.5 (GOBLIN) [id:10645714] | Grayson Allen OVER PA 14.5 (GOBLIN) [id:10652204] | Ayo Dosunmu OVER PTS 15.5 (STANDARD) [id:10649095] | Jett Howard UNDER PA 6.5 (STANDARD) [id:10648860],0.04526658086941187,20.0,1.0,20.0,0.9053316173882374,20.0,atlas,0.5389943462871558,0.058647005803853444,LaMelo Ball OVER PA 19.5 (GOBLIN) [id:10646873] | Miles Bridges OVER PRA 22.5 (GOBLIN) [id:10645714] | Grayson Allen OVER PA 14.5 (GOBLIN) [id:10652204] | Ayo Dosunmu OVER PTS 15.5 (STANDARD) [id:10649095] | Jett Howard UNDER PA 6.5 (STANDARD) [id:10648860],0.0,0.0,0.0,0.0,0.0,0,0.0,0.9053316173882374,"['lamelo ball', 'miles bridges', 'grayson allen', 'ayo dosunmu', 'jett howard']",0.9053316173882374,1,LaMelo Ball OVER PA 19.5 (GOBLIN) [id:10646873],Miles Bridges OVER PRA 22.5 (GOBLIN) [id:10645714],Grayson Allen OVER PA 14.5 (GOBLIN) [id:10652204],Ayo Dosunmu OVER PTS 15.5 (STANDARD) [id:10649095],Jett Howard UNDER PA 6.5 (STANDARD) [id:10648860],0,
5,Ryan Kalkbrenner OVER PR 7.5 (GOBLIN) [id:10650594] | Tyler Herro OVER PTS 17.5 (GOBLIN) [id:10644585] | Grant Williams OVER PRA 8.5 (GOBLIN) [id:10645596] | Quentin Grimes UNDER PTS 20.5 (STANDARD) [id:10644625] | Oso Ighodaro OVER PA 9.5 (STANDARD) [id:10649470],0.0439694324552533,20.0,1.0,20.0,0.8793886491050661,20.0,atlas,0.5356769642611976,0.05896610903411294,Ryan Kalkbrenner OVER PR 7.5 (GOBLIN) [id:10650594] | Tyler Herro OVER PTS 17.5 (GOBLIN) [id:10644585] | Grant Williams OVER PRA 8.5 (GOBLIN) [id:10645596] | Quentin Grimes UNDER PTS 20.5 (STANDARD) [id:10644625] | Oso Ighodaro OVER PA 9.5 (STANDARD) [id:10649470],0.0,0.0,0.0,0.0,0.0,0,0.0,0.8793886491050661,"['ryan kalkbrenner', 'tyler herro', 'grant williams', 'quentin grimes', 'oso ighodaro']",0.8793886491050661,1,Ryan Kalkbrenner OVER PR 7.5 (GOBLIN) [id:10650594],Tyler Herro OVER PTS 17.5 (GOBLIN) [id:10644585],Grant Williams OVER PRA 8.5 (GOBLIN) [id:10645596],Quentin Grimes UNDER PTS 20.5 (STANDARD) [id:10644625],Oso Ighodaro OVER PA 9.5 (STANDARD) [id:10649470],0,
5,Bam Adebayo OVER PRA 29.5 (GOBLIN) [id:10644451] | Tyler Herro OVER PRA 28.5 (GOBLIN) [id:10652731] | Miles Bridges OVER PTS 14.5 (GOBLIN) [id:10644027] | Ryan Kalkbrenner OVER PR 10.5 (STANDARD) [id:10650365] | Kon Knueppel OVER PA 22.5 (STANDARD) [id:10643968],0.04129825032447849,20.0,1.0,20.0,0.8259650064895697,20.0,atlas,0.528690733991771,0.07452299292264812,Bam Adebayo OVER PRA 29.5 (GOBLIN) [id:10644451] | Tyler Herro OVER PRA 28.5 (GOBLIN) [id:10652731] | Miles Bridges OVER PTS 14.5 (GOBLIN) [id:10644027] | Ryan Kalkbrenner OVER PR 10.5 (STANDARD) [id:10650365] | Kon Knueppel OVER PA 22.5 (STANDARD) [id:10643968],0.0,0.0,0.0,0.0,0.0,0,0.0,0.8259650064895697,"['bam adebayo', 'tyler herro', 'miles bridges', 'ryan kalkbrenner', 'kon knueppel']",0.8259650064895697,1,Bam Adebayo OVER PRA 29.5 (GOBLIN) [id:10644451],Tyler Herro OVER PRA 28.5 (GOBLIN) [id:10652731],Miles Bridges OVER PTS 14.5 (GOBLIN) [id:10644027],Ryan Kalkbrenner OVER PR 10.5 (STANDARD) [id:10650365],Kon Knueppel OVER PA 22.5 (STANDARD) [id:10643968],0,
5,Ajay Mitchell OVER PTS 9.5 (GOBLIN) [id:10644948] | Jaylon Tyson OVER PTS 5.5 (GOBLIN) [id:10652642] | Oso Ighodaro OVER PR 9.5 (GOBLIN) [id:10652494] | Bam Adebayo OVER RA 12.5 (STANDARD) [id:10650494] | De'Aaron Fox UNDER RA 10.5 (STANDARD) [id:10649865],0.04122214960929539,20.0,1.0,20.0,0.8244429921859078,20.0,atlas,0.5287068373662983,0.07050497603510339,Ajay Mitchell OVER PTS 9.5 (GOBLIN) [id:10644948] | Jaylon Tyson OVER PTS 5.5 (GOBLIN) [id:10652642] | Oso Ighodaro OVER PR 9.5 (GOBLIN) [id:10652494] | Bam Adebayo OVER RA 12.5 (STANDARD) [id:10650494] | De'Aaron Fox UNDER RA 10.5 (STANDARD) [id:10649865],0.0,0.0,0.0,0.0,0.0,0,0.0,0.8244429921859078,"['ajay mitchell', 'jaylon tyson', 'oso ighodaro', 'bam adebayo', ""de'aaron fox""]",0.8244429921859078,1,Ajay Mitchell OVER PTS 9.5 (GOBLIN) [id:10644948],Jaylon Tyson OVER PTS 5.5 (GOBLIN) [id:10652642],Oso Ighodaro OVER PR 9.5 (GOBLIN) [id:10652494],Bam Adebayo OVER RA 12.5 (STANDARD) [id:10650494],De'Aaron Fox UNDER RA 10.5 (STANDARD) [id:10649865],0,
5,Jordan Goodwin OVER PTS 4.5 (GOBLIN) [id:10652150] | Naz Reid OVER REB 5.5 (GOBLIN) [id:10649440] | Miles Bridges OVER PTS 11.5 (GOBLIN) [id:10644534] | Bam Adebayo OVER REB 9.5 (STANDARD) [id:10653980] | Thomas Bryant OVER PTS 6.5 (STANDARD) [id:10653223],0.039610542529877085,20.0,1.0,20.0,0.7922108505975417,20.0,atlas,0.5245222868625423,0.05814397393335717,Jordan Goodwin OVER PTS 4.5 (GOBLIN) [id:10652150] | Naz Reid OVER REB 5.5 (GOBLIN) [id:10649440] | Miles Bridges OVER PTS 11.5 (GOBLIN) [id:10644534] | Bam Adebayo OVER REB 9.5 (STANDARD) [id:10653980] | Thomas Bryant OVER PTS 6.5 (STANDARD) [id:10653223],0.0,0.0,0.0,0.0,0.0,0,0.0,0.7922108505975417,"['jordan goodwin', 'naz reid', 'miles bridges', 'bam adebayo', 'thomas bryant']",0.7922108505975417,1,Jordan Goodwin OVER PTS 4.5 (GOBLIN) [id:10652150],Naz Reid OVER REB 5.5 (GOBLIN) [id:10649440],Miles Bridges OVER PTS 11.5 (GOBLIN) [id:10644534],Bam Adebayo OVER REB 9.5 (STANDARD) [id:10653980],Thomas Bryant OVER PTS 6.5 (STANDARD) [id:10653223],0,
5,Kon Knueppel OVER PRA 25.5 (GOBLIN) [id:10645615] | Collin Gillespie OVER PR 11.5 (GOBLIN) [id:10652478] | Grayson Allen OVER PRA 19.5 (GOBLIN) [id:10650232] | Naz Reid OVER PTS 15.5 (STANDARD) [id:10649422] | Nikola Jokić UNDER PRA 53 (STANDARD) [id:10644622],0.03925540360465272,20.0,1.0,20.0,0.7851080720930543,20.0,atlas,0.523498611814626,0.05802315383915171,Kon Knueppel OVER PRA 25.5 (GOBLIN) [id:10645615] | Collin Gillespie OVER PR 11.5 (GOBLIN) [id:10652478] | Grayson Allen OVER PRA 19.5 (GOBLIN) [id:10650232] | Naz Reid OVER PTS 15.5 (STANDARD) [id:10649422] | Nikola Jokić UNDER PRA 53 (STANDARD) [id:10644622],0.0,0.0,0.0,0.0,0.0,0,0.0,0.7851080720930543,"['kon knueppel', 'collin gillespie', 'grayson allen', 'naz reid', 'nikola jokić']",0.7851080720930543,1,Kon Knueppel OVER PRA 25.5 (GOBLIN) [id:10645615],Collin Gillespie OVER PR 11.5 (GOBLIN) [id:10652478],Grayson Allen OVER PRA 19.5 (GOBLIN) [id:10650232],Naz Reid OVER PTS 15.5 (STANDARD) [id:10649422],Nikola Jokić UNDER PRA 53 (STANDARD) [id:10644622],0,
