n_legs,legs,hit_prob,ev_mult,avg_p,avg_fragility,slip_key,leg_1,leg_2,leg_3,leg_4
4,Donovan Clingan OVER RA 11.5 (GOBLIN) [id:9812132] | Ty Jerome OVER RA 6.5 (STANDARD) [id:9804329] | Tim Hardaway OVER PR 15.5 (STANDARD) [id:9796353] | Scoot Henderson OVER RA 7.5 (DEMON) [id:9801396],0.2536679963302444,2.536679963302444,0.7253539292141572,0.0,Donovan Clingan OVER RA 11.5 (GOBLIN) [id:9812132] | Ty Jerome OVER RA 6.5 (STANDARD) [id:9804329] | Tim Hardaway OVER PR 15.5 (STANDARD) [id:9796353] | Scoot Henderson OVER RA 7.5 (DEMON) [id:9801396],Donovan Clingan OVER RA 11.5 (GOBLIN) [id:9812132],Ty Jerome OVER RA 6.5 (STANDARD) [id:9804329],Tim Hardaway OVER PR 15.5 (STANDARD) [id:9796353],Scoot Henderson OVER RA 7.5 (DEMON) [id:9801396]
4,Toumani Camara OVER PA 11.5 (GOBLIN) [id:9802560] | Max Christie OVER PTS 12.5 (STANDARD) [id:9817275] | Al Horford UNDER RA 8.5 (STANDARD) [id:9808522] | Scoot Henderson OVER AST 6.5 (DEMON) [id:9801380],0.2463486563096164,2.463486563096164,0.7213422315536893,0.0012594458438287195,Toumani Camara OVER PA 11.5 (GOBLIN) [id:9802560] | Max Christie OVER PTS 12.5 (STANDARD) [id:9817275] | Al Horford UNDER RA 8.5 (STANDARD) [id:9808522] | Scoot Henderson OVER AST 6.5 (DEMON) [id:9801380],Toumani Camara OVER PA 11.5 (GOBLIN) [id:9802560],Max Christie OVER PTS 12.5 (STANDARD) [id:9817275],Al Horford UNDER RA 8.5 (STANDARD) [id:9808522],Scoot Henderson OVER AST 6.5 (DEMON) [id:9801380]
4,Austin Reaves OVER RA 5.5 (GOBLIN) [id:9818692] | Devin Booker OVER PTS 22.5 (STANDARD) [id:9818255] | Pat Spencer UNDER PTS 13.5 (STANDARD) [id:9797299] | Landry Shamet OVER PTS 9.5 (DEMON) [id:9817156],0.24580394840967157,2.458039484096716,0.7239677064587083,0.00142872261614985,Austin Reaves OVER RA 5.5 (GOBLIN) [id:9818692] | Devin Booker OVER PTS 22.5 (STANDARD) [id:9818255] | Pat Spencer UNDER PTS 13.5 (STANDARD) [id:9797299] | Landry Shamet OVER PTS 9.5 (DEMON) [id:9817156],Austin Reaves OVER RA 5.5 (GOBLIN) [id:9818692],Devin Booker OVER PTS 22.5 (STANDARD) [id:9818255],Pat Spencer UNDER PTS 13.5 (STANDARD) [id:9797299],Landry Shamet OVER PTS 9.5 (DEMON) [id:9817156]
4,Cam Spencer OVER AST 3.5 (GOBLIN) [id:9803485] | Tim Hardaway OVER PTS 12.5 (STANDARD) [id:9796347] | Kevin Durant OVER PRA 32.5 (STANDARD) [id:9817039] | Dillon Brooks OVER FG3M 2.5 (DEMON) [id:9817601],0.2001016109905488,2.001016109905488,0.6830133973205359,0.0,Cam Spencer OVER AST 3.5 (GOBLIN) [id:9803485] | Tim Hardaway OVER PTS 12.5 (STANDARD) [id:9796347] | Kevin Durant OVER PRA 32.5 (STANDARD) [id:9817039] | Dillon Brooks OVER FG3M 2.5 (DEMON) [id:9817601],Cam Spencer OVER AST 3.5 (GOBLIN) [id:9803485],Tim Hardaway OVER PTS 12.5 (STANDARD) [id:9796347],Kevin Durant OVER PRA 32.5 (STANDARD) [id:9817039],Dillon Brooks OVER FG3M 2.5 (DEMON) [id:9817601]
4,LeBron James OVER RA 10.5 (GOBLIN) [id:9813821] | Collin Gillespie OVER PTS 11.5 (STANDARD) [id:9817195] | Scotty Pippen OVER PTS 9.5 (STANDARD) [id:9803899] | Max Christie OVER RA 6.5 (DEMON) [id:9817279],0.19220494074599478,1.922049407459948,0.6957918416316737,0.0,LeBron James OVER RA 10.5 (GOBLIN) [id:9813821] | Collin Gillespie OVER PTS 11.5 (STANDARD) [id:9817195] | Scotty Pippen OVER PTS 9.5 (STANDARD) [id:9803899] | Max Christie OVER RA 6.5 (DEMON) [id:9817279],LeBron James OVER RA 10.5 (GOBLIN) [id:9813821],Collin Gillespie OVER PTS 11.5 (STANDARD) [id:9817195],Scotty Pippen OVER PTS 9.5 (STANDARD) [id:9803899],Max Christie OVER RA 6.5 (DEMON) [id:9817279]
4,LeBron James OVER PTS 17.5 (GOBLIN) [id:9801805] | Scoot Henderson OVER PA 14.5 (STANDARD) [id:9801389] | Jrue Holiday OVER PA 19.5 (STANDARD) [id:9798547] | Jordan Goodwin OVER REB 5.5 (DEMON) [id:9817252],0.1873360068043058,1.8733600680430578,0.6983103379324135,0.0,LeBron James OVER PTS 17.5 (GOBLIN) [id:9801805] | Scoot Henderson OVER PA 14.5 (STANDARD) [id:9801389] | Jrue Holiday OVER PA 19.5 (STANDARD) [id:9798547] | Jordan Goodwin OVER REB 5.5 (DEMON) [id:9817252],LeBron James OVER PTS 17.5 (GOBLIN) [id:9801805],Scoot Henderson OVER PA 14.5 (STANDARD) [id:9801389],Jrue Holiday OVER PA 19.5 (STANDARD) [id:9798547],Jordan Goodwin OVER REB 5.5 (DEMON) [id:9817252]
4,Tim Hardaway OVER PR 13.5 (GOBLIN) [id:9818252] | Julian Strawther UNDER PR 14.5 (STANDARD) [id:9796233] | Kelly Oubre UNDER PA 16.5 (STANDARD) [id:9798564] | Cam Spencer OVER AST 6.5 (DEMON) [id:9805599],0.18187610690064024,1.8187610690064024,0.6600949810037993,0.003757464687283529,Tim Hardaway OVER PR 13.5 (GOBLIN) [id:9818252] | Julian Strawther UNDER PR 14.5 (STANDARD) [id:9796233] | Kelly Oubre UNDER PA 16.5 (STANDARD) [id:9798564] | Cam Spencer OVER AST 6.5 (DEMON) [id:9805599],Tim Hardaway OVER PR 13.5 (GOBLIN) [id:9818252],Julian Strawther UNDER PR 14.5 (STANDARD) [id:9796233],Kelly Oubre UNDER PA 16.5 (STANDARD) [id:9798564],Cam Spencer OVER AST 6.5 (DEMON) [id:9805599]
4,Isaiah Hartenstein OVER PR 13.5 (GOBLIN) [id:9813862] | Deni Avdija OVER PR 27.5 (STANDARD) [id:9798463] | Julian Champagnie OVER PTS 8.5 (STANDARD) [id:9818606] | Jordan Goodwin OVER REB 5.5 (DEMON) [id:9817252],0.17884204655920574,1.7884204655920575,0.6719156168766247,0.0,Isaiah Hartenstein OVER PR 13.5 (GOBLIN) [id:9813862] | Deni Avdija OVER PR 27.5 (STANDARD) [id:9798463] | Julian Champagnie OVER PTS 8.5 (STANDARD) [id:9818606] | Jordan Goodwin OVER REB 5.5 (DEMON) [id:9817252],Isaiah Hartenstein OVER PR 13.5 (GOBLIN) [id:9813862],Deni Avdija OVER PR 27.5 (STANDARD) [id:9798463],Julian Champagnie OVER PTS 8.5 (STANDARD) [id:9818606],Jordan Goodwin OVER REB 5.5 (DEMON) [id:9817252]
4,Ty Jerome OVER REB 1.5 (GOBLIN) [id:9804809] | Brook Lopez UNDER REB 4.5 (STANDARD) [id:9817175] | Royce O'Neale OVER RA 7.5 (STANDARD) [id:9817297] | Jonas Valančiūnas OVER PR 13.5 (DEMON) [id:9805860],0.167799222823138,1.67799222823138,0.6449315136972605,0.0022519921468991616,Ty Jerome OVER REB 1.5 (GOBLIN) [id:9804809] | Brook Lopez UNDER REB 4.5 (STANDARD) [id:9817175] | Royce O'Neale OVER RA 7.5 (STANDARD) [id:9817297] | Jonas Valančiūnas OVER PR 13.5 (DEMON) [id:9805860],Ty Jerome OVER REB 1.5 (GOBLIN) [id:9804809],Brook Lopez UNDER REB 4.5 (STANDARD) [id:9817175],Royce O'Neale OVER RA 7.5 (STANDARD) [id:9817297],Jonas Valančiūnas OVER PR 13.5 (DEMON) [id:9805860]
4,Cam Spencer OVER AST 3.5 (GOBLIN) [id:9803485] | Gui Santos UNDER PTS 12 (STANDARD) [id:9797249] | Caleb Martin UNDER PRA 11.5 (STANDARD) [id:9817443] | Jaylon Tyson OVER PRA 22.5 (DEMON) [id:9796196],0.1648503593554529,1.648503593554529,0.6589922015596881,0.001514967882680892,Cam Spencer OVER AST 3.5 (GOBLIN) [id:9803485] | Gui Santos UNDER PTS 12 (STANDARD) [id:9797249] | Caleb Martin UNDER PRA 11.5 (STANDARD) [id:9817443] | Jaylon Tyson OVER PRA 22.5 (DEMON) [id:9796196],Cam Spencer OVER AST 3.5 (GOBLIN) [id:9803485],Gui Santos UNDER PTS 12 (STANDARD) [id:9797249],Caleb Martin UNDER PRA 11.5 (STANDARD) [id:9817443],Jaylon Tyson OVER PRA 22.5 (DEMON) [id:9796196]
4,Al Horford OVER PTS 5.5 (GOBLIN) [id:9804796] | Deni Avdija OVER PA 26.5 (STANDARD) [id:9798462] | Olivier-Maxence Prosper UNDER PA 9.5 (STANDARD) [id:9814109] | Austin Reaves OVER PA 28.5 (DEMON) [id:9813850],0.16348222508140242,1.6348222508140242,0.6438937212557488,0.0,Al Horford OVER PTS 5.5 (GOBLIN) [id:9804796] | Deni Avdija OVER PA 26.5 (STANDARD) [id:9798462] | Olivier-Maxence Prosper UNDER PA 9.5 (STANDARD) [id:9814109] | Austin Reaves OVER PA 28.5 (DEMON) [id:9813850],Al Horford OVER PTS 5.5 (GOBLIN) [id:9804796],Deni Avdija OVER PA 26.5 (STANDARD) [id:9798462],Olivier-Maxence Prosper UNDER PA 9.5 (STANDARD) [id:9814109],Austin Reaves OVER PA 28.5 (DEMON) [id:9813850]
4,Scotty Pippen OVER PTS 7.5 (GOBLIN) [id:9804826] | Victor Wembanyama OVER PTS 22.5 (STANDARD) [id:9818644] | Toumani Camara OVER PR 17.5 (STANDARD) [id:9798584] | Donovan Clingan OVER PR 24.5 (DEMON) [id:9816007],0.16267342553304442,1.6267342553304442,0.6619286142771446,0.0,Scotty Pippen OVER PTS 7.5 (GOBLIN) [id:9804826] | Victor Wembanyama OVER PTS 22.5 (STANDARD) [id:9818644] | Toumani Camara OVER PR 17.5 (STANDARD) [id:9798584] | Donovan Clingan OVER PR 24.5 (DEMON) [id:9816007],Scotty Pippen OVER PTS 7.5 (GOBLIN) [id:9804826],Victor Wembanyama OVER PTS 22.5 (STANDARD) [id:9818644],Toumani Camara OVER PR 17.5 (STANDARD) [id:9798584],Donovan Clingan OVER PR 24.5 (DEMON) [id:9816007]
4,Luke Kennard OVER FG3M 0.5 (GOBLIN) [id:9800855] | Cam Spencer OVER PTS 11.5 (STANDARD) [id:9803453] | Julian Champagnie OVER PTS 8.5 (STANDARD) [id:9818606] | Deni Avdija OVER PRA 37.5 (DEMON) [id:9799255],0.16041963952897156,1.6041963952897156,0.6434460607878424,0.0,Luke Kennard OVER FG3M 0.5 (GOBLIN) [id:9800855] | Cam Spencer OVER PTS 11.5 (STANDARD) [id:9803453] | Julian Champagnie OVER PTS 8.5 (STANDARD) [id:9818606] | Deni Avdija OVER PRA 37.5 (DEMON) [id:9799255],Luke Kennard OVER FG3M 0.5 (GOBLIN) [id:9800855],Cam Spencer OVER PTS 11.5 (STANDARD) [id:9803453],Julian Champagnie OVER PTS 8.5 (STANDARD) [id:9818606],Deni Avdija OVER PRA 37.5 (DEMON) [id:9799255]
4,Pascal Siakam OVER REB 5.5 (GOBLIN) [id:9816667] | Al Horford UNDER PTS 9.5 (STANDARD) [id:9797152] | Scotty Pippen OVER PTS 9.5 (STANDARD) [id:9803899] | Jerami Grant OVER FG3M 2.5 (DEMON) [id:9798505],0.15771229010796944,1.5771229010796946,0.6614052189562089,0.0023940414967192646,Pascal Siakam OVER REB 5.5 (GOBLIN) [id:9816667] | Al Horford UNDER PTS 9.5 (STANDARD) [id:9797152] | Scotty Pippen OVER PTS 9.5 (STANDARD) [id:9803899] | Jerami Grant OVER FG3M 2.5 (DEMON) [id:9798505],Pascal Siakam OVER REB 5.5 (GOBLIN) [id:9816667],Al Horford UNDER PTS 9.5 (STANDARD) [id:9797152],Scotty Pippen OVER PTS 9.5 (STANDARD) [id:9803899],Jerami Grant OVER FG3M 2.5 (DEMON) [id:9798505]
4,James Harden OVER RA 10.5 (GOBLIN) [id:9802294] | Pat Spencer UNDER PR 18.5 (STANDARD) [id:9797301] | Toumani Camara OVER PTS 12.5 (STANDARD) [id:9798582] | Jaylon Tyson OVER PR 19.5 (DEMON) [id:9799208],0.15373059668463884,1.5373059668463884,0.6455693861227754,0.0014822657490735712,James Harden OVER RA 10.5 (GOBLIN) [id:9802294] | Pat Spencer UNDER PR 18.5 (STANDARD) [id:9797301] | Toumani Camara OVER PTS 12.5 (STANDARD) [id:9798582] | Jaylon Tyson OVER PR 19.5 (DEMON) [id:9799208],James Harden OVER RA 10.5 (GOBLIN) [id:9802294],Pat Spencer UNDER PR 18.5 (STANDARD) [id:9797301],Toumani Camara OVER PTS 12.5 (STANDARD) [id:9798582],Jaylon Tyson OVER PR 19.5 (DEMON) [id:9799208]
4,Jalen Williams OVER REB 2.5 (GOBLIN) [id:9803685] | Rui Hachimura UNDER PA 13.5 (STANDARD) [id:9803799] | Scoot Henderson OVER PA 14.5 (STANDARD) [id:9801389] | Marcus Smart OVER PR 16.5 (DEMON) [id:9813866],0.15234226870327688,1.523422687032769,0.6831148770245952,0.001047433787221278,Jalen Williams OVER REB 2.5 (GOBLIN) [id:9803685] | Rui Hachimura UNDER PA 13.5 (STANDARD) [id:9803799] | Scoot Henderson OVER PA 14.5 (STANDARD) [id:9801389] | Marcus Smart OVER PR 16.5 (DEMON) [id:9813866],Jalen Williams OVER REB 2.5 (GOBLIN) [id:9803685],Rui Hachimura UNDER PA 13.5 (STANDARD) [id:9803799],Scoot Henderson OVER PA 14.5 (STANDARD) [id:9801389],Marcus Smart OVER PR 16.5 (DEMON) [id:9813866]
4,Cameron Johnson OVER PRA 13.5 (GOBLIN) [id:9795913] | Kris Dunn UNDER PRA 16.5 (STANDARD) [id:9817590] | Julian Strawther UNDER PR 14.5 (STANDARD) [id:9796233] | Cedric Coward OVER PA 18.5 (DEMON) [id:9816521],0.15154715810887295,1.5154715810887296,0.6471095780843832,0.0028708019783498045,Cameron Johnson OVER PRA 13.5 (GOBLIN) [id:9795913] | Kris Dunn UNDER PRA 16.5 (STANDARD) [id:9817590] | Julian Strawther UNDER PR 14.5 (STANDARD) [id:9796233] | Cedric Coward OVER PA 18.5 (DEMON) [id:9816521],Cameron Johnson OVER PRA 13.5 (GOBLIN) [id:9795913],Kris Dunn UNDER PRA 16.5 (STANDARD) [id:9817590],Julian Strawther UNDER PR 14.5 (STANDARD) [id:9796233],Cedric Coward OVER PA 18.5 (DEMON) [id:9816521]
4,Donovan Mitchell OVER FG3M 2.5 (GOBLIN) [id:9796005] | Julian Strawther UNDER PTS 10.5 (STANDARD) [id:9796227] | Rui Hachimura UNDER PR 16.5 (STANDARD) [id:9800867] | Jerami Grant OVER FG3M 2.5 (DEMON) [id:9798505],0.15147709190490533,1.5147709190490533,0.6343331333733254,0.0030805374334734736,Donovan Mitchell OVER FG3M 2.5 (GOBLIN) [id:9796005] | Julian Strawther UNDER PTS 10.5 (STANDARD) [id:9796227] | Rui Hachimura UNDER PR 16.5 (STANDARD) [id:9800867] | Jerami Grant OVER FG3M 2.5 (DEMON) [id:9798505],Donovan Mitchell OVER FG3M 2.5 (GOBLIN) [id:9796005],Julian Strawther UNDER PTS 10.5 (STANDARD) [id:9796227],Rui Hachimura UNDER PR 16.5 (STANDARD) [id:9800867],Jerami Grant OVER FG3M 2.5 (DEMON) [id:9798505]
4,Dillon Brooks OVER PTS 14.5 (GOBLIN) [id:9817233] | Olivier-Maxence Prosper UNDER RA 6.5 (STANDARD) [id:9814540] | Pat Spencer UNDER REB 4.5 (STANDARD) [id:9797551] | Jarrett Allen OVER PRA 28.5 (DEMON) [id:9796156],0.1501782281905302,1.501782281905302,0.6424265146970605,0.00043055726411614934,Dillon Brooks OVER PTS 14.5 (GOBLIN) [id:9817233] | Olivier-Maxence Prosper UNDER RA 6.5 (STANDARD) [id:9814540] | Pat Spencer UNDER REB 4.5 (STANDARD) [id:9797551] | Jarrett Allen OVER PRA 28.5 (DEMON) [id:9796156],Dillon Brooks OVER PTS 14.5 (GOBLIN) [id:9817233],Olivier-Maxence Prosper UNDER RA 6.5 (STANDARD) [id:9814540],Pat Spencer UNDER REB 4.5 (STANDARD) [id:9797551],Jarrett Allen OVER PRA 28.5 (DEMON) [id:9796156]
4,James Harden OVER RA 10.5 (GOBLIN) [id:9802294] | Devin Booker OVER AST 5.5 (STANDARD) [id:9817467] | Scoot Henderson OVER PRA 17.5 (STANDARD) [id:9801894] | Aaron Nesmith OVER PTS 14.5 (DEMON) [id:9816619],0.14991289436150618,1.4991289436150619,0.6673165366926614,0.0,James Harden OVER RA 10.5 (GOBLIN) [id:9802294] | Devin Booker OVER AST 5.5 (STANDARD) [id:9817467] | Scoot Henderson OVER PRA 17.5 (STANDARD) [id:9801894] | Aaron Nesmith OVER PTS 14.5 (DEMON) [id:9816619],James Harden OVER RA 10.5 (GOBLIN) [id:9802294],Devin Booker OVER AST 5.5 (STANDARD) [id:9817467],Scoot Henderson OVER PRA 17.5 (STANDARD) [id:9801894],Aaron Nesmith OVER PTS 14.5 (DEMON) [id:9816619]
4,Tim Hardaway OVER REB 1.5 (GOBLIN) [id:9796360] | Max Christie OVER PTS 12.5 (STANDARD) [id:9817275] | Cameron Johnson OVER PA 12.5 (STANDARD) [id:9795910] | Jordan Goodwin OVER REB 5.5 (DEMON) [id:9817252],0.14810428769254866,1.4810428769254866,0.6399720055988802,0.0,Tim Hardaway OVER REB 1.5 (GOBLIN) [id:9796360] | Max Christie OVER PTS 12.5 (STANDARD) [id:9817275] | Cameron Johnson OVER PA 12.5 (STANDARD) [id:9795910] | Jordan Goodwin OVER REB 5.5 (DEMON) [id:9817252],Tim Hardaway OVER REB 1.5 (GOBLIN) [id:9796360],Max Christie OVER PTS 12.5 (STANDARD) [id:9817275],Cameron Johnson OVER PA 12.5 (STANDARD) [id:9795910],Jordan Goodwin OVER REB 5.5 (DEMON) [id:9817252]
4,Luke Kennard OVER FG3M 0.5 (GOBLIN) [id:9800855] | Karl-Anthony Towns UNDER PTS 19.5 (STANDARD) [id:9817023] | Scoot Henderson OVER PA 14.5 (STANDARD) [id:9801389] | Stephon Castle OVER PTS 19.5 (DEMON) [id:9818625],0.1457926937028142,1.457926937028142,0.6724957508498299,0.0021034061609444964,Luke Kennard OVER FG3M 0.5 (GOBLIN) [id:9800855] | Karl-Anthony Towns UNDER PTS 19.5 (STANDARD) [id:9817023] | Scoot Henderson OVER PA 14.5 (STANDARD) [id:9801389] | Stephon Castle OVER PTS 19.5 (DEMON) [id:9818625],Luke Kennard OVER FG3M 0.5 (GOBLIN) [id:9800855],Karl-Anthony Towns UNDER PTS 19.5 (STANDARD) [id:9817023],Scoot Henderson OVER PA 14.5 (STANDARD) [id:9801389],Stephon Castle OVER PTS 19.5 (DEMON) [id:9818625]
4,Cam Spencer OVER PTS 9.5 (GOBLIN) [id:9803488] | Jrue Holiday OVER PA 19.5 (STANDARD) [id:9798547] | GG Jackson UNDER PR 18.5 (STANDARD) [id:9803294] | Austin Reaves OVER PR 25.5 (DEMON) [id:9813817],0.14518504548448946,1.4518504548448945,0.6195455908818236,0.0,Cam Spencer OVER PTS 9.5 (GOBLIN) [id:9803488] | Jrue Holiday OVER PA 19.5 (STANDARD) [id:9798547] | GG Jackson UNDER PR 18.5 (STANDARD) [id:9803294] | Austin Reaves OVER PR 25.5 (DEMON) [id:9813817],Cam Spencer OVER PTS 9.5 (GOBLIN) [id:9803488],Jrue Holiday OVER PA 19.5 (STANDARD) [id:9798547],GG Jackson UNDER PR 18.5 (STANDARD) [id:9803294],Austin Reaves OVER PR 25.5 (DEMON) [id:9813817]
4,Bruce Brown OVER AST 1.5 (GOBLIN) [id:9818470] | Scoot Henderson OVER PA 14.5 (STANDARD) [id:9801389] | Gui Santos UNDER PTS 12 (STANDARD) [id:9797249] | Deandre Ayton OVER PR 23.5 (DEMON) [id:9813858],0.1445457154618369,1.445457154618369,0.6776969606078784,0.001514967882680892,Bruce Brown OVER AST 1.5 (GOBLIN) [id:9818470] | Scoot Henderson OVER PA 14.5 (STANDARD) [id:9801389] | Gui Santos UNDER PTS 12 (STANDARD) [id:9797249] | Deandre Ayton OVER PR 23.5 (DEMON) [id:9813858],Bruce Brown OVER AST 1.5 (GOBLIN) [id:9818470],Scoot Henderson OVER PA 14.5 (STANDARD) [id:9801389],Gui Santos UNDER PTS 12 (STANDARD) [id:9797249],Deandre Ayton OVER PR 23.5 (DEMON) [id:9813858]
4,Donovan Mitchell OVER REB 2.5 (GOBLIN) [id:9796035] | Daniel Gafford UNDER PR 16.5 (STANDARD) [id:9817219] | Tyrese Maxey UNDER PTS 27.5 (STANDARD) [id:9798601] | Amen Thompson OVER REB 7.5 (DEMON) [id:9817968],0.14375390073671646,1.4375390073671646,0.6242701459708059,0.0015379634126598814,Donovan Mitchell OVER REB 2.5 (GOBLIN) [id:9796035] | Daniel Gafford UNDER PR 16.5 (STANDARD) [id:9817219] | Tyrese Maxey UNDER PTS 27.5 (STANDARD) [id:9798601] | Amen Thompson OVER REB 7.5 (DEMON) [id:9817968],Donovan Mitchell OVER REB 2.5 (GOBLIN) [id:9796035],Daniel Gafford UNDER PR 16.5 (STANDARD) [id:9817219],Tyrese Maxey UNDER PTS 27.5 (STANDARD) [id:9798601],Amen Thompson OVER REB 7.5 (DEMON) [id:9817968]
