n_legs,legs,hit_prob,payout_mult,ev_mult,atlas_power_mult,pricing_engine,avg_p,avg_fragility,slip_key,leg_1,leg_2,leg_3,leg_4
4,Bub Carrington OVER PTS 5.5 (GOBLIN) [id:9932108] | Paul Reed UNDER REB 8.5 (STANDARD) [id:9917263] | Jaylon Tyson OVER AST 1.5 (STANDARD) [id:9921993] | Jamal Murray OVER REB 4.5 (DEMON) [id:9917580],0.24695498428351395,6.503884658225634,1.606166733553899,10.0,pp_kernel,0.7381023795240952,0.0014462628225474562,Bub Carrington OVER PTS 5.5 (GOBLIN) [id:9932108] | Paul Reed UNDER REB 8.5 (STANDARD) [id:9917263] | Jaylon Tyson OVER AST 1.5 (STANDARD) [id:9921993] | Jamal Murray OVER REB 4.5 (DEMON) [id:9917580],Bub Carrington OVER PTS 5.5 (GOBLIN) [id:9932108],Paul Reed UNDER REB 8.5 (STANDARD) [id:9917263],Jaylon Tyson OVER AST 1.5 (STANDARD) [id:9921993],Jamal Murray OVER REB 4.5 (DEMON) [id:9917580]
4,Neemias Queta OVER PRA 13.5 (GOBLIN) [id:9934857] | Julian Champagnie OVER REB 3.5 (STANDARD) [id:9923447] | Paul Reed UNDER REB 8.5 (STANDARD) [id:9917263] | Duncan Robinson OVER PRA 18.5 (DEMON) [id:9926402],0.23219778328295243,6.514909990776568,1.512747658146279,10.0,pp_kernel,0.7241051789642072,0.001676658137119754,Neemias Queta OVER PRA 13.5 (GOBLIN) [id:9934857] | Julian Champagnie OVER REB 3.5 (STANDARD) [id:9923447] | Paul Reed UNDER REB 8.5 (STANDARD) [id:9917263] | Duncan Robinson OVER PRA 18.5 (DEMON) [id:9926402],Neemias Queta OVER PRA 13.5 (GOBLIN) [id:9934857],Julian Champagnie OVER REB 3.5 (STANDARD) [id:9923447],Paul Reed UNDER REB 8.5 (STANDARD) [id:9917263],Duncan Robinson OVER PRA 18.5 (DEMON) [id:9926402]
4,OG Anunoby OVER PTS 11.5 (GOBLIN) [id:9919025] | Franz Wagner OVER PA 18.5 (STANDARD) [id:9919060] | Jalen Brunson UNDER PTS 26.5 (STANDARD) [id:9917544] | Mikal Bridges OVER PRA 24.5 (DEMON) [id:9919275],0.19170419613742565,6.200481685343765,1.1886583571536566,10.0,pp_kernel,0.6840131973605279,0.0011301688605238923,OG Anunoby OVER PTS 11.5 (GOBLIN) [id:9919025] | Franz Wagner OVER PA 18.5 (STANDARD) [id:9919060] | Jalen Brunson UNDER PTS 26.5 (STANDARD) [id:9917544] | Mikal Bridges OVER PRA 24.5 (DEMON) [id:9919275],OG Anunoby OVER PTS 11.5 (GOBLIN) [id:9919025],Franz Wagner OVER PA 18.5 (STANDARD) [id:9919060],Jalen Brunson UNDER PTS 26.5 (STANDARD) [id:9917544],Mikal Bridges OVER PRA 24.5 (DEMON) [id:9919275]
4,Nikola Vučević OVER PTS 9.5 (GOBLIN) [id:9918030] | Grant Williams UNDER PR 15.5 (STANDARD) [id:9918198] | Jonas Valančiūnas OVER PR 12.5 (STANDARD) [id:9933597] | Bub Carrington OVER AST 5.5 (DEMON) [id:9919753],0.19394733377256274,5.863782479290638,1.1372649776806867,10.0,pp_kernel,0.6882123575284943,0.0035042459438444505,Nikola Vučević OVER PTS 9.5 (GOBLIN) [id:9918030] | Grant Williams UNDER PR 15.5 (STANDARD) [id:9918198] | Jonas Valančiūnas OVER PR 12.5 (STANDARD) [id:9933597] | Bub Carrington OVER AST 5.5 (DEMON) [id:9919753],Nikola Vučević OVER PTS 9.5 (GOBLIN) [id:9918030],Grant Williams UNDER PR 15.5 (STANDARD) [id:9918198],Jonas Valančiūnas OVER PR 12.5 (STANDARD) [id:9933597],Bub Carrington OVER AST 5.5 (DEMON) [id:9919753]
4,Cameron Johnson OVER PR 9.5 (GOBLIN) [id:9923632] | James Harden OVER PTS 20.5 (STANDARD) [id:9918488] | Nikola Vučević OVER PA 16.5 (STANDARD) [id:9918032] | Wendell Carter OVER RA 9.5 (DEMON) [id:9935079],0.2362086337748355,4.806377184403753,1.135307788134551,10.0,pp_kernel,0.7178564287142571,0.0,Cameron Johnson OVER PR 9.5 (GOBLIN) [id:9923632] | James Harden OVER PTS 20.5 (STANDARD) [id:9918488] | Nikola Vučević OVER PA 16.5 (STANDARD) [id:9918032] | Wendell Carter OVER RA 9.5 (DEMON) [id:9935079],Cameron Johnson OVER PR 9.5 (GOBLIN) [id:9923632],James Harden OVER PTS 20.5 (STANDARD) [id:9918488],Nikola Vučević OVER PA 16.5 (STANDARD) [id:9918032],Wendell Carter OVER RA 9.5 (DEMON) [id:9935079]
4,Bub Carrington OVER PRA 14.5 (GOBLIN) [id:9926604] | Paul Reed UNDER PA 14.5 (STANDARD) [id:9917326] | Kristaps Porziņģis OVER PTS 12 (STANDARD) [id:9922998] | Julian Champagnie OVER FG3M 2.5 (DEMON) [id:9933018],0.23645695510047587,4.7288089432395255,1.1181597639703174,10.0,pp_kernel,0.7149570085982804,0.0036188827317203713,Bub Carrington OVER PRA 14.5 (GOBLIN) [id:9926604] | Paul Reed UNDER PA 14.5 (STANDARD) [id:9917326] | Kristaps Porziņģis OVER PTS 12 (STANDARD) [id:9922998] | Julian Champagnie OVER FG3M 2.5 (DEMON) [id:9933018],Bub Carrington OVER PRA 14.5 (GOBLIN) [id:9926604],Paul Reed UNDER PA 14.5 (STANDARD) [id:9917326],Kristaps Porziņģis OVER PTS 12 (STANDARD) [id:9922998],Julian Champagnie OVER FG3M 2.5 (DEMON) [id:9933018]
4,Bilal Coulibaly OVER PTS 7.5 (GOBLIN) [id:9926520] | Jalen Brunson UNDER PA 32.5 (STANDARD) [id:9917547] | Neemias Queta OVER PRA 15.5 (STANDARD) [id:9923234] | Bub Carrington OVER PRA 20.5 (DEMON) [id:9934629],0.1634537569820832,6.669108499389777,1.0900908399464022,10.0,pp_kernel,0.6557688462307539,0.004376367614879651,Bilal Coulibaly OVER PTS 7.5 (GOBLIN) [id:9926520] | Jalen Brunson UNDER PA 32.5 (STANDARD) [id:9917547] | Neemias Queta OVER PRA 15.5 (STANDARD) [id:9923234] | Bub Carrington OVER PRA 20.5 (DEMON) [id:9934629],Bilal Coulibaly OVER PTS 7.5 (GOBLIN) [id:9926520],Jalen Brunson UNDER PA 32.5 (STANDARD) [id:9917547],Neemias Queta OVER PRA 15.5 (STANDARD) [id:9923234],Bub Carrington OVER PRA 20.5 (DEMON) [id:9934629]
4,Nikola Vučević OVER PR 14.5 (GOBLIN) [id:9919788] | Nolan Traore UNDER PA 16.5 (STANDARD) [id:9918565] | Ryan Kalkbrenner UNDER PR 14.5 (STANDARD) [id:9918272] | Tim Hardaway OVER PR 19.5 (DEMON) [id:9920906],0.19729514759802486,5.506332538381278,1.086372690883741,10.0,pp_kernel,0.6927614477104579,0.0012554211367267977,Nikola Vučević OVER PR 14.5 (GOBLIN) [id:9919788] | Nolan Traore UNDER PA 16.5 (STANDARD) [id:9918565] | Ryan Kalkbrenner UNDER PR 14.5 (STANDARD) [id:9918272] | Tim Hardaway OVER PR 19.5 (DEMON) [id:9920906],Nikola Vučević OVER PR 14.5 (GOBLIN) [id:9919788],Nolan Traore UNDER PA 16.5 (STANDARD) [id:9918565],Ryan Kalkbrenner UNDER PR 14.5 (STANDARD) [id:9918272],Tim Hardaway OVER PR 19.5 (DEMON) [id:9920906]
4,Bennedict Mathurin OVER REB 3.5 (GOBLIN) [id:9917429] | Brook Lopez UNDER PRA 14.5 (STANDARD) [id:9931117] | Cameron Johnson OVER PR 14 (STANDARD) [id:9921882] | Tre Johnson OVER PTS 14.5 (DEMON) [id:9934714],0.21609515618027542,4.922757177199655,1.063783981044531,10.0,pp_kernel,0.6978604279144172,0.0005817711700064373,Bennedict Mathurin OVER REB 3.5 (GOBLIN) [id:9917429] | Brook Lopez UNDER PRA 14.5 (STANDARD) [id:9931117] | Cameron Johnson OVER PR 14 (STANDARD) [id:9921882] | Tre Johnson OVER PTS 14.5 (DEMON) [id:9934714],Bennedict Mathurin OVER REB 3.5 (GOBLIN) [id:9917429],Brook Lopez UNDER PRA 14.5 (STANDARD) [id:9931117],Cameron Johnson OVER PR 14 (STANDARD) [id:9921882],Tre Johnson OVER PTS 14.5 (DEMON) [id:9934714]
4,Josh Giddey OVER PTS 11.5 (GOBLIN) [id:9929742] | Alperen Sengun OVER REB 8.5 (STANDARD) [id:9918157] | Julian Champagnie OVER RA 4.5 (STANDARD) [id:9923448] | Russell Westbrook OVER PTS 17.5 (DEMON) [id:9921011],0.16042371903158023,6.598364929008978,1.0585342414391692,10.0,pp_kernel,0.660117976404719,0.003480635212067826,Josh Giddey OVER PTS 11.5 (GOBLIN) [id:9929742] | Alperen Sengun OVER REB 8.5 (STANDARD) [id:9918157] | Julian Champagnie OVER RA 4.5 (STANDARD) [id:9923448] | Russell Westbrook OVER PTS 17.5 (DEMON) [id:9921011],Josh Giddey OVER PTS 11.5 (GOBLIN) [id:9929742],Alperen Sengun OVER REB 8.5 (STANDARD) [id:9918157],Julian Champagnie OVER RA 4.5 (STANDARD) [id:9923448],Russell Westbrook OVER PTS 17.5 (DEMON) [id:9921011]
4,John Collins OVER FG3M 0.5 (GOBLIN) [id:9917443] | T.J. McConnell OVER PRA 13.5 (STANDARD) [id:9929604] | Brook Lopez UNDER RA 5.5 (STANDARD) [id:9931118] | James Harden OVER PTS 24.5 (DEMON) [id:9918489],0.17757319552041162,5.772299264569692,1.0250056259097622,10.0,pp_kernel,0.6674165166966606,0.002330852325563531,John Collins OVER FG3M 0.5 (GOBLIN) [id:9917443] | T.J. McConnell OVER PRA 13.5 (STANDARD) [id:9929604] | Brook Lopez UNDER RA 5.5 (STANDARD) [id:9931118] | James Harden OVER PTS 24.5 (DEMON) [id:9918489],John Collins OVER FG3M 0.5 (GOBLIN) [id:9917443],T.J. McConnell OVER PRA 13.5 (STANDARD) [id:9929604],Brook Lopez UNDER RA 5.5 (STANDARD) [id:9931118],James Harden OVER PTS 24.5 (DEMON) [id:9918489]
4,Duncan Robinson OVER PR 11.5 (GOBLIN) [id:9925869] | Tim Hardaway OVER PR 14.5 (STANDARD) [id:9917510] | Paul Reed UNDER PA 14.5 (STANDARD) [id:9917326] | Bennedict Mathurin OVER AST 2.5 (DEMON) [id:9917417],0.2334090717606293,4.293118988890543,1.0020529181548732,10.0,pp_kernel,0.7113577284543091,0.002643716953538077,Duncan Robinson OVER PR 11.5 (GOBLIN) [id:9925869] | Tim Hardaway OVER PR 14.5 (STANDARD) [id:9917510] | Paul Reed UNDER PA 14.5 (STANDARD) [id:9917326] | Bennedict Mathurin OVER AST 2.5 (DEMON) [id:9917417],Duncan Robinson OVER PR 11.5 (GOBLIN) [id:9925869],Tim Hardaway OVER PR 14.5 (STANDARD) [id:9917510],Paul Reed UNDER PA 14.5 (STANDARD) [id:9917326],Bennedict Mathurin OVER AST 2.5 (DEMON) [id:9917417]
4,Franz Wagner OVER PRA 19.5 (GOBLIN) [id:9921642] | Dominick Barlow UNDER PRA 15.5 (STANDARD) [id:9926515] | Paul Reed UNDER PA 14.5 (STANDARD) [id:9917326] | Tim Hardaway OVER PRA 19.5 (DEMON) [id:9933798],0.23524338995012264,4.1877793935375065,0.9851474208990317,10.0,pp_kernel,0.7152569486102779,0.003694750469829113,Franz Wagner OVER PRA 19.5 (GOBLIN) [id:9921642] | Dominick Barlow UNDER PRA 15.5 (STANDARD) [id:9926515] | Paul Reed UNDER PA 14.5 (STANDARD) [id:9917326] | Tim Hardaway OVER PRA 19.5 (DEMON) [id:9933798],Franz Wagner OVER PRA 19.5 (GOBLIN) [id:9921642],Dominick Barlow UNDER PRA 15.5 (STANDARD) [id:9926515],Paul Reed UNDER PA 14.5 (STANDARD) [id:9917326],Tim Hardaway OVER PRA 19.5 (DEMON) [id:9933798]
4,Tim Hardaway OVER PTS 9.5 (GOBLIN) [id:9917677] | Bilal Coulibaly UNDER AST 2.5 (STANDARD) [id:9929560] | Nikola Vučević OVER PR 21 (STANDARD) [id:9918033] | Paolo Banchero OVER PA 29.5 (DEMON) [id:9921652],0.14554608312508358,6.715407213729588,0.9774012165482725,10.0,pp_kernel,0.6392721455708859,0.003138939368907962,Tim Hardaway OVER PTS 9.5 (GOBLIN) [id:9917677] | Bilal Coulibaly UNDER AST 2.5 (STANDARD) [id:9929560] | Nikola Vučević OVER PR 21 (STANDARD) [id:9918033] | Paolo Banchero OVER PA 29.5 (DEMON) [id:9921652],Tim Hardaway OVER PTS 9.5 (GOBLIN) [id:9917677],Bilal Coulibaly UNDER AST 2.5 (STANDARD) [id:9929560],Nikola Vučević OVER PR 21 (STANDARD) [id:9918033],Paolo Banchero OVER PA 29.5 (DEMON) [id:9921652]
4,Ronald Holland OVER RA 3.5 (GOBLIN) [id:9926483] | James Harden OVER PR 24.5 (STANDARD) [id:9918492] | Egor Dëmin UNDER PA 15.5 (STANDARD) [id:9918464] | Onyeka Okongwu OVER PRA 29.5 (DEMON) [id:9921425],0.19230643435524952,5.041627664730006,0.9695374395510109,10.0,pp_kernel,0.6803639272145572,0.0,Ronald Holland OVER RA 3.5 (GOBLIN) [id:9926483] | James Harden OVER PR 24.5 (STANDARD) [id:9918492] | Egor Dëmin UNDER PA 15.5 (STANDARD) [id:9918464] | Onyeka Okongwu OVER PRA 29.5 (DEMON) [id:9921425],Ronald Holland OVER RA 3.5 (GOBLIN) [id:9926483],James Harden OVER PR 24.5 (STANDARD) [id:9918492],Egor Dëmin UNDER PA 15.5 (STANDARD) [id:9918464],Onyeka Okongwu OVER PRA 29.5 (DEMON) [id:9921425]
4,Bub Carrington OVER PRA 14.5 (GOBLIN) [id:9926604] | Tim Hardaway OVER RA 3.5 (STANDARD) [id:9933658] | Domantas Sabonis OVER PR 20.5 (STANDARD) [id:9919218] | Daniss Jenkins OVER RA 5.5 (DEMON) [id:9926394],0.15239505191602676,6.280569427283949,0.9571277039331479,10.0,pp_kernel,0.6432713457308539,0.005002627400194689,Bub Carrington OVER PRA 14.5 (GOBLIN) [id:9926604] | Tim Hardaway OVER RA 3.5 (STANDARD) [id:9933658] | Domantas Sabonis OVER PR 20.5 (STANDARD) [id:9919218] | Daniss Jenkins OVER RA 5.5 (DEMON) [id:9926394],Bub Carrington OVER PRA 14.5 (GOBLIN) [id:9926604],Tim Hardaway OVER RA 3.5 (STANDARD) [id:9933658],Domantas Sabonis OVER PR 20.5 (STANDARD) [id:9919218],Daniss Jenkins OVER RA 5.5 (DEMON) [id:9926394]
4,Immanuel Quickley OVER REB 2.5 (GOBLIN) [id:9919283] | CJ McCollum OVER PR 19.5 (STANDARD) [id:9921176] | Tim Hardaway OVER PRA 15.5 (STANDARD) [id:9931140] | Jonas Valančiūnas OVER RA 7.5 (DEMON) [id:9933761],0.1484883463328712,6.385349920013763,0.948150050379575,10.0,pp_kernel,0.6389722055588881,0.005112960760998788,Immanuel Quickley OVER REB 2.5 (GOBLIN) [id:9919283] | CJ McCollum OVER PR 19.5 (STANDARD) [id:9921176] | Tim Hardaway OVER PRA 15.5 (STANDARD) [id:9931140] | Jonas Valančiūnas OVER RA 7.5 (DEMON) [id:9933761],Immanuel Quickley OVER REB 2.5 (GOBLIN) [id:9919283],CJ McCollum OVER PR 19.5 (STANDARD) [id:9921176],Tim Hardaway OVER PRA 15.5 (STANDARD) [id:9931140],Jonas Valančiūnas OVER RA 7.5 (DEMON) [id:9933761]
4,Domantas Sabonis OVER PA 11.5 (GOBLIN) [id:9932344] | Onyeka Okongwu OVER PTS 14.5 (STANDARD) [id:9921416] | Amen Thompson OVER RA 11.5 (STANDARD) [id:9918173] | Dyson Daniels OVER PTS 12.5 (DEMON) [id:9921278],0.18932086521527305,4.963915925530502,0.9397728578773076,10.0,pp_kernel,0.6771145770845831,0.0,Domantas Sabonis OVER PA 11.5 (GOBLIN) [id:9932344] | Onyeka Okongwu OVER PTS 14.5 (STANDARD) [id:9921416] | Amen Thompson OVER RA 11.5 (STANDARD) [id:9918173] | Dyson Daniels OVER PTS 12.5 (DEMON) [id:9921278],Domantas Sabonis OVER PA 11.5 (GOBLIN) [id:9932344],Onyeka Okongwu OVER PTS 14.5 (STANDARD) [id:9921416],Amen Thompson OVER RA 11.5 (STANDARD) [id:9918173],Dyson Daniels OVER PTS 12.5 (DEMON) [id:9921278]
4,Josh Hart OVER PRA 19.5 (GOBLIN) [id:9919267] | Jalen Brunson UNDER PRA 36 (STANDARD) [id:9917549] | Desmond Bane UNDER AST 4 (STANDARD) [id:9919043] | Stephen Curry OVER REB 3.5 (DEMON) [id:9918076],0.14738423404930395,6.32938572748253,0.9328516674476091,10.0,pp_kernel,0.6382723455308937,0.0035650623885918205,Josh Hart OVER PRA 19.5 (GOBLIN) [id:9919267] | Jalen Brunson UNDER PRA 36 (STANDARD) [id:9917549] | Desmond Bane UNDER AST 4 (STANDARD) [id:9919043] | Stephen Curry OVER REB 3.5 (DEMON) [id:9918076],Josh Hart OVER PRA 19.5 (GOBLIN) [id:9919267],Jalen Brunson UNDER PRA 36 (STANDARD) [id:9917549],Desmond Bane UNDER AST 4 (STANDARD) [id:9919043],Stephen Curry OVER REB 3.5 (DEMON) [id:9918076]
4,Devin Vassell OVER REB 2.5 (GOBLIN) [id:9919503] | Franz Wagner OVER REB 4 (STANDARD) [id:9919065] | Duncan Robinson OVER PRA 14.5 (STANDARD) [id:9923220] | Amen Thompson OVER PTS 17.5 (DEMON) [id:9920761],0.19569285117035645,4.7623183847809365,0.9319516628987882,10.0,pp_kernel,0.6784143171365727,0.0,Devin Vassell OVER REB 2.5 (GOBLIN) [id:9919503] | Franz Wagner OVER REB 4 (STANDARD) [id:9919065] | Duncan Robinson OVER PRA 14.5 (STANDARD) [id:9923220] | Amen Thompson OVER PTS 17.5 (DEMON) [id:9920761],Devin Vassell OVER REB 2.5 (GOBLIN) [id:9919503],Franz Wagner OVER REB 4 (STANDARD) [id:9919065],Duncan Robinson OVER PRA 14.5 (STANDARD) [id:9923220],Amen Thompson OVER PTS 17.5 (DEMON) [id:9920761]
4,Joel Embiid OVER PA 29.5 (GOBLIN) [id:9918983] | OG Anunoby OVER REB 4.5 (STANDARD) [id:9917251] | Alperen Sengun UNDER PTS 18.5 (STANDARD) [id:9918151] | Immanuel Quickley OVER PRA 29.5 (DEMON) [id:9919449],0.14045825515028013,6.578612305004071,0.9240204056710342,10.0,pp_kernel,0.6291741651669666,0.0011060507482108255,Joel Embiid OVER PA 29.5 (GOBLIN) [id:9918983] | OG Anunoby OVER REB 4.5 (STANDARD) [id:9917251] | Alperen Sengun UNDER PTS 18.5 (STANDARD) [id:9918151] | Immanuel Quickley OVER PRA 29.5 (DEMON) [id:9919449],Joel Embiid OVER PA 29.5 (GOBLIN) [id:9918983],OG Anunoby OVER REB 4.5 (STANDARD) [id:9917251],Alperen Sengun UNDER PTS 18.5 (STANDARD) [id:9918151],Immanuel Quickley OVER PRA 29.5 (DEMON) [id:9919449]
4,Kristaps Porziņģis OVER PR 14.5 (GOBLIN) [id:9923000] | Kelly Oubre UNDER PRA 22.5 (STANDARD) [id:9921361] | Harrison Barnes OVER PTS 6.5 (STANDARD) [id:9923439] | DeMar DeRozan OVER RA 6.5 (DEMON) [id:9934950],0.18226992333055855,5.063582272971917,0.9229387526725668,10.0,pp_kernel,0.6680163967206559,0.0024753898339732027,Kristaps Porziņģis OVER PR 14.5 (GOBLIN) [id:9923000] | Kelly Oubre UNDER PRA 22.5 (STANDARD) [id:9921361] | Harrison Barnes OVER PTS 6.5 (STANDARD) [id:9923439] | DeMar DeRozan OVER RA 6.5 (DEMON) [id:9934950],Kristaps Porziņģis OVER PR 14.5 (GOBLIN) [id:9923000],Kelly Oubre UNDER PRA 22.5 (STANDARD) [id:9921361],Harrison Barnes OVER PTS 6.5 (STANDARD) [id:9923439],DeMar DeRozan OVER RA 6.5 (DEMON) [id:9934950]
4,Joel Embiid OVER PTS 24.5 (GOBLIN) [id:9918357] | Grant Williams UNDER FG3M 1.5 (STANDARD) [id:9918189] | Ausar Thompson OVER RA 7.5 (STANDARD) [id:9923289] | Alperen Sengun OVER REB 11.5 (DEMON) [id:9918159],0.15499445039199675,5.886221179655759,0.9123316166264751,10.0,pp_kernel,0.6442711457708459,0.0035753953391711646,Joel Embiid OVER PTS 24.5 (GOBLIN) [id:9918357] | Grant Williams UNDER FG3M 1.5 (STANDARD) [id:9918189] | Ausar Thompson OVER RA 7.5 (STANDARD) [id:9923289] | Alperen Sengun OVER REB 11.5 (DEMON) [id:9918159],Joel Embiid OVER PTS 24.5 (GOBLIN) [id:9918357],Grant Williams UNDER FG3M 1.5 (STANDARD) [id:9918189],Ausar Thompson OVER RA 7.5 (STANDARD) [id:9923289],Alperen Sengun OVER REB 11.5 (DEMON) [id:9918159]
4,Tari Eason OVER PTS 7.5 (GOBLIN) [id:9920767] | Stephen Curry OVER PA 28.5 (STANDARD) [id:9918073] | Brook Lopez UNDER AST 1.5 (STANDARD) [id:9931114] | Russell Westbrook OVER PTS 17.5 (DEMON) [id:9921011],0.13801003110453025,6.598174589977432,0.9106142803959064,10.0,pp_kernel,0.6295240951809637,0.006199575139248006,Tari Eason OVER PTS 7.5 (GOBLIN) [id:9920767] | Stephen Curry OVER PA 28.5 (STANDARD) [id:9918073] | Brook Lopez UNDER AST 1.5 (STANDARD) [id:9931114] | Russell Westbrook OVER PTS 17.5 (DEMON) [id:9921011],Tari Eason OVER PTS 7.5 (GOBLIN) [id:9920767],Stephen Curry OVER PA 28.5 (STANDARD) [id:9918073],Brook Lopez UNDER AST 1.5 (STANDARD) [id:9931114],Russell Westbrook OVER PTS 17.5 (DEMON) [id:9921011]
4,Sion James OVER RA 3.5 (GOBLIN) [id:9924102] | Payton Pritchard OVER REB 3.5 (STANDARD) [id:9918053] | Brook Lopez UNDER PA 10.5 (STANDARD) [id:9931116] | Tari Eason OVER RA 8.5 (DEMON) [id:9924116],0.14242826414949156,6.379498083325648,0.9086208381530805,10.0,pp_kernel,0.6339732053589282,0.0060362960140945485,Sion James OVER RA 3.5 (GOBLIN) [id:9924102] | Payton Pritchard OVER REB 3.5 (STANDARD) [id:9918053] | Brook Lopez UNDER PA 10.5 (STANDARD) [id:9931116] | Tari Eason OVER RA 8.5 (DEMON) [id:9924116],Sion James OVER RA 3.5 (GOBLIN) [id:9924102],Payton Pritchard OVER REB 3.5 (STANDARD) [id:9918053],Brook Lopez UNDER PA 10.5 (STANDARD) [id:9931116],Tari Eason OVER RA 8.5 (DEMON) [id:9924116]
