n_legs,legs,hit_prob,payout_mult,ev_mult,atlas_power_mult,pricing_engine,avg_p,avg_fragility,slip_key,leg_1,leg_2,leg_3
3,Paolo Banchero OVER PA 19.5 (GOBLIN) [id:9826110] | Yanic Niederhäuser UNDER PR 9.5 (STANDARD) [id:9841151] | Mitchell Robinson OVER RA 10.5 (DEMON) [id:9842319],0.41794964592014683,2.9130956367705325,1.2175272899197687,6.0,pp_kernel,0.7878091048456975,0.00014315367547060228,Paolo Banchero OVER PA 19.5 (GOBLIN) [id:9826110] | Yanic Niederhäuser UNDER PR 9.5 (STANDARD) [id:9841151] | Mitchell Robinson OVER RA 10.5 (DEMON) [id:9842319],Paolo Banchero OVER PA 19.5 (GOBLIN) [id:9826110],Yanic Niederhäuser UNDER PR 9.5 (STANDARD) [id:9841151],Mitchell Robinson OVER RA 10.5 (DEMON) [id:9842319]
3,John Collins OVER PR 14.5 (GOBLIN) [id:9846583] | Maxime Raynaud UNDER PA 15.5 (STANDARD) [id:9839273] | Onyeka Okongwu OVER PA 21.5 (DEMON) [id:9857399],0.33904796495755724,3.329297299009393,1.1287914739678266,6.0,pp_kernel,0.7320869159501434,0.004000150949092406,John Collins OVER PR 14.5 (GOBLIN) [id:9846583] | Maxime Raynaud UNDER PA 15.5 (STANDARD) [id:9839273] | Onyeka Okongwu OVER PA 21.5 (DEMON) [id:9857399],John Collins OVER PR 14.5 (GOBLIN) [id:9846583],Maxime Raynaud UNDER PA 15.5 (STANDARD) [id:9839273],Onyeka Okongwu OVER PA 21.5 (DEMON) [id:9857399]
3,Royce O'Neale OVER PTS 5.5 (GOBLIN) [id:9844317] | Paul Reed UNDER REB 9 (STANDARD) [id:9855433] | Dennis Schröder OVER PRA 18.5 (DEMON) [id:9840700],0.3507782313420008,3.161191801483149,1.1088772690570923,6.0,pp_kernel,0.7398187029260814,0.00501927366159071,Royce O'Neale OVER PTS 5.5 (GOBLIN) [id:9844317] | Paul Reed UNDER REB 9 (STANDARD) [id:9855433] | Dennis Schröder OVER PRA 18.5 (DEMON) [id:9840700],Royce O'Neale OVER PTS 5.5 (GOBLIN) [id:9844317],Paul Reed UNDER REB 9 (STANDARD) [id:9855433],Dennis Schröder OVER PRA 18.5 (DEMON) [id:9840700]
3,Nikola Vučević OVER PA 14.5 (GOBLIN) [id:9837324] | Devin Carter UNDER PR 21.5 (STANDARD) [id:9842414] | Jamal Shead OVER PRA 14.5 (DEMON) [id:9834945],0.39606776173665803,2.7637174102378546,1.0946193687455401,6.0,pp_kernel,0.7676797973738586,0.0008234688625836591,Nikola Vučević OVER PA 14.5 (GOBLIN) [id:9837324] | Devin Carter UNDER PR 21.5 (STANDARD) [id:9842414] | Jamal Shead OVER PRA 14.5 (DEMON) [id:9834945],Nikola Vučević OVER PA 14.5 (GOBLIN) [id:9837324],Devin Carter UNDER PR 21.5 (STANDARD) [id:9842414],Jamal Shead OVER PRA 14.5 (DEMON) [id:9834945]
3,Julian Champagnie OVER AST 0.5 (GOBLIN) [id:9855848] | Grant Williams UNDER PA 13 (STANDARD) [id:9838696] | Tim Hardaway OVER PR 19.5 (DEMON) [id:9839518],0.3019673798985595,3.4132286172145467,1.03068370253506,6.0,pp_kernel,0.7002266213423982,0.003282840587274044,Julian Champagnie OVER AST 0.5 (GOBLIN) [id:9855848] | Grant Williams UNDER PA 13 (STANDARD) [id:9838696] | Tim Hardaway OVER PR 19.5 (DEMON) [id:9839518],Julian Champagnie OVER AST 0.5 (GOBLIN) [id:9855848],Grant Williams UNDER PA 13 (STANDARD) [id:9838696],Tim Hardaway OVER PR 19.5 (DEMON) [id:9839518]
3,Kawhi Leonard OVER FG3M 1.5 (GOBLIN) [id:9840972] | Franz Wagner OVER PRA 19.5 (STANDARD) [id:9823028] | Bilal Coulibaly OVER PTS 11.5 (DEMON) [id:9837496],0.29564660698485107,3.4153353029291336,1.0097322940265767,6.0,pp_kernel,0.694361127774445,0.001401378021721381,Kawhi Leonard OVER FG3M 1.5 (GOBLIN) [id:9840972] | Franz Wagner OVER PRA 19.5 (STANDARD) [id:9823028] | Bilal Coulibaly OVER PTS 11.5 (DEMON) [id:9837496],Kawhi Leonard OVER FG3M 1.5 (GOBLIN) [id:9840972],Franz Wagner OVER PRA 19.5 (STANDARD) [id:9823028],Bilal Coulibaly OVER PTS 11.5 (DEMON) [id:9837496]
3,Jamal Murray OVER PRA 29.5 (GOBLIN) [id:9839507] | Nikola Vučević OVER PA 16.5 (STANDARD) [id:9831752] | Jalen Johnson OVER REB 11.5 (DEMON) [id:9838733],0.31726046267360225,3.1809938537963554,1.0092035818173168,6.0,pp_kernel,0.7123575284943012,0.0012365884706310116,Jamal Murray OVER PRA 29.5 (GOBLIN) [id:9839507] | Nikola Vučević OVER PA 16.5 (STANDARD) [id:9831752] | Jalen Johnson OVER REB 11.5 (DEMON) [id:9838733],Jamal Murray OVER PRA 29.5 (GOBLIN) [id:9839507],Nikola Vučević OVER PA 16.5 (STANDARD) [id:9831752],Jalen Johnson OVER REB 11.5 (DEMON) [id:9838733]
3,Kevin Porter OVER RA 9.5 (GOBLIN) [id:9830535] | Scotty Pippen UNDER REB 2.5 (STANDARD) [id:9832568] | Immanuel Quickley OVER PRA 28.5 (DEMON) [id:9834928],0.3297004032923386,3.0567733462060134,1.0078194050173939,6.0,pp_kernel,0.7183563287342531,0.004195315231325042,Kevin Porter OVER RA 9.5 (GOBLIN) [id:9830535] | Scotty Pippen UNDER REB 2.5 (STANDARD) [id:9832568] | Immanuel Quickley OVER PRA 28.5 (DEMON) [id:9834928],Kevin Porter OVER RA 9.5 (GOBLIN) [id:9830535],Scotty Pippen UNDER REB 2.5 (STANDARD) [id:9832568],Immanuel Quickley OVER PRA 28.5 (DEMON) [id:9834928]
3,Nikola Vučević OVER PA 14.5 (GOBLIN) [id:9837324] | Paul Reed UNDER REB 9 (STANDARD) [id:9855433] | Brice Sensabaugh OVER REB 3.5 (DEMON) [id:9839042],0.33515916525406647,2.991164361748157,1.0025161506212248,6.0,pp_kernel,0.7218889555422249,0.0026557313024800013,Nikola Vučević OVER PA 14.5 (GOBLIN) [id:9837324] | Paul Reed UNDER REB 9 (STANDARD) [id:9855433] | Brice Sensabaugh OVER REB 3.5 (DEMON) [id:9839042],Nikola Vučević OVER PA 14.5 (GOBLIN) [id:9837324],Paul Reed UNDER REB 9 (STANDARD) [id:9855433],Brice Sensabaugh OVER REB 3.5 (DEMON) [id:9839042]
3,Nikola Vučević OVER FG3M 0.5 (GOBLIN) [id:9831733] | Paul Reed UNDER PR 21.5 (STANDARD) [id:9855431] | Dominick Barlow OVER FG3M 0.5 (DEMON) [id:9842126],0.3361704026782554,2.944672417875916,0.9899117124728986,6.0,pp_kernel,0.7218889555422249,0.003686566602716042,Nikola Vučević OVER FG3M 0.5 (GOBLIN) [id:9831733] | Paul Reed UNDER PR 21.5 (STANDARD) [id:9855431] | Dominick Barlow OVER FG3M 0.5 (DEMON) [id:9842126],Nikola Vučević OVER FG3M 0.5 (GOBLIN) [id:9831733],Paul Reed UNDER PR 21.5 (STANDARD) [id:9855431],Dominick Barlow OVER FG3M 0.5 (DEMON) [id:9842126]
3,Nikola Vučević OVER PTS 9.5 (GOBLIN) [id:9831749] | Ryan Kalkbrenner UNDER PRA 17.5 (STANDARD) [id:9838913] | Royce O'Neale OVER PRA 19.5 (DEMON) [id:9841699],0.3251265432912391,3.030969206028247,0.9854485407781555,6.0,pp_kernel,0.7164233819902686,0.0003419241783134696,Nikola Vučević OVER PTS 9.5 (GOBLIN) [id:9831749] | Ryan Kalkbrenner UNDER PRA 17.5 (STANDARD) [id:9838913] | Royce O'Neale OVER PRA 19.5 (DEMON) [id:9841699],Nikola Vučević OVER PTS 9.5 (GOBLIN) [id:9831749],Ryan Kalkbrenner UNDER PRA 17.5 (STANDARD) [id:9838913],Royce O'Neale OVER PRA 19.5 (DEMON) [id:9841699]
3,Royce O'Neale OVER AST 1.5 (GOBLIN) [id:9843468] | Aaron Wiggins OVER REB 2.5 (STANDARD) [id:9841219] | Toumani Camara OVER PTS 14.5 (DEMON) [id:9833513],0.33717886747035625,2.911950692815682,0.981848236733111,6.0,pp_kernel,0.7221555688862228,0.0,Royce O'Neale OVER AST 1.5 (GOBLIN) [id:9843468] | Aaron Wiggins OVER REB 2.5 (STANDARD) [id:9841219] | Toumani Camara OVER PTS 14.5 (DEMON) [id:9833513],Royce O'Neale OVER AST 1.5 (GOBLIN) [id:9843468],Aaron Wiggins OVER REB 2.5 (STANDARD) [id:9841219],Toumani Camara OVER PTS 14.5 (DEMON) [id:9833513]
3,Scotty Pippen OVER PTS 8.5 (GOBLIN) [id:9858877] | Nique Clifford UNDER PTS 16.5 (STANDARD) [id:9839303] | Cam Spencer OVER RA 9.5 (DEMON) [id:9835196],0.45467426480156986,2.140861841436062,0.9733947837966764,6.0,pp_kernel,0.7974071852296207,0.0026168312242912804,Scotty Pippen OVER PTS 8.5 (GOBLIN) [id:9858877] | Nique Clifford UNDER PTS 16.5 (STANDARD) [id:9839303] | Cam Spencer OVER RA 9.5 (DEMON) [id:9835196],Scotty Pippen OVER PTS 8.5 (GOBLIN) [id:9858877],Nique Clifford UNDER PTS 16.5 (STANDARD) [id:9839303],Cam Spencer OVER RA 9.5 (DEMON) [id:9835196]
3,Nikola Vučević OVER PTS 10.5 (GOBLIN) [id:9831750] | Kel'el Ware UNDER PTS 13.5 (STANDARD) [id:9836612] | Donte DiVincenzo OVER FG3M 3.5 (DEMON) [id:9833070],0.3025832229188413,3.188929807558809,0.9649166588331048,6.0,pp_kernel,0.698360327934413,0.0010385564065948174,Nikola Vučević OVER PTS 10.5 (GOBLIN) [id:9831750] | Kel'el Ware UNDER PTS 13.5 (STANDARD) [id:9836612] | Donte DiVincenzo OVER FG3M 3.5 (DEMON) [id:9833070],Nikola Vučević OVER PTS 10.5 (GOBLIN) [id:9831750],Kel'el Ware UNDER PTS 13.5 (STANDARD) [id:9836612],Donte DiVincenzo OVER FG3M 3.5 (DEMON) [id:9833070]
3,Jusuf Nurkić OVER PR 14.5 (GOBLIN) [id:9844329] | Cason Wallace UNDER PA 12.5 (STANDARD) [id:9822036] | Tim Hardaway OVER PR 19.5 (DEMON) [id:9839518],0.29326284217580734,3.285369618927198,0.9634768320446392,6.0,pp_kernel,0.7000266613343998,0.004631768996194863,Jusuf Nurkić OVER PR 14.5 (GOBLIN) [id:9844329] | Cason Wallace UNDER PA 12.5 (STANDARD) [id:9822036] | Tim Hardaway OVER PR 19.5 (DEMON) [id:9839518],Jusuf Nurkić OVER PR 14.5 (GOBLIN) [id:9844329],Cason Wallace UNDER PA 12.5 (STANDARD) [id:9822036],Tim Hardaway OVER PR 19.5 (DEMON) [id:9839518]
3,Scoot Henderson OVER PTS 9.5 (GOBLIN) [id:9833499] | Collin Sexton UNDER AST 4 (STANDARD) [id:9847606] | Jamal Shead OVER PTS 7.5 (DEMON) [id:9834944],0.29977616189032813,3.2091335868826345,0.962021749669018,6.0,pp_kernel,0.6993601279744052,0.002990349327171431,Scoot Henderson OVER PTS 9.5 (GOBLIN) [id:9833499] | Collin Sexton UNDER AST 4 (STANDARD) [id:9847606] | Jamal Shead OVER PTS 7.5 (DEMON) [id:9834944],Scoot Henderson OVER PTS 9.5 (GOBLIN) [id:9833499],Collin Sexton UNDER AST 4 (STANDARD) [id:9847606],Jamal Shead OVER PTS 7.5 (DEMON) [id:9834944]
3,Donovan Mitchell OVER AST 3.5 (GOBLIN) [id:9857964] | Isaiah Collier UNDER RA 15 (STANDARD) [id:9839141] | RJ Barrett OVER PA 21.5 (DEMON) [id:9843973],0.31160534528069733,3.0802788641272225,0.9598313590171974,6.0,pp_kernel,0.7046923948543625,0.0012898232942086976,Donovan Mitchell OVER AST 3.5 (GOBLIN) [id:9857964] | Isaiah Collier UNDER RA 15 (STANDARD) [id:9839141] | RJ Barrett OVER PA 21.5 (DEMON) [id:9843973],Donovan Mitchell OVER AST 3.5 (GOBLIN) [id:9857964],Isaiah Collier UNDER RA 15 (STANDARD) [id:9839141],RJ Barrett OVER PA 21.5 (DEMON) [id:9843973]
3,Wendell Carter OVER REB 4.5 (GOBLIN) [id:9859212] | Pat Spencer UNDER RA 10 (STANDARD) [id:9846194] | Anthony Black OVER PTS 17.5 (DEMON) [id:9824394],0.3060671255231825,3.124827007059288,0.9564068198078458,6.0,pp_kernel,0.6987602479504099,0.0009025641025640964,Wendell Carter OVER REB 4.5 (GOBLIN) [id:9859212] | Pat Spencer UNDER RA 10 (STANDARD) [id:9846194] | Anthony Black OVER PTS 17.5 (DEMON) [id:9824394],Wendell Carter OVER REB 4.5 (GOBLIN) [id:9859212],Pat Spencer UNDER RA 10 (STANDARD) [id:9846194],Anthony Black OVER PTS 17.5 (DEMON) [id:9824394]
3,Jalen Johnson OVER REB 7.5 (GOBLIN) [id:9840842] | Scoot Henderson OVER PR 14.5 (STANDARD) [id:9834166] | Jaylon Tyson OVER FG3M 2.5 (DEMON) [id:9834309],0.28657377372961673,3.3336276242948624,0.9553302485034757,6.0,pp_kernel,0.6852962740785177,0.0,Jalen Johnson OVER REB 7.5 (GOBLIN) [id:9840842] | Scoot Henderson OVER PR 14.5 (STANDARD) [id:9834166] | Jaylon Tyson OVER FG3M 2.5 (DEMON) [id:9834309],Jalen Johnson OVER REB 7.5 (GOBLIN) [id:9840842],Scoot Henderson OVER PR 14.5 (STANDARD) [id:9834166],Jaylon Tyson OVER FG3M 2.5 (DEMON) [id:9834309]
3,Bobby Portis OVER PTS 8.5 (GOBLIN) [id:9843938] | Paul Reed UNDER PRA 23.5 (STANDARD) [id:9855432] | Derrick Jones OVER PTS 9.5 (DEMON) [id:9840923],0.33310384347978605,2.8454406979542837,0.9478272328823769,6.0,pp_kernel,0.7176897953742585,0.003983914007592016,Bobby Portis OVER PTS 8.5 (GOBLIN) [id:9843938] | Paul Reed UNDER PRA 23.5 (STANDARD) [id:9855432] | Derrick Jones OVER PTS 9.5 (DEMON) [id:9840923],Bobby Portis OVER PTS 8.5 (GOBLIN) [id:9843938],Paul Reed UNDER PRA 23.5 (STANDARD) [id:9855432],Derrick Jones OVER PTS 9.5 (DEMON) [id:9840923]
3,Jusuf Nurkić OVER PR 14.5 (GOBLIN) [id:9844329] | Alex Caruso UNDER PRA 13.5 (STANDARD) [id:9841250] | Anfernee Simons OVER FG3M 3.5 (DEMON) [id:9831356],0.32876539496554313,2.8157471509535266,0.9257202242063389,6.0,pp_kernel,0.7211557688462307,0.0,Jusuf Nurkić OVER PR 14.5 (GOBLIN) [id:9844329] | Alex Caruso UNDER PRA 13.5 (STANDARD) [id:9841250] | Anfernee Simons OVER FG3M 3.5 (DEMON) [id:9831356],Jusuf Nurkić OVER PR 14.5 (GOBLIN) [id:9844329],Alex Caruso UNDER PRA 13.5 (STANDARD) [id:9841250],Anfernee Simons OVER FG3M 3.5 (DEMON) [id:9831356]
3,Scoot Henderson OVER PA 11.5 (GOBLIN) [id:9847041] | Deni Avdija OVER REB 6 (STANDARD) [id:9847530] | Derrick White OVER RA 11.5 (DEMON) [id:9831477],0.3058272949443114,2.991411239572453,0.9148552074644526,6.0,pp_kernel,0.7097580483903219,0.0,Scoot Henderson OVER PA 11.5 (GOBLIN) [id:9847041] | Deni Avdija OVER REB 6 (STANDARD) [id:9847530] | Derrick White OVER RA 11.5 (DEMON) [id:9831477],Scoot Henderson OVER PA 11.5 (GOBLIN) [id:9847041],Deni Avdija OVER REB 6 (STANDARD) [id:9847530],Derrick White OVER RA 11.5 (DEMON) [id:9831477]
3,Sam Merrill OVER AST 0.5 (GOBLIN) [id:9838502] | Day'Ron Sharpe UNDER PRA 28.5 (STANDARD) [id:9855770] | Jaylon Tyson OVER RA 8.5 (DEMON) [id:9838474],0.3139560692462123,2.9138396757641187,0.9148176510165604,6.0,pp_kernel,0.7020929147503833,0.0014668133480014896,Sam Merrill OVER AST 0.5 (GOBLIN) [id:9838502] | Day'Ron Sharpe UNDER PRA 28.5 (STANDARD) [id:9855770] | Jaylon Tyson OVER RA 8.5 (DEMON) [id:9838474],Sam Merrill OVER AST 0.5 (GOBLIN) [id:9838502],Day'Ron Sharpe UNDER PRA 28.5 (STANDARD) [id:9855770],Jaylon Tyson OVER RA 8.5 (DEMON) [id:9838474]
3,Dennis Schröder OVER PA 9.5 (GOBLIN) [id:9844462] | Dylan Cardwell UNDER PTS 9.5 (STANDARD) [id:9839110] | Jerami Grant OVER REB 3.5 (DEMON) [id:9833468],0.3293463961291202,2.7728134644553024,0.9132161216566542,6.0,pp_kernel,0.7129574085182964,0.0019095357441222252,Dennis Schröder OVER PA 9.5 (GOBLIN) [id:9844462] | Dylan Cardwell UNDER PTS 9.5 (STANDARD) [id:9839110] | Jerami Grant OVER REB 3.5 (DEMON) [id:9833468],Dennis Schröder OVER PA 9.5 (GOBLIN) [id:9844462],Dylan Cardwell UNDER PTS 9.5 (STANDARD) [id:9839110],Jerami Grant OVER REB 3.5 (DEMON) [id:9833468]
3,Wendell Carter OVER PR 11.5 (GOBLIN) [id:9826953] | Nolan Traore UNDER PA 17.5 (STANDARD) [id:9842719] | Ty Jerome OVER AST 5.5 (DEMON) [id:9835136],0.27470286698426777,3.3121563746882083,0.9098588520270694,6.0,pp_kernel,0.6729654069186163,0.0005076299016987122,Wendell Carter OVER PR 11.5 (GOBLIN) [id:9826953] | Nolan Traore UNDER PA 17.5 (STANDARD) [id:9842719] | Ty Jerome OVER AST 5.5 (DEMON) [id:9835136],Wendell Carter OVER PR 11.5 (GOBLIN) [id:9826953],Nolan Traore UNDER PA 17.5 (STANDARD) [id:9842719],Ty Jerome OVER AST 5.5 (DEMON) [id:9835136]
