n_legs,legs,hit_prob,payout_mult,kernel_mult,payout_mult_eff,ev_mult,atlas_power_mult,pricing_engine,avg_p,avg_fragility,slip_key,pen_team,pen_family,pen_frag,pen_role_ctx,pen_total,role_ctx_bonus,role_ctx_on_legs,role_ctx_on_share,score_adj,players,rank_ev,beam_selected,leg_1,leg_2,leg_3,leg_4,q_leg_count,q_players
4,Rui Hachimura OVER REB 1.5 (GOBLIN) [id:10674125] | Sandro Mamukelashvili OVER REB 2.5 (GOBLIN) [id:10690622] | Dejounte Murray UNDER RA 12 (STANDARD) [id:10679689] | Jock Landale OVER REB 4 (STANDARD) [id:10680664],0.20711155515976334,10.0,0.776578380851208,7.76578380851208,1.6083835616154467,10.0,pp_kernel,0.6794567778455515,0.04276323120752798,Rui Hachimura OVER REB 1.5 (GOBLIN) [id:10674125] | Sandro Mamukelashvili OVER REB 2.5 (GOBLIN) [id:10690622] | Dejounte Murray UNDER RA 12 (STANDARD) [id:10679689] | Jock Landale OVER REB 4 (STANDARD) [id:10680664],0.0,0.0,0.0,0.0,0.0,0.0,0,0.0,1.6083835616154467,"['rui hachimura', 'sandro mamukelashvili', 'dejounte murray', 'jock landale']",1.6083835616154467,1,Rui Hachimura OVER REB 1.5 (GOBLIN) [id:10674125],Sandro Mamukelashvili OVER REB 2.5 (GOBLIN) [id:10690622],Dejounte Murray UNDER RA 12 (STANDARD) [id:10679689],Jock Landale OVER REB 4 (STANDARD) [id:10680664],0,
4,Rui Hachimura OVER PTS 5.5 (GOBLIN) [id:10674111] | Jeremiah Fears OVER AST 1.5 (GOBLIN) [id:10692076] | Darius Garland UNDER PA 28.5 (STANDARD) [id:10669733] | Jarace Walker UNDER AST 3.5 (STANDARD) [id:10675264],0.19730194631108428,10.0,0.7740712563192377,7.7407125631923765,1.5272576545525178,10.0,pp_kernel,0.6727357515698078,0.021489012471297763,Rui Hachimura OVER PTS 5.5 (GOBLIN) [id:10674111] | Jeremiah Fears OVER AST 1.5 (GOBLIN) [id:10692076] | Darius Garland UNDER PA 28.5 (STANDARD) [id:10669733] | Jarace Walker UNDER AST 3.5 (STANDARD) [id:10675264],0.0,0.0,0.0,0.0,0.0,0.0,0,0.0,1.5272576545525178,"['rui hachimura', 'jeremiah fears', 'darius garland', 'jarace walker']",1.5272576545525178,1,Rui Hachimura OVER PTS 5.5 (GOBLIN) [id:10674111],Jeremiah Fears OVER AST 1.5 (GOBLIN) [id:10692076],Darius Garland UNDER PA 28.5 (STANDARD) [id:10669733],Jarace Walker UNDER AST 3.5 (STANDARD) [id:10675264],0,
4,Rui Hachimura OVER PTS 4.5 (GOBLIN) [id:10674112] | Reed Sheppard OVER PTS 9.5 (GOBLIN) [id:10673877] | RJ Barrett UNDER PRA 31.5 (STANDARD) [id:10670432] | Daniel Gafford UNDER REB 8 (STANDARD) [id:10669865],0.19190478174172718,10.0,0.7623676478039385,7.6236764780393855,1.4630199705876876,10.0,pp_kernel,0.6672463131944788,0.022338390406070194,Rui Hachimura OVER PTS 4.5 (GOBLIN) [id:10674112] | Reed Sheppard OVER PTS 9.5 (GOBLIN) [id:10673877] | RJ Barrett UNDER PRA 31.5 (STANDARD) [id:10670432] | Daniel Gafford UNDER REB 8 (STANDARD) [id:10669865],0.0,0.0,0.0,0.0,0.0,0.0,0,0.0,1.4630199705876876,"['rui hachimura', 'reed sheppard', 'rj barrett', 'daniel gafford']",1.4630199705876876,1,Rui Hachimura OVER PTS 4.5 (GOBLIN) [id:10674112],Reed Sheppard OVER PTS 9.5 (GOBLIN) [id:10673877],RJ Barrett UNDER PRA 31.5 (STANDARD) [id:10670432],Daniel Gafford UNDER REB 8 (STANDARD) [id:10669865],0,
4,Amen Thompson OVER REB 4.5 (GOBLIN) [id:10688020] | Saddiq Bey OVER REB 3.5 (GOBLIN) [id:10692255] | Cody Williams UNDER PR 16.5 (STANDARD) [id:10676051] | Jakob Poeltl UNDER REB 9 (STANDARD) [id:10679783],0.20175081333074793,10.0,0.7886141450063795,7.8861414500637945,1.5910354515916945,10.0,pp_kernel,0.6825432965746069,0.02281163010702387,Amen Thompson OVER REB 4.5 (GOBLIN) [id:10688020] | Saddiq Bey OVER REB 3.5 (GOBLIN) [id:10692255] | Cody Williams UNDER PR 16.5 (STANDARD) [id:10676051] | Jakob Poeltl UNDER REB 9 (STANDARD) [id:10679783],0.0,0.0,0.0,0.0,0.0,0.0,0,0.0,1.5910354515916945,"['amen thompson', 'saddiq bey', 'cody williams', 'jakob poeltl']",1.5910354515916945,1,Amen Thompson OVER REB 4.5 (GOBLIN) [id:10688020],Saddiq Bey OVER REB 3.5 (GOBLIN) [id:10692255],Cody Williams UNDER PR 16.5 (STANDARD) [id:10676051],Jakob Poeltl UNDER REB 9 (STANDARD) [id:10679783],0,
4,Jeremiah Fears OVER PR 9.5 (GOBLIN) [id:10692092] | Jabari Smith OVER PR 14.5 (GOBLIN) [id:10673024] | Cody Williams UNDER PA 15.5 (STANDARD) [id:10676050] | Baylor Scheierman UNDER PTS 6.5 (STANDARD) [id:10674582],0.1977854737277764,10.0,0.7655240098265269,7.655240098265269,1.514095289335266,10.0,pp_kernel,0.6726904128241273,0.03501339399241534,Jeremiah Fears OVER PR 9.5 (GOBLIN) [id:10692092] | Jabari Smith OVER PR 14.5 (GOBLIN) [id:10673024] | Cody Williams UNDER PA 15.5 (STANDARD) [id:10676050] | Baylor Scheierman UNDER PTS 6.5 (STANDARD) [id:10674582],0.0,0.0,0.0,0.0,0.0,0.0,0,0.0,1.514095289335266,"['jeremiah fears', 'jabari smith', 'cody williams', 'baylor scheierman']",1.514095289335266,1,Jeremiah Fears OVER PR 9.5 (GOBLIN) [id:10692092],Jabari Smith OVER PR 14.5 (GOBLIN) [id:10673024],Cody Williams UNDER PA 15.5 (STANDARD) [id:10676050],Baylor Scheierman UNDER PTS 6.5 (STANDARD) [id:10674582],0,
4,Amen Thompson OVER REB 4.5 (GOBLIN) [id:10688020] | Dejounte Murray OVER PR 19.5 (GOBLIN) [id:10672193] | Baylor Scheierman UNDER FG3M 1.5 (STANDARD) [id:10670805] | Jonathan Kuminga OVER REB 5 (STANDARD) [id:10669912],0.17651872565829804,10.0,0.8356107846089845,8.356107846089845,1.4750095084550852,10.0,pp_kernel,0.660955456223906,0.044460802030265235,Amen Thompson OVER REB 4.5 (GOBLIN) [id:10688020] | Dejounte Murray OVER PR 19.5 (GOBLIN) [id:10672193] | Baylor Scheierman UNDER FG3M 1.5 (STANDARD) [id:10670805] | Jonathan Kuminga OVER REB 5 (STANDARD) [id:10669912],0.0,0.0,0.0,0.0,0.0,0.0,0,0.0,1.4750095084550852,"['amen thompson', 'dejounte murray', 'baylor scheierman', 'jonathan kuminga']",1.4750095084550852,1,Amen Thompson OVER REB 4.5 (GOBLIN) [id:10688020],Dejounte Murray OVER PR 19.5 (GOBLIN) [id:10672193],Baylor Scheierman UNDER FG3M 1.5 (STANDARD) [id:10670805],Jonathan Kuminga OVER REB 5 (STANDARD) [id:10669912],0,
