n_legs,legs,hit_prob,payout_mult,kernel_mult,payout_mult_eff,ev_mult,atlas_power_mult,pricing_engine,avg_p,avg_fragility,slip_key,pen_team,pen_family,pen_frag,pen_min_std,pen_role_ctx,pen_total,role_ctx_bonus,role_ctx_on_legs,role_ctx_on_share,score_adj,players,rank_ev,beam_selected,leg_1,leg_2,leg_3,leg_4,q_leg_count,q_players
4,Alex Caruso OVER PR 8.5 (GOBLIN) [id:10605296] | Ousmane Dieng OVER RA 7.5 (GOBLIN) [id:10603294] | Andrew Nembhard OVER AST 7 (STANDARD) [id:10602724] | Shai Gilgeous-Alexander UNDER PTS 33 (STANDARD) [id:10599677],0.5316217728639274,10.0,0.32929446698759496,3.2929446698759497,1.7506010833422725,10.0,pp_kernel,0.8543580514554421,0.07795174628789664,Alex Caruso OVER PR 8.5 (GOBLIN) [id:10605296] | Ousmane Dieng OVER RA 7.5 (GOBLIN) [id:10603294] | Andrew Nembhard OVER AST 7 (STANDARD) [id:10602724] | Shai Gilgeous-Alexander UNDER PTS 33 (STANDARD) [id:10599677],0.0,0.0,0.0,0.0,0.0,0.0,0.0,3,0.75,2.2006010833422724,"['alex caruso', 'ousmane dieng', 'andrew nembhard', 'shai gilgeous-alexander']",1.7506010833422725,1,Alex Caruso OVER PR 8.5 (GOBLIN) [id:10605296],Ousmane Dieng OVER RA 7.5 (GOBLIN) [id:10603294],Andrew Nembhard OVER AST 7 (STANDARD) [id:10602724],Shai Gilgeous-Alexander UNDER PTS 33 (STANDARD) [id:10599677],0,
4,Alex Caruso OVER PR 8.5 (GOBLIN) [id:10605296] | Kyle Kuzma OVER FG3M 0.5 (GOBLIN) [id:10603007] | Andrew Nembhard OVER PRA 26.5 (STANDARD) [id:10602731] | Ajay Mitchell UNDER PA 17.5 (STANDARD) [id:10602236],0.4840056499146034,10.0,0.352698243158694,3.5269824315869402,1.7070794240376252,10.0,pp_kernel,0.834401962164109,0.03307362940806797,Alex Caruso OVER PR 8.5 (GOBLIN) [id:10605296] | Kyle Kuzma OVER FG3M 0.5 (GOBLIN) [id:10603007] | Andrew Nembhard OVER PRA 26.5 (STANDARD) [id:10602731] | Ajay Mitchell UNDER PA 17.5 (STANDARD) [id:10602236],0.0,0.0,0.0,0.0,0.0,0.0,0.0,3,0.75,2.157079424037625,"['alex caruso', 'kyle kuzma', 'andrew nembhard', 'ajay mitchell']",1.7070794240376252,1,Alex Caruso OVER PR 8.5 (GOBLIN) [id:10605296],Kyle Kuzma OVER FG3M 0.5 (GOBLIN) [id:10603007],Andrew Nembhard OVER PRA 26.5 (STANDARD) [id:10602731],Ajay Mitchell UNDER PA 17.5 (STANDARD) [id:10602236],0,
4,Aaron Nesmith OVER PTS 11.5 (GOBLIN) [id:10605650] | Isaiah Joe OVER PTS 3.5 (GOBLIN) [id:10609204] | Ousmane Dieng OVER RA 8.5 (STANDARD) [id:10603293] | Shai Gilgeous-Alexander UNDER REB 5 (STANDARD) [id:10599173],0.5200194566673066,10.0,0.32304162774748035,3.2304162774748035,1.6798793174216706,10.0,pp_kernel,0.8496702589453624,0.0481704786107053,Aaron Nesmith OVER PTS 11.5 (GOBLIN) [id:10605650] | Isaiah Joe OVER PTS 3.5 (GOBLIN) [id:10609204] | Ousmane Dieng OVER RA 8.5 (STANDARD) [id:10603293] | Shai Gilgeous-Alexander UNDER REB 5 (STANDARD) [id:10599173],0.0,0.0022222222222222222,0.0,0.0,0.0,0.0022222222222222222,0.0,3,0.75,2.1276570951994485,"['aaron nesmith', 'isaiah joe', 'ousmane dieng', 'shai gilgeous-alexander']",1.6798793174216706,1,Aaron Nesmith OVER PTS 11.5 (GOBLIN) [id:10605650],Isaiah Joe OVER PTS 3.5 (GOBLIN) [id:10609204],Ousmane Dieng OVER RA 8.5 (STANDARD) [id:10603293],Shai Gilgeous-Alexander UNDER REB 5 (STANDARD) [id:10599173],0,
4,Brandon Williams OVER PR 11.5 (GOBLIN) [id:10606522] | Josh Hart OVER REB 5.5 (GOBLIN) [id:10596957] | Donte DiVincenzo UNDER PRA 18.5 (STANDARD) [id:10599851] | Andrew Nembhard OVER RA 9.5 (STANDARD) [id:10603538],0.49570677014524755,10.0,0.36950520628834527,3.6950520628834527,1.8316623236104905,10.0,pp_kernel,0.8400603578904704,0.09617327226916111,Brandon Williams OVER PR 11.5 (GOBLIN) [id:10606522] | Josh Hart OVER REB 5.5 (GOBLIN) [id:10596957] | Donte DiVincenzo UNDER PRA 18.5 (STANDARD) [id:10599851] | Andrew Nembhard OVER RA 9.5 (STANDARD) [id:10603538],0.0,0.0,0.0,0.0,0.0,0.0,0.0,0,0.0,1.8316623236104905,"['brandon williams', 'josh hart', 'donte divincenzo', 'andrew nembhard']",1.8316623236104905,1,Brandon Williams OVER PR 11.5 (GOBLIN) [id:10606522],Josh Hart OVER REB 5.5 (GOBLIN) [id:10596957],Donte DiVincenzo UNDER PRA 18.5 (STANDARD) [id:10599851],Andrew Nembhard OVER RA 9.5 (STANDARD) [id:10603538],0,
4,Gary Payton OVER PTS 7.5 (GOBLIN) [id:10603369] | Josh Hart OVER REB 5.5 (GOBLIN) [id:10596957] | Karl-Anthony Towns OVER RA 15.5 (STANDARD) [id:10596684] | Jaylon Tyson UNDER RA 6.5 (STANDARD) [id:10601330],0.49641359288751846,10.0,0.36832433318507324,3.6832433318507323,1.8284120558430166,10.0,pp_kernel,0.8403428296433467,0.1246742163615169,Gary Payton OVER PTS 7.5 (GOBLIN) [id:10603369] | Josh Hart OVER REB 5.5 (GOBLIN) [id:10596957] | Karl-Anthony Towns OVER RA 15.5 (STANDARD) [id:10596684] | Jaylon Tyson UNDER RA 6.5 (STANDARD) [id:10601330],0.0,0.0022222222222222222,0.0,0.0,0.0,0.0022222222222222222,0.0,0,0.0,1.8261898336207945,"['gary payton', 'josh hart', 'karl-anthony towns', 'jaylon tyson']",1.8284120558430166,1,Gary Payton OVER PTS 7.5 (GOBLIN) [id:10603369],Josh Hart OVER REB 5.5 (GOBLIN) [id:10596957],Karl-Anthony Towns OVER RA 15.5 (STANDARD) [id:10596684],Jaylon Tyson UNDER RA 6.5 (STANDARD) [id:10601330],0,
4,Josh Hart OVER REB 6.5 (GOBLIN) [id:10603309] | Quinten Post OVER FG3M 1.5 (GOBLIN) [id:10597725] | Jalen Brunson OVER RA 11.5 (STANDARD) [id:10597566] | Julius Randle UNDER PTS 17.5 (STANDARD) [id:10598995],0.5091539579701585,10.0,0.3581260679725267,3.581260679725267,1.8234130496050198,10.0,pp_kernel,0.8455660033782219,0.11796806876400193,Josh Hart OVER REB 6.5 (GOBLIN) [id:10603309] | Quinten Post OVER FG3M 1.5 (GOBLIN) [id:10597725] | Jalen Brunson OVER RA 11.5 (STANDARD) [id:10597566] | Julius Randle UNDER PTS 17.5 (STANDARD) [id:10598995],0.0,0.0,0.0,0.0,0.0,0.0,0.0,0,0.0,1.8234130496050198,"['josh hart', 'quinten post', 'jalen brunson', 'julius randle']",1.8234130496050198,1,Josh Hart OVER REB 6.5 (GOBLIN) [id:10603309],Quinten Post OVER FG3M 1.5 (GOBLIN) [id:10597725],Jalen Brunson OVER RA 11.5 (STANDARD) [id:10597566],Julius Randle UNDER PTS 17.5 (STANDARD) [id:10598995],0,
