n_legs,legs,hit_prob,payout_mult,kernel_mult,payout_mult_eff,ev_mult,atlas_power_mult,pricing_engine,avg_p,avg_fragility,slip_key,pen_team,pen_family,pen_frag,pen_min_std,pen_role_ctx,pen_total,role_ctx_bonus,role_ctx_on_legs,role_ctx_on_share,score_adj,players,rank_ev,beam_selected,leg_1,leg_2,leg_3,leg_4,q_leg_count,q_players
4,Jayson Tatum OVER REB 7.5 (GOBLIN) [id:11808122] | Sam Hauser UNDER PR 10.5 (STANDARD) [id:11807511] | VJ Edgecombe OVER PA 14.5 (STANDARD) [id:11807684] | Joel Embiid OVER PTS 28.5 (DEMON) [id:11808149],0.20712682507983451,10.0,0.4366275162609269,4.366275162609269,0.904372711856196,10.0,pp_kernel,0.6858232747940398,0.06269919043528112,Jayson Tatum OVER REB 7.5 (GOBLIN) [id:11808122] | Sam Hauser UNDER PR 10.5 (STANDARD) [id:11807511] | VJ Edgecombe OVER PA 14.5 (STANDARD) [id:11807684] | Joel Embiid OVER PTS 28.5 (DEMON) [id:11808149],0.0,0.0,0.0,0.0,0.0,0.0,0.0,0,0.0,0.904372711856196,"['jayson tatum', 'sam hauser', 'vj edgecombe', 'joel embiid']",0.904372711856196,1,Jayson Tatum OVER REB 7.5 (GOBLIN) [id:11808122],Sam Hauser UNDER PR 10.5 (STANDARD) [id:11807511],VJ Edgecombe OVER PA 14.5 (STANDARD) [id:11807684],Joel Embiid OVER PTS 28.5 (DEMON) [id:11808149],0,
4,Jaylen Brown OVER RA 7.5 (GOBLIN) [id:11823884] | Paul George OVER PTS 15.5 (STANDARD) [id:11807492] | Tyrese Maxey UNDER PR 28 (STANDARD) [id:11807526] | Neemias Queta OVER PRA 19.5 (DEMON) [id:11808833],0.24189679525916216,10.0,0.37286530171706195,3.7286530171706196,0.9019492154869786,10.0,pp_kernel,0.714007886906507,0.0889456052323707,Jaylen Brown OVER RA 7.5 (GOBLIN) [id:11823884] | Paul George OVER PTS 15.5 (STANDARD) [id:11807492] | Tyrese Maxey UNDER PR 28 (STANDARD) [id:11807526] | Neemias Queta OVER PRA 19.5 (DEMON) [id:11808833],0.0,0.0,0.0,0.0,0.0,0.0,0.0,0,0.0,0.9019492154869786,"['jaylen brown', 'paul george', 'tyrese maxey', 'neemias queta']",0.9019492154869786,1,Jaylen Brown OVER RA 7.5 (GOBLIN) [id:11823884],Paul George OVER PTS 15.5 (STANDARD) [id:11807492],Tyrese Maxey UNDER PR 28 (STANDARD) [id:11807526],Neemias Queta OVER PRA 19.5 (DEMON) [id:11808833],0,
4,Nikola Vučević OVER RA 4.5 (GOBLIN) [id:11808852] | Payton Pritchard UNDER PA 18.5 (STANDARD) [id:11808264] | Joel Embiid OVER PRA 39.5 (STANDARD) [id:11807680] | Quentin Grimes OVER PR 11.5 (DEMON) [id:11825571],0.23790821655058236,10.0,0.3789166064301697,3.789166064301697,0.901473740572006,10.0,pp_kernel,0.7110038186586058,0.04899535735481987,Nikola Vučević OVER RA 4.5 (GOBLIN) [id:11808852] | Payton Pritchard UNDER PA 18.5 (STANDARD) [id:11808264] | Joel Embiid OVER PRA 39.5 (STANDARD) [id:11807680] | Quentin Grimes OVER PR 11.5 (DEMON) [id:11825571],0.0,0.0,0.0,0.0,0.0,0.0,0.0,0,0.0,0.901473740572006,"['nikola vučević', 'payton pritchard', 'joel embiid', 'quentin grimes']",0.901473740572006,1,Nikola Vučević OVER RA 4.5 (GOBLIN) [id:11808852],Payton Pritchard UNDER PA 18.5 (STANDARD) [id:11808264],Joel Embiid OVER PRA 39.5 (STANDARD) [id:11807680],Quentin Grimes OVER PR 11.5 (DEMON) [id:11825571],0,
4,Jaylen Brown OVER RA 7.5 (GOBLIN) [id:11823884] | Kelly Oubre OVER RA 6.5 (STANDARD) [id:11817168] | Tyrese Maxey UNDER PRA 34.5 (STANDARD) [id:11808328] | Neemias Queta OVER PRA 19.5 (DEMON) [id:11808833],0.23229158185028792,10.0,0.38845376302417445,3.8845376302417445,0.9023453908858237,10.0,pp_kernel,0.706862060697493,0.11028800507962322,Jaylen Brown OVER RA 7.5 (GOBLIN) [id:11823884] | Kelly Oubre OVER RA 6.5 (STANDARD) [id:11817168] | Tyrese Maxey UNDER PRA 34.5 (STANDARD) [id:11808328] | Neemias Queta OVER PRA 19.5 (DEMON) [id:11808833],0.0,0.0044444444444444444,0.0,0.0,0.0,0.0044444444444444444,0.0,0,0.0,0.8979009464413792,"['jaylen brown', 'kelly oubre', 'tyrese maxey', 'neemias queta']",0.9023453908858237,1,Jaylen Brown OVER RA 7.5 (GOBLIN) [id:11823884],Kelly Oubre OVER RA 6.5 (STANDARD) [id:11817168],Tyrese Maxey UNDER PRA 34.5 (STANDARD) [id:11808328],Neemias Queta OVER PRA 19.5 (DEMON) [id:11808833],0,
4,Jaylen Brown OVER RA 9.5 (GOBLIN) [id:11807942] | VJ Edgecombe OVER PTS 11 (STANDARD) [id:11808351] | Jayson Tatum OVER AST 5.5 (STANDARD) [id:11815952] | Quentin Grimes OVER PR 11.5 (DEMON) [id:11825571],0.2245927245588765,10.0,0.39762345955026307,3.9762345955026306,0.893033361289198,10.0,pp_kernel,0.6991007096377864,0.06263532276761648,Jaylen Brown OVER RA 9.5 (GOBLIN) [id:11807942] | VJ Edgecombe OVER PTS 11 (STANDARD) [id:11808351] | Jayson Tatum OVER AST 5.5 (STANDARD) [id:11815952] | Quentin Grimes OVER PR 11.5 (DEMON) [id:11825571],0.0,0.0,0.0,0.0,0.0,0.0,0.0,0,0.0,0.893033361289198,"['jaylen brown', 'vj edgecombe', 'jayson tatum', 'quentin grimes']",0.893033361289198,1,Jaylen Brown OVER RA 9.5 (GOBLIN) [id:11807942],VJ Edgecombe OVER PTS 11 (STANDARD) [id:11808351],Jayson Tatum OVER AST 5.5 (STANDARD) [id:11815952],Quentin Grimes OVER PR 11.5 (DEMON) [id:11825571],0,
4,Jaylen Brown OVER PRA 29.5 (GOBLIN) [id:11807933] | Quentin Grimes UNDER AST 1.5 (STANDARD) [id:11816123] | Kelly Oubre OVER PTS 9 (STANDARD) [id:11808172] | Neemias Queta OVER PRA 19.5 (DEMON) [id:11808833],0.2214965379857841,10.0,0.40363928877045857,4.036392887704586,0.8940470505770075,10.0,pp_kernel,0.6966535627712456,0.04611773005097629,Jaylen Brown OVER PRA 29.5 (GOBLIN) [id:11807933] | Quentin Grimes UNDER AST 1.5 (STANDARD) [id:11816123] | Kelly Oubre OVER PTS 9 (STANDARD) [id:11808172] | Neemias Queta OVER PRA 19.5 (DEMON) [id:11808833],0.0,0.0022222222222222222,0.0,0.0,0.0,0.0022222222222222222,0.0,0,0.0,0.8918248283547853,"['jaylen brown', 'quentin grimes', 'kelly oubre', 'neemias queta']",0.8940470505770075,1,Jaylen Brown OVER PRA 29.5 (GOBLIN) [id:11807933],Quentin Grimes UNDER AST 1.5 (STANDARD) [id:11816123],Kelly Oubre OVER PTS 9 (STANDARD) [id:11808172],Neemias Queta OVER PRA 19.5 (DEMON) [id:11808833],0,
