n_legs,legs,hit_prob,payout_mult,ev_mult,atlas_power_mult,pricing_engine,avg_p,avg_fragility,slip_key,leg_1,leg_2,leg_3
3,Cameron Johnson OVER PRA 13.5 (GOBLIN) [id:9933702] | Jaylon Tyson OVER PRA 18.5 (STANDARD) [id:9922007] | Paul Reed UNDER PA 14.5 (STANDARD) [id:9917326],0.5086952765115902,3.9788191879782384,2.024006527018211,6.0,pp_kernel,0.8039392121575685,0.003524955938050769,Cameron Johnson OVER PRA 13.5 (GOBLIN) [id:9933702] | Jaylon Tyson OVER PRA 18.5 (STANDARD) [id:9922007] | Paul Reed UNDER PA 14.5 (STANDARD) [id:9917326],Cameron Johnson OVER PRA 13.5 (GOBLIN) [id:9933702],Jaylon Tyson OVER PRA 18.5 (STANDARD) [id:9922007],Paul Reed UNDER PA 14.5 (STANDARD) [id:9917326]
3,Franz Wagner OVER AST 1.5 (GOBLIN) [id:9919054] | Tim Hardaway OVER PTS 12.5 (STANDARD) [id:9917509] | Paul Reed UNDER PTS 12.5 (STANDARD) [id:9917257],0.4966886154990932,3.9541603579480515,1.9639864336506165,6.0,pp_kernel,0.8008065053655935,0.004006501115016849,Franz Wagner OVER AST 1.5 (GOBLIN) [id:9919054] | Tim Hardaway OVER PTS 12.5 (STANDARD) [id:9917509] | Paul Reed UNDER PTS 12.5 (STANDARD) [id:9917257],Franz Wagner OVER AST 1.5 (GOBLIN) [id:9919054],Tim Hardaway OVER PTS 12.5 (STANDARD) [id:9917509],Paul Reed UNDER PTS 12.5 (STANDARD) [id:9917257]
3,Domantas Sabonis OVER RA 9.5 (GOBLIN) [id:9926165] | Nikola Vučević OVER PR 21 (STANDARD) [id:9918033] | Duncan Robinson OVER PA 12.5 (STANDARD) [id:9923218],0.4729089052330083,3.9500771185184806,1.8680266457045307,6.0,pp_kernel,0.7844764380457242,0.0,Domantas Sabonis OVER RA 9.5 (GOBLIN) [id:9926165] | Nikola Vučević OVER PR 21 (STANDARD) [id:9918033] | Duncan Robinson OVER PA 12.5 (STANDARD) [id:9923218],Domantas Sabonis OVER RA 9.5 (GOBLIN) [id:9926165],Nikola Vučević OVER PR 21 (STANDARD) [id:9918033],Duncan Robinson OVER PA 12.5 (STANDARD) [id:9923218]
3,DeMar DeRozan OVER PTS 11.5 (GOBLIN) [id:9921008] | Cameron Johnson OVER FG3M 1.5 (STANDARD) [id:9917497] | Kristaps Porziņģis OVER PA 14.5 (STANDARD) [id:9933970],0.45816268762523704,3.9932324677339905,1.8295501197293627,6.0,pp_kernel,0.7722122242218222,0.0,DeMar DeRozan OVER PTS 11.5 (GOBLIN) [id:9921008] | Cameron Johnson OVER FG3M 1.5 (STANDARD) [id:9917497] | Kristaps Porziņģis OVER PA 14.5 (STANDARD) [id:9933970],DeMar DeRozan OVER PTS 11.5 (GOBLIN) [id:9921008],Cameron Johnson OVER FG3M 1.5 (STANDARD) [id:9917497],Kristaps Porziņģis OVER PA 14.5 (STANDARD) [id:9933970]
3,Cameron Johnson OVER REB 2.5 (GOBLIN) [id:9920862] | Nikola Vučević OVER PR 21 (STANDARD) [id:9918033] | T.J. McConnell OVER PR 8.5 (STANDARD) [id:9934530],0.4463491697376862,4.0053931991388705,1.7878039289086096,6.0,pp_kernel,0.7658135039658736,0.0,Cameron Johnson OVER REB 2.5 (GOBLIN) [id:9920862] | Nikola Vučević OVER PR 21 (STANDARD) [id:9918033] | T.J. McConnell OVER PR 8.5 (STANDARD) [id:9934530],Cameron Johnson OVER REB 2.5 (GOBLIN) [id:9920862],Nikola Vučević OVER PR 21 (STANDARD) [id:9918033],T.J. McConnell OVER PR 8.5 (STANDARD) [id:9934530]
3,Josh Giddey OVER AST 5.5 (GOBLIN) [id:9918878] | Jarrett Allen OVER RA 10.5 (STANDARD) [id:9921983] | Paul Reed UNDER PRA 23.5 (STANDARD) [id:9917262],0.4190844694698291,4.003225633191167,1.6776896906539407,6.0,pp_kernel,0.7596813970539226,0.003983914007592016,Josh Giddey OVER AST 5.5 (GOBLIN) [id:9918878] | Jarrett Allen OVER RA 10.5 (STANDARD) [id:9921983] | Paul Reed UNDER PRA 23.5 (STANDARD) [id:9917262],Josh Giddey OVER AST 5.5 (GOBLIN) [id:9918878],Jarrett Allen OVER RA 10.5 (STANDARD) [id:9921983],Paul Reed UNDER PRA 23.5 (STANDARD) [id:9917262]
3,Bub Carrington OVER PTS 5.5 (GOBLIN) [id:9932108] | Kon Knueppel UNDER PRA 28.5 (STANDARD) [id:9918244] | Kristaps Porziņģis OVER PTS 12 (STANDARD) [id:9922998],0.4040113565364832,3.946006790328351,1.594231556262731,6.0,pp_kernel,0.7490835166300074,0.0,Bub Carrington OVER PTS 5.5 (GOBLIN) [id:9932108] | Kon Knueppel UNDER PRA 28.5 (STANDARD) [id:9918244] | Kristaps Porziņģis OVER PTS 12 (STANDARD) [id:9922998],Bub Carrington OVER PTS 5.5 (GOBLIN) [id:9932108],Kon Knueppel UNDER PRA 28.5 (STANDARD) [id:9918244],Kristaps Porziņģis OVER PTS 12 (STANDARD) [id:9922998]
3,Jalen Smith OVER PR 14.5 (GOBLIN) [id:9919406] | Jalen Brunson UNDER PR 29.5 (STANDARD) [id:9917548] | Mitchell Robinson OVER PR 11.5 (STANDARD) [id:9925936],0.3965324348330358,4.012410637580056,1.5910509596695932,6.0,pp_kernel,0.7362194227821103,0.0017380509000620697,Jalen Smith OVER PR 14.5 (GOBLIN) [id:9919406] | Jalen Brunson UNDER PR 29.5 (STANDARD) [id:9917548] | Mitchell Robinson OVER PR 11.5 (STANDARD) [id:9925936],Jalen Smith OVER PR 14.5 (GOBLIN) [id:9919406],Jalen Brunson UNDER PR 29.5 (STANDARD) [id:9917548],Mitchell Robinson OVER PR 11.5 (STANDARD) [id:9925936]
3,Amen Thompson OVER AST 4.5 (GOBLIN) [id:9918163] | Julian Champagnie OVER PR 10.5 (STANDARD) [id:9923445] | Tim Hardaway OVER PR 14.5 (STANDARD) [id:9917510],0.3883991115770532,4.063816739609235,1.578382811276184,6.0,pp_kernel,0.7332200226621343,0.0001589382922080331,Amen Thompson OVER AST 4.5 (GOBLIN) [id:9918163] | Julian Champagnie OVER PR 10.5 (STANDARD) [id:9923445] | Tim Hardaway OVER PR 14.5 (STANDARD) [id:9917510],Amen Thompson OVER AST 4.5 (GOBLIN) [id:9918163],Julian Champagnie OVER PR 10.5 (STANDARD) [id:9923445],Tim Hardaway OVER PR 14.5 (STANDARD) [id:9917510]
3,Isaac Okoro OVER AST 0.5 (GOBLIN) [id:9930055] | Tyrese Maxey UNDER PRA 38.5 (STANDARD) [id:9921503] | OG Anunoby OVER RA 6.5 (STANDARD) [id:9923222],0.3914002751067718,4.021028778290659,1.5738317700352102,6.0,pp_kernel,0.7325534893021395,0.0,Isaac Okoro OVER AST 0.5 (GOBLIN) [id:9930055] | Tyrese Maxey UNDER PRA 38.5 (STANDARD) [id:9921503] | OG Anunoby OVER RA 6.5 (STANDARD) [id:9923222],Isaac Okoro OVER AST 0.5 (GOBLIN) [id:9930055],Tyrese Maxey UNDER PRA 38.5 (STANDARD) [id:9921503],OG Anunoby OVER RA 6.5 (STANDARD) [id:9923222]
3,OG Anunoby OVER PR 14.5 (GOBLIN) [id:9919164] | Franz Wagner OVER PA 18.5 (STANDARD) [id:9919060] | Kon Knueppel UNDER PR 24.5 (STANDARD) [id:9918243],0.3974964625247297,3.9574455905775303,1.5730706228886582,6.0,pp_kernel,0.744884356462041,0.0015068918140318565,OG Anunoby OVER PR 14.5 (GOBLIN) [id:9919164] | Franz Wagner OVER PA 18.5 (STANDARD) [id:9919060] | Kon Knueppel UNDER PR 24.5 (STANDARD) [id:9918243],OG Anunoby OVER PR 14.5 (GOBLIN) [id:9919164],Franz Wagner OVER PA 18.5 (STANDARD) [id:9919060],Kon Knueppel UNDER PR 24.5 (STANDARD) [id:9918243]
3,Kristaps Porziņģis OVER PRA 17.5 (GOBLIN) [id:9933974] | Jakob Poeltl OVER PR 14.5 (STANDARD) [id:9918721] | Franz Wagner OVER PA 18.5 (STANDARD) [id:9919060],0.3911475531322851,4.013731842690854,1.5699613891976654,6.0,pp_kernel,0.7338199026861294,0.0015068918140318565,Kristaps Porziņģis OVER PRA 17.5 (GOBLIN) [id:9933974] | Jakob Poeltl OVER PR 14.5 (STANDARD) [id:9918721] | Franz Wagner OVER PA 18.5 (STANDARD) [id:9919060],Kristaps Porziņģis OVER PRA 17.5 (GOBLIN) [id:9933974],Jakob Poeltl OVER PR 14.5 (STANDARD) [id:9918721],Franz Wagner OVER PA 18.5 (STANDARD) [id:9919060]
3,Dyson Daniels OVER PTS 7.5 (GOBLIN) [id:9929548] | Evan Mobley OVER AST 3.5 (STANDARD) [id:9918469] | Julian Champagnie OVER PRA 11.5 (STANDARD) [id:9923446],0.38241755943417305,4.032247619600782,1.5420022937219848,6.0,pp_kernel,0.7332200226621343,0.0,Dyson Daniels OVER PTS 7.5 (GOBLIN) [id:9929548] | Evan Mobley OVER AST 3.5 (STANDARD) [id:9918469] | Julian Champagnie OVER PRA 11.5 (STANDARD) [id:9923446],Dyson Daniels OVER PTS 7.5 (GOBLIN) [id:9929548],Evan Mobley OVER AST 3.5 (STANDARD) [id:9918469],Julian Champagnie OVER PRA 11.5 (STANDARD) [id:9923446]
3,Nickeil Alexander-Walker OVER PRA 19.5 (GOBLIN) [id:9929510] | T.J. McConnell OVER PR 8.5 (STANDARD) [id:9934530] | Karl-Anthony Towns UNDER PTS 18.5 (STANDARD) [id:9917559],0.3872729273927149,3.9541603579480515,1.5313392572027673,6.0,pp_kernel,0.7374191828301008,0.0,Nickeil Alexander-Walker OVER PRA 19.5 (GOBLIN) [id:9929510] | T.J. McConnell OVER PR 8.5 (STANDARD) [id:9934530] | Karl-Anthony Towns UNDER PTS 18.5 (STANDARD) [id:9917559],Nickeil Alexander-Walker OVER PRA 19.5 (GOBLIN) [id:9929510],T.J. McConnell OVER PR 8.5 (STANDARD) [id:9934530],Karl-Anthony Towns UNDER PTS 18.5 (STANDARD) [id:9917559]
3,Jabari Smith OVER REB 5.5 (GOBLIN) [id:9918210] | Jakob Poeltl OVER PA 9.5 (STANDARD) [id:9923713] | Domantas Sabonis OVER RA 11.5 (STANDARD) [id:9919225],0.37474966119932307,4.027155365881207,1.5091751089610181,6.0,pp_kernel,0.7258215023661934,0.0,Jabari Smith OVER REB 5.5 (GOBLIN) [id:9918210] | Jakob Poeltl OVER PA 9.5 (STANDARD) [id:9923713] | Domantas Sabonis OVER RA 11.5 (STANDARD) [id:9919225],Jabari Smith OVER REB 5.5 (GOBLIN) [id:9918210],Jakob Poeltl OVER PA 9.5 (STANDARD) [id:9923713],Domantas Sabonis OVER RA 11.5 (STANDARD) [id:9919225]
3,Nikola Vučević OVER PA 11.5 (GOBLIN) [id:9920682] | Tim Hardaway OVER PA 13.5 (STANDARD) [id:9935368] | Collin Gillespie UNDER PA 18.5 (STANDARD) [id:9917874],0.38196620607635373,3.905493170263707,1.4917664091027392,6.0,pp_kernel,0.7381523695260949,0.00599018848437902,Nikola Vučević OVER PA 11.5 (GOBLIN) [id:9920682] | Tim Hardaway OVER PA 13.5 (STANDARD) [id:9935368] | Collin Gillespie UNDER PA 18.5 (STANDARD) [id:9917874],Nikola Vučević OVER PA 11.5 (GOBLIN) [id:9920682],Tim Hardaway OVER PA 13.5 (STANDARD) [id:9935368],Collin Gillespie UNDER PA 18.5 (STANDARD) [id:9917874]
3,Josh Giddey OVER FG3M 0.5 (GOBLIN) [id:9918733] | Ausar Thompson OVER REB 5.5 (STANDARD) [id:9917199] | OG Anunoby OVER PR 19.5 (STANDARD) [id:9917250],0.37425774203785417,3.9850478910502245,1.4914350256171698,6.0,pp_kernel,0.7263547290541892,0.0,Josh Giddey OVER FG3M 0.5 (GOBLIN) [id:9918733] | Ausar Thompson OVER REB 5.5 (STANDARD) [id:9917199] | OG Anunoby OVER PR 19.5 (STANDARD) [id:9917250],Josh Giddey OVER FG3M 0.5 (GOBLIN) [id:9918733],Ausar Thompson OVER REB 5.5 (STANDARD) [id:9917199],OG Anunoby OVER PR 19.5 (STANDARD) [id:9917250]
3,Onyeka Okongwu OVER PR 19.5 (GOBLIN) [id:9929557] | Jaylon Tyson OVER PRA 18.5 (STANDARD) [id:9922007] | Kelly Oubre UNDER PRA 22.5 (STANDARD) [id:9921361],0.3682505524005474,4.034735174412411,1.4857934567672892,6.0,pp_kernel,0.7175564887022595,0.002734107997265901,Onyeka Okongwu OVER PR 19.5 (GOBLIN) [id:9929557] | Jaylon Tyson OVER PRA 18.5 (STANDARD) [id:9922007] | Kelly Oubre UNDER PRA 22.5 (STANDARD) [id:9921361],Onyeka Okongwu OVER PR 19.5 (GOBLIN) [id:9929557],Jaylon Tyson OVER PRA 18.5 (STANDARD) [id:9922007],Kelly Oubre UNDER PRA 22.5 (STANDARD) [id:9921361]
3,Julian Champagnie OVER REB 2.5 (GOBLIN) [id:9933035] | Grant Williams UNDER PRA 17.5 (STANDARD) [id:9918199] | Noah Clowney UNDER PA 14.5 (STANDARD) [id:9922741],0.375668995770253,3.9413903628824536,1.4806581595626043,6.0,pp_kernel,0.7386855962140905,0.006222293255670094,Julian Champagnie OVER REB 2.5 (GOBLIN) [id:9933035] | Grant Williams UNDER PRA 17.5 (STANDARD) [id:9918199] | Noah Clowney UNDER PA 14.5 (STANDARD) [id:9922741],Julian Champagnie OVER REB 2.5 (GOBLIN) [id:9933035],Grant Williams UNDER PRA 17.5 (STANDARD) [id:9918199],Noah Clowney UNDER PA 14.5 (STANDARD) [id:9922741]
3,James Harden OVER AST 6.5 (GOBLIN) [id:9920717] | Devin Vassell OVER REB 3.5 (STANDARD) [id:9917807] | Franz Wagner OVER PA 18.5 (STANDARD) [id:9919060],0.36470192492089887,4.018897394506103,1.465699615835961,6.0,pp_kernel,0.7182896753982537,0.0015068918140318565,James Harden OVER AST 6.5 (GOBLIN) [id:9920717] | Devin Vassell OVER REB 3.5 (STANDARD) [id:9917807] | Franz Wagner OVER PA 18.5 (STANDARD) [id:9919060],James Harden OVER AST 6.5 (GOBLIN) [id:9920717],Devin Vassell OVER REB 3.5 (STANDARD) [id:9917807],Franz Wagner OVER PA 18.5 (STANDARD) [id:9919060]
3,Tobias Harris OVER PR 14.5 (GOBLIN) [id:9919705] | Immanuel Quickley OVER FG3M 2.5 (STANDARD) [id:9918700] | Paul Reed UNDER PTS 12.5 (STANDARD) [id:9917257],0.36058740950592255,4.06206125804608,1.464728146293205,6.0,pp_kernel,0.7202226221422382,0.004006501115016849,Tobias Harris OVER PR 14.5 (GOBLIN) [id:9919705] | Immanuel Quickley OVER FG3M 2.5 (STANDARD) [id:9918700] | Paul Reed UNDER PTS 12.5 (STANDARD) [id:9917257],Tobias Harris OVER PR 14.5 (GOBLIN) [id:9919705],Immanuel Quickley OVER FG3M 2.5 (STANDARD) [id:9918700],Paul Reed UNDER PTS 12.5 (STANDARD) [id:9917257]
3,Mikal Bridges OVER AST 2.5 (GOBLIN) [id:9919130] | T.J. McConnell OVER PTS 6.5 (STANDARD) [id:9929603] | Grant Williams UNDER REB 5.5 (STANDARD) [id:9918200],0.36004942427762204,4.054266032478533,1.4597361508622146,6.0,pp_kernel,0.7116909951343064,0.0030638134903537635,Mikal Bridges OVER AST 2.5 (GOBLIN) [id:9919130] | T.J. McConnell OVER PTS 6.5 (STANDARD) [id:9929603] | Grant Williams UNDER REB 5.5 (STANDARD) [id:9918200],Mikal Bridges OVER AST 2.5 (GOBLIN) [id:9919130],T.J. McConnell OVER PTS 6.5 (STANDARD) [id:9929603],Grant Williams UNDER REB 5.5 (STANDARD) [id:9918200]
3,Cade Cunningham OVER REB 3.5 (GOBLIN) [id:9917533] | Franz Wagner OVER PA 18.5 (STANDARD) [id:9919060] | Nolan Traore UNDER PA 16.5 (STANDARD) [id:9918565],0.3547582383381704,4.0696035546517635,1.4437253877830156,6.0,pp_kernel,0.7086915950143305,0.0015068918140318565,Cade Cunningham OVER REB 3.5 (GOBLIN) [id:9917533] | Franz Wagner OVER PA 18.5 (STANDARD) [id:9919060] | Nolan Traore UNDER PA 16.5 (STANDARD) [id:9918565],Cade Cunningham OVER REB 3.5 (GOBLIN) [id:9917533],Franz Wagner OVER PA 18.5 (STANDARD) [id:9919060],Nolan Traore UNDER PA 16.5 (STANDARD) [id:9918565]
3,DeMar DeRozan OVER RA 4.5 (GOBLIN) [id:9934953] | T.J. McConnell OVER PRA 13.5 (STANDARD) [id:9929604] | Mitchell Robinson OVER PR 11.5 (STANDARD) [id:9925936],0.3559660332262925,4.026135589548695,1.4331675150428496,6.0,pp_kernel,0.7100913150703193,0.0,DeMar DeRozan OVER RA 4.5 (GOBLIN) [id:9934953] | T.J. McConnell OVER PRA 13.5 (STANDARD) [id:9929604] | Mitchell Robinson OVER PR 11.5 (STANDARD) [id:9925936],DeMar DeRozan OVER RA 4.5 (GOBLIN) [id:9934953],T.J. McConnell OVER PRA 13.5 (STANDARD) [id:9929604],Mitchell Robinson OVER PR 11.5 (STANDARD) [id:9925936]
3,Corey Kispert OVER PRA 11.5 (GOBLIN) [id:9921213] | Jarace Walker UNDER REB 5.5 (STANDARD) [id:9929588] | Amen Thompson OVER RA 11.5 (STANDARD) [id:9918173],0.34797411963753927,4.060601033872116,1.4129840699609313,6.0,pp_kernel,0.7034259814703726,0.0018745020853835762,Corey Kispert OVER PRA 11.5 (GOBLIN) [id:9921213] | Jarace Walker UNDER REB 5.5 (STANDARD) [id:9929588] | Amen Thompson OVER RA 11.5 (STANDARD) [id:9918173],Corey Kispert OVER PRA 11.5 (GOBLIN) [id:9921213],Jarace Walker UNDER REB 5.5 (STANDARD) [id:9929588],Amen Thompson OVER RA 11.5 (STANDARD) [id:9918173]
