n_legs,legs,hit_prob,payout_mult,kernel_mult,payout_mult_eff,ev_mult,atlas_power_mult,pricing_engine,avg_p,avg_fragility,slip_key,pen_team,pen_family,pen_frag,pen_role_ctx,pen_total,role_ctx_bonus,role_ctx_on_legs,role_ctx_on_share,score_adj,players,rank_ev,beam_selected,leg_1,leg_2,leg_3,leg_4,q_leg_count,q_players
4,James Harden OVER PTS 17.5 (GOBLIN) [id:10646779] | Trendon Watford UNDER PTS 8.5 (STANDARD) [id:10648231] | Jordan Goodwin OVER PTS 5.5 (STANDARD) [id:10652151] | Grant Williams OVER PRA 16.5 (DEMON) [id:10645598],0.08545625154885778,10.0,1.930640291292737,19.306402912927368,1.6498528238307217,10.0,pp_kernel,0.5662643493872075,0.053842493289325576,James Harden OVER PTS 17.5 (GOBLIN) [id:10646779] | Trendon Watford UNDER PTS 8.5 (STANDARD) [id:10648231] | Jordan Goodwin OVER PTS 5.5 (STANDARD) [id:10652151] | Grant Williams OVER PRA 16.5 (DEMON) [id:10645598],0.0,0.0,0.0,0.0,0.0,0.0,1,0.25,1.7998528238307216,"['james harden', 'trendon watford', 'jordan goodwin', 'grant williams']",1.6498528238307217,1,James Harden OVER PTS 17.5 (GOBLIN) [id:10646779],Trendon Watford UNDER PTS 8.5 (STANDARD) [id:10648231],Jordan Goodwin OVER PTS 5.5 (STANDARD) [id:10652151],Grant Williams OVER PRA 16.5 (DEMON) [id:10645598],0,
4,Jaden McDaniels OVER AST 1.5 (GOBLIN) [id:10649284] | Jordan Goodwin OVER PTS 5.5 (STANDARD) [id:10652151] | Jaylon Tyson OVER PRA 14.5 (STANDARD) [id:10645798] | Kon Knueppel OVER REB 6.5 (DEMON) [id:10643971],0.09288589263769188,10.0,1.730386612783647,17.303866127836468,1.6072850513672112,10.0,pp_kernel,0.5812468962375797,0.07770785695149743,Jaden McDaniels OVER AST 1.5 (GOBLIN) [id:10649284] | Jordan Goodwin OVER PTS 5.5 (STANDARD) [id:10652151] | Jaylon Tyson OVER PRA 14.5 (STANDARD) [id:10645798] | Kon Knueppel OVER REB 6.5 (DEMON) [id:10643971],0.0,0.0,0.0,0.0,0.0,0.0,1,0.25,1.7572850513672111,"['jaden mcdaniels', 'jordan goodwin', 'jaylon tyson', 'kon knueppel']",1.6072850513672112,1,Jaden McDaniels OVER AST 1.5 (GOBLIN) [id:10649284],Jordan Goodwin OVER PTS 5.5 (STANDARD) [id:10652151],Jaylon Tyson OVER PRA 14.5 (STANDARD) [id:10645798],Kon Knueppel OVER REB 6.5 (DEMON) [id:10643971],0,
4,Davion Mitchell OVER AST 3.5 (GOBLIN) [id:10643873] | Royce O'Neale OVER PTS 7.5 (STANDARD) [id:10649509] | Justin Edwards UNDER PTS 12.5 (STANDARD) [id:10647161] | LaMelo Ball OVER PRA 34.5 (DEMON) [id:10644531],0.08933665399494198,10.0,1.6976003525315648,16.976003525315647,1.5165793531580392,10.0,pp_kernel,0.5798046131859518,0.03392522570405936,Davion Mitchell OVER AST 3.5 (GOBLIN) [id:10643873] | Royce O'Neale OVER PTS 7.5 (STANDARD) [id:10649509] | Justin Edwards UNDER PTS 12.5 (STANDARD) [id:10647161] | LaMelo Ball OVER PRA 34.5 (DEMON) [id:10644531],0.0,0.0,0.0,0.0,0.0,0.0,1,0.25,1.666579353158039,"['davion mitchell', ""royce o'neale"", 'justin edwards', 'lamelo ball']",1.5165793531580392,1,Davion Mitchell OVER AST 3.5 (GOBLIN) [id:10643873],Royce O'Neale OVER PTS 7.5 (STANDARD) [id:10649509],Justin Edwards UNDER PTS 12.5 (STANDARD) [id:10647161],LaMelo Ball OVER PRA 34.5 (DEMON) [id:10644531],0,
4,Myles Turner OVER PTS 7.5 (GOBLIN) [id:10646697] | Julius Randle UNDER PRA 34.5 (STANDARD) [id:10649386] | Nique Clifford UNDER PTS 11.5 (STANDARD) [id:10651075] | Sam Merrill OVER FG3M 3.5 (DEMON) [id:10646826],0.06923351888674904,10.0,1.1964274294853072,11.964274294853073,0.8283288103589563,10.0,pp_kernel,0.5284564553354011,0.04677006382917234,Myles Turner OVER PTS 7.5 (GOBLIN) [id:10646697] | Julius Randle UNDER PRA 34.5 (STANDARD) [id:10649386] | Nique Clifford UNDER PTS 11.5 (STANDARD) [id:10651075] | Sam Merrill OVER FG3M 3.5 (DEMON) [id:10646826],0.0,0.0,0.0,0.0,0.0,0.0,0,0.0,0.8283288103589563,"['myles turner', 'julius randle', 'nique clifford', 'sam merrill']",0.8283288103589563,1,Myles Turner OVER PTS 7.5 (GOBLIN) [id:10646697],Julius Randle UNDER PRA 34.5 (STANDARD) [id:10649386],Nique Clifford UNDER PTS 11.5 (STANDARD) [id:10651075],Sam Merrill OVER FG3M 3.5 (DEMON) [id:10646826],0,
4,Tyler Herro OVER PTS 17.5 (GOBLIN) [id:10644585] | Ayo Dosunmu UNDER PTS 15.5 (STANDARD) [id:10649095] | Jordan Goodwin OVER PTS 5.5 (STANDARD) [id:10652151] | Myles Turner OVER AST 1.5 (DEMON) [id:10645803],0.08462378889330001,10.0,0.9344473741757369,9.34447374175737,0.7907647732414608,10.0,pp_kernel,0.5544862071213552,0.04997201449688056,Tyler Herro OVER PTS 17.5 (GOBLIN) [id:10644585] | Ayo Dosunmu UNDER PTS 15.5 (STANDARD) [id:10649095] | Jordan Goodwin OVER PTS 5.5 (STANDARD) [id:10652151] | Myles Turner OVER AST 1.5 (DEMON) [id:10645803],0.0,0.0,0.0,0.0,0.0,0.0,0,0.0,0.7907647732414608,"['tyler herro', 'ayo dosunmu', 'jordan goodwin', 'myles turner']",0.7907647732414608,1,Tyler Herro OVER PTS 17.5 (GOBLIN) [id:10644585],Ayo Dosunmu UNDER PTS 15.5 (STANDARD) [id:10649095],Jordan Goodwin OVER PTS 5.5 (STANDARD) [id:10652151],Myles Turner OVER AST 1.5 (DEMON) [id:10645803],0,
4,DeMar DeRozan OVER REB 1.5 (GOBLIN) [id:10651618] | Adem Bona UNDER PTS 6.5 (STANDARD) [id:10644808] | Ayo Dosunmu UNDER REB 3.5 (STANDARD) [id:10652118] | Sam Merrill OVER FG3M 3.5 (DEMON) [id:10646826],0.06480964322856642,10.0,1.2000756667294616,12.000756667294617,0.7777647580802038,10.0,pp_kernel,0.5173119619478991,0.05180257373746627,DeMar DeRozan OVER REB 1.5 (GOBLIN) [id:10651618] | Adem Bona UNDER PTS 6.5 (STANDARD) [id:10644808] | Ayo Dosunmu UNDER REB 3.5 (STANDARD) [id:10652118] | Sam Merrill OVER FG3M 3.5 (DEMON) [id:10646826],0.0,0.0,0.0,0.0,0.0,0.0,0,0.0,0.7777647580802038,"['demar derozan', 'adem bona', 'ayo dosunmu', 'sam merrill']",0.7777647580802038,1,DeMar DeRozan OVER REB 1.5 (GOBLIN) [id:10651618],Adem Bona UNDER PTS 6.5 (STANDARD) [id:10644808],Ayo Dosunmu UNDER REB 3.5 (STANDARD) [id:10652118],Sam Merrill OVER FG3M 3.5 (DEMON) [id:10646826],0,
