n_legs,legs,hit_prob,payout_mult,kernel_mult,payout_mult_eff,ev_mult,atlas_power_mult,pricing_engine,avg_p,avg_fragility,slip_key,pen_team,pen_family,pen_frag,pen_total,role_ctx_bonus,role_ctx_on_legs,role_ctx_on_share,score_adj,players,rank_ev,beam_selected,leg_1,leg_2,leg_3,leg_4,leg_5,q_leg_count,q_players
5,Tyler Herro OVER PR 24.5 (GOBLIN) [id:10644589] | Brandon Miller OVER PTS 17.5 (GOBLIN) [id:10644457] | Davion Mitchell OVER PRA 14.5 (GOBLIN) [id:10644489] | Tristan Silva UNDER PA 12.5 (STANDARD) [id:10648740] | Trendon Watford UNDER REB 3.5 (STANDARD) [id:10644896],0.062336811500897454,20.0,1.0,20.0,1.246736230017949,20.0,atlas,0.5778942026784215,0.04177717418454242,Tyler Herro OVER PR 24.5 (GOBLIN) [id:10644589] | Brandon Miller OVER PTS 17.5 (GOBLIN) [id:10644457] | Davion Mitchell OVER PRA 14.5 (GOBLIN) [id:10644489] | Tristan Silva UNDER PA 12.5 (STANDARD) [id:10648740] | Trendon Watford UNDER REB 3.5 (STANDARD) [id:10644896],0.0,0.0,0.0,0.0,0.0,0,0.0,1.246736230017949,"['tyler herro', 'brandon miller', 'davion mitchell', 'tristan silva', 'trendon watford']",1.246736230017949,1,Tyler Herro OVER PR 24.5 (GOBLIN) [id:10644589],Brandon Miller OVER PTS 17.5 (GOBLIN) [id:10644457],Davion Mitchell OVER PRA 14.5 (GOBLIN) [id:10644489],Tristan Silva UNDER PA 12.5 (STANDARD) [id:10648740],Trendon Watford UNDER REB 3.5 (STANDARD) [id:10644896],0,
5,Davion Mitchell OVER PR 7.5 (GOBLIN) [id:10650527] | Tyler Herro OVER PR 24.5 (GOBLIN) [id:10644589] | Grant Williams OVER PTS 4.5 (GOBLIN) [id:10643909] | Tristan Silva UNDER PA 12.5 (STANDARD) [id:10648740] | Quentin Grimes UNDER PTS 20.5 (STANDARD) [id:10644625],0.06030750301473504,20.0,1.0,20.0,1.2061500602947008,20.0,atlas,0.5743619288023549,0.042631094581708634,Davion Mitchell OVER PR 7.5 (GOBLIN) [id:10650527] | Tyler Herro OVER PR 24.5 (GOBLIN) [id:10644589] | Grant Williams OVER PTS 4.5 (GOBLIN) [id:10643909] | Tristan Silva UNDER PA 12.5 (STANDARD) [id:10648740] | Quentin Grimes UNDER PTS 20.5 (STANDARD) [id:10644625],0.0,0.0,0.0,0.0,0.0,0,0.0,1.2061500602947008,"['davion mitchell', 'tyler herro', 'grant williams', 'tristan silva', 'quentin grimes']",1.2061500602947008,1,Davion Mitchell OVER PR 7.5 (GOBLIN) [id:10650527],Tyler Herro OVER PR 24.5 (GOBLIN) [id:10644589],Grant Williams OVER PTS 4.5 (GOBLIN) [id:10643909],Tristan Silva UNDER PA 12.5 (STANDARD) [id:10648740],Quentin Grimes UNDER PTS 20.5 (STANDARD) [id:10644625],0,
5,Davion Mitchell OVER PA 9.5 (GOBLIN) [id:10644482] | LaMelo Ball OVER PRA 29.5 (GOBLIN) [id:10644530] | Devin Booker OVER PR 24.5 (GOBLIN) [id:10652325] | Nique Clifford UNDER PTS 11.5 (STANDARD) [id:10651075] | Tristan Silva UNDER PTS 10.5 (STANDARD) [id:10645979],0.059937327366113895,20.0,1.0,20.0,1.1987465473222778,20.0,atlas,0.5753786824465031,0.04835252586830546,Davion Mitchell OVER PA 9.5 (GOBLIN) [id:10644482] | LaMelo Ball OVER PRA 29.5 (GOBLIN) [id:10644530] | Devin Booker OVER PR 24.5 (GOBLIN) [id:10652325] | Nique Clifford UNDER PTS 11.5 (STANDARD) [id:10651075] | Tristan Silva UNDER PTS 10.5 (STANDARD) [id:10645979],0.0,0.0,0.0,0.0,0.0,0,0.0,1.1987465473222778,"['davion mitchell', 'lamelo ball', 'devin booker', 'nique clifford', 'tristan silva']",1.1987465473222778,1,Davion Mitchell OVER PA 9.5 (GOBLIN) [id:10644482],LaMelo Ball OVER PRA 29.5 (GOBLIN) [id:10644530],Devin Booker OVER PR 24.5 (GOBLIN) [id:10652325],Nique Clifford UNDER PTS 11.5 (STANDARD) [id:10651075],Tristan Silva UNDER PTS 10.5 (STANDARD) [id:10645979],0,
5,Naz Reid OVER PR 19.5 (GOBLIN) [id:10652223] | Kon Knueppel OVER PR 19.5 (GOBLIN) [id:10644514] | Jalen Green OVER PR 19.5 (GOBLIN) [id:10652486] | Grayson Allen OVER PRA 20.5 (STANDARD) [id:10649271] | Tristan Silva UNDER PTS 10.5 (STANDARD) [id:10645979],0.05876117772420375,20.0,1.0,20.0,1.175223554484075,20.0,atlas,0.5732352665351292,0.06466266967035714,Naz Reid OVER PR 19.5 (GOBLIN) [id:10652223] | Kon Knueppel OVER PR 19.5 (GOBLIN) [id:10644514] | Jalen Green OVER PR 19.5 (GOBLIN) [id:10652486] | Grayson Allen OVER PRA 20.5 (STANDARD) [id:10649271] | Tristan Silva UNDER PTS 10.5 (STANDARD) [id:10645979],0.0,0.0,0.0,0.0,0.0,0,0.0,1.175223554484075,"['naz reid', 'kon knueppel', 'jalen green', 'grayson allen', 'tristan silva']",1.175223554484075,1,Naz Reid OVER PR 19.5 (GOBLIN) [id:10652223],Kon Knueppel OVER PR 19.5 (GOBLIN) [id:10644514],Jalen Green OVER PR 19.5 (GOBLIN) [id:10652486],Grayson Allen OVER PRA 20.5 (STANDARD) [id:10649271],Tristan Silva UNDER PTS 10.5 (STANDARD) [id:10645979],0,
5,Tyler Herro OVER PA 19.5 (GOBLIN) [id:10652729] | Brandon Miller OVER PTS 17.5 (GOBLIN) [id:10644457] | Jalen Green OVER REB 2.5 (GOBLIN) [id:10652818] | Ryan Kalkbrenner UNDER AST 0.5 (STANDARD) [id:10644123] | Tristan Silva UNDER PRA 17.5 (STANDARD) [id:10648741],0.05784532147051792,20.0,1.0,20.0,1.1569064294103584,20.0,atlas,0.5698092626702091,0.034459112750041036,Tyler Herro OVER PA 19.5 (GOBLIN) [id:10652729] | Brandon Miller OVER PTS 17.5 (GOBLIN) [id:10644457] | Jalen Green OVER REB 2.5 (GOBLIN) [id:10652818] | Ryan Kalkbrenner UNDER AST 0.5 (STANDARD) [id:10644123] | Tristan Silva UNDER PRA 17.5 (STANDARD) [id:10648741],0.0,0.0,0.0,0.0,0.0,0,0.0,1.1569064294103584,"['tyler herro', 'brandon miller', 'jalen green', 'ryan kalkbrenner', 'tristan silva']",1.1569064294103584,1,Tyler Herro OVER PA 19.5 (GOBLIN) [id:10652729],Brandon Miller OVER PTS 17.5 (GOBLIN) [id:10644457],Jalen Green OVER REB 2.5 (GOBLIN) [id:10652818],Ryan Kalkbrenner UNDER AST 0.5 (STANDARD) [id:10644123],Tristan Silva UNDER PRA 17.5 (STANDARD) [id:10648741],0,
5,Jaime Jaquez OVER PTS 11.5 (GOBLIN) [id:10644498] | Collin Gillespie OVER PRA 16.5 (GOBLIN) [id:10650225] | Naz Reid OVER REB 5.5 (GOBLIN) [id:10649440] | Kel'el Ware UNDER REB 10.5 (STANDARD) [id:10650505] | Jett Howard UNDER PA 6.5 (STANDARD) [id:10648860],0.0572508023051319,20.0,1.0,20.0,1.145016046102638,20.0,atlas,0.5660902643420967,0.035500850532824195,Jaime Jaquez OVER PTS 11.5 (GOBLIN) [id:10644498] | Collin Gillespie OVER PRA 16.5 (GOBLIN) [id:10650225] | Naz Reid OVER REB 5.5 (GOBLIN) [id:10649440] | Kel'el Ware UNDER REB 10.5 (STANDARD) [id:10650505] | Jett Howard UNDER PA 6.5 (STANDARD) [id:10648860],0.0,0.0,0.0,0.0,0.0,0,0.0,1.145016046102638,"['jaime jaquez', 'collin gillespie', 'naz reid', ""kel'el ware"", 'jett howard']",1.145016046102638,1,Jaime Jaquez OVER PTS 11.5 (GOBLIN) [id:10644498],Collin Gillespie OVER PRA 16.5 (GOBLIN) [id:10650225],Naz Reid OVER REB 5.5 (GOBLIN) [id:10649440],Kel'el Ware UNDER REB 10.5 (STANDARD) [id:10650505],Jett Howard UNDER PA 6.5 (STANDARD) [id:10648860],0,
5,Coby White OVER PA 11.5 (GOBLIN) [id:10653362] | Bam Adebayo OVER PRA 32.5 (GOBLIN) [id:10645675] | Jaime Jaquez OVER PTS 12.5 (GOBLIN) [id:10645604] | Kel'el Ware UNDER RA 11.5 (STANDARD) [id:10653551] | Shai Gilgeous-Alexander UNDER PRA 43.5 (STANDARD) [id:10645030],0.0569232045865213,20.0,1.0,20.0,1.138464091730426,20.0,atlas,0.5650470319945284,0.04099085945143936,Coby White OVER PA 11.5 (GOBLIN) [id:10653362] | Bam Adebayo OVER PRA 32.5 (GOBLIN) [id:10645675] | Jaime Jaquez OVER PTS 12.5 (GOBLIN) [id:10645604] | Kel'el Ware UNDER RA 11.5 (STANDARD) [id:10653551] | Shai Gilgeous-Alexander UNDER PRA 43.5 (STANDARD) [id:10645030],0.0,0.0,0.0,0.0,0.0,0,0.0,1.138464091730426,"['coby white', 'bam adebayo', 'jaime jaquez', ""kel'el ware"", 'shai gilgeous-alexander']",1.138464091730426,1,Coby White OVER PA 11.5 (GOBLIN) [id:10653362],Bam Adebayo OVER PRA 32.5 (GOBLIN) [id:10645675],Jaime Jaquez OVER PTS 12.5 (GOBLIN) [id:10645604],Kel'el Ware UNDER RA 11.5 (STANDARD) [id:10653551],Shai Gilgeous-Alexander UNDER PRA 43.5 (STANDARD) [id:10645030],0,
5,LaMelo Ball OVER PRA 28.5 (GOBLIN) [id:10645623] | Jaime Jaquez OVER PR 17.5 (GOBLIN) [id:10654221] | Brandon Miller OVER PA 19.5 (GOBLIN) [id:10644458] | Kel'el Ware UNDER PR 22.5 (STANDARD) [id:10650504] | De'Aaron Fox UNDER PR 22.5 (STANDARD) [id:10649863],0.05365988144384806,20.0,1.0,20.0,1.0731976288769611,20.0,atlas,0.5580595292147044,0.04849238602437371,LaMelo Ball OVER PRA 28.5 (GOBLIN) [id:10645623] | Jaime Jaquez OVER PR 17.5 (GOBLIN) [id:10654221] | Brandon Miller OVER PA 19.5 (GOBLIN) [id:10644458] | Kel'el Ware UNDER PR 22.5 (STANDARD) [id:10650504] | De'Aaron Fox UNDER PR 22.5 (STANDARD) [id:10649863],0.0,0.0,0.0,0.0,0.0,0,0.0,1.0731976288769611,"['lamelo ball', 'jaime jaquez', 'brandon miller', ""kel'el ware"", ""de'aaron fox""]",1.0731976288769611,1,LaMelo Ball OVER PRA 28.5 (GOBLIN) [id:10645623],Jaime Jaquez OVER PR 17.5 (GOBLIN) [id:10654221],Brandon Miller OVER PA 19.5 (GOBLIN) [id:10644458],Kel'el Ware UNDER PR 22.5 (STANDARD) [id:10650504],De'Aaron Fox UNDER PR 22.5 (STANDARD) [id:10649863],0,
5,Ryan Kalkbrenner OVER REB 2.5 (GOBLIN) [id:10644583] | Tyler Herro OVER PRA 24.5 (GOBLIN) [id:10644593] | Brandon Miller OVER PTS 17.5 (GOBLIN) [id:10644457] | Norman Powell OVER PTS 21 (STANDARD) [id:10644079] | Trendon Watford UNDER PTS 8.5 (STANDARD) [id:10648231],0.052289386473473046,20.0,1.0,20.0,1.0457877294694609,20.0,atlas,0.5554104313334486,0.044435453188250616,Ryan Kalkbrenner OVER REB 2.5 (GOBLIN) [id:10644583] | Tyler Herro OVER PRA 24.5 (GOBLIN) [id:10644593] | Brandon Miller OVER PTS 17.5 (GOBLIN) [id:10644457] | Norman Powell OVER PTS 21 (STANDARD) [id:10644079] | Trendon Watford UNDER PTS 8.5 (STANDARD) [id:10648231],0.0,0.0,0.0,0.0,0.0,0,0.0,1.0457877294694609,"['ryan kalkbrenner', 'tyler herro', 'brandon miller', 'norman powell', 'trendon watford']",1.0457877294694609,1,Ryan Kalkbrenner OVER REB 2.5 (GOBLIN) [id:10644583],Tyler Herro OVER PRA 24.5 (GOBLIN) [id:10644593],Brandon Miller OVER PTS 17.5 (GOBLIN) [id:10644457],Norman Powell OVER PTS 21 (STANDARD) [id:10644079],Trendon Watford UNDER PTS 8.5 (STANDARD) [id:10648231],0,
5,Kon Knueppel OVER PTS 17.5 (GOBLIN) [id:10644510] | Rudy Gobert OVER REB 9.5 (GOBLIN) [id:10652125] | Julius Randle OVER PRA 29.5 (GOBLIN) [id:10652218] | Ryan Kalkbrenner OVER PTS 5.5 (STANDARD) [id:10650364] | Moussa Diabaté UNDER PR 19 (STANDARD) [id:10644055],0.05214073427979098,20.0,1.0,20.0,1.0428146855958196,20.0,atlas,0.5556848254496632,0.04433948737473985,Kon Knueppel OVER PTS 17.5 (GOBLIN) [id:10644510] | Rudy Gobert OVER REB 9.5 (GOBLIN) [id:10652125] | Julius Randle OVER PRA 29.5 (GOBLIN) [id:10652218] | Ryan Kalkbrenner OVER PTS 5.5 (STANDARD) [id:10650364] | Moussa Diabaté UNDER PR 19 (STANDARD) [id:10644055],0.0,0.0,0.0,0.0,0.0,0,0.0,1.0428146855958196,"['kon knueppel', 'rudy gobert', 'julius randle', 'ryan kalkbrenner', 'moussa diabaté']",1.0428146855958196,1,Kon Knueppel OVER PTS 17.5 (GOBLIN) [id:10644510],Rudy Gobert OVER REB 9.5 (GOBLIN) [id:10652125],Julius Randle OVER PRA 29.5 (GOBLIN) [id:10652218],Ryan Kalkbrenner OVER PTS 5.5 (STANDARD) [id:10650364],Moussa Diabaté UNDER PR 19 (STANDARD) [id:10644055],0,
5,Bam Adebayo OVER PTS 17.5 (GOBLIN) [id:10644443] | Ryan Kalkbrenner OVER PRA 9.5 (GOBLIN) [id:10644581] | Miles Bridges OVER PRA 22.5 (GOBLIN) [id:10645714] | Moussa Diabaté UNDER PR 19 (STANDARD) [id:10644055] | Coby White OVER PR 15.5 (STANDARD) [id:10643855],0.05137134680315029,20.0,1.0,20.0,1.0274269360630057,20.0,atlas,0.5541215141901219,0.05875271625596845,Bam Adebayo OVER PTS 17.5 (GOBLIN) [id:10644443] | Ryan Kalkbrenner OVER PRA 9.5 (GOBLIN) [id:10644581] | Miles Bridges OVER PRA 22.5 (GOBLIN) [id:10645714] | Moussa Diabaté UNDER PR 19 (STANDARD) [id:10644055] | Coby White OVER PR 15.5 (STANDARD) [id:10643855],0.0,0.0,0.0,0.0,0.0,0,0.0,1.0274269360630057,"['bam adebayo', 'ryan kalkbrenner', 'miles bridges', 'moussa diabaté', 'coby white']",1.0274269360630057,1,Bam Adebayo OVER PTS 17.5 (GOBLIN) [id:10644443],Ryan Kalkbrenner OVER PRA 9.5 (GOBLIN) [id:10644581],Miles Bridges OVER PRA 22.5 (GOBLIN) [id:10645714],Moussa Diabaté UNDER PR 19 (STANDARD) [id:10644055],Coby White OVER PR 15.5 (STANDARD) [id:10643855],0,
5,Bam Adebayo OVER PA 19.5 (GOBLIN) [id:10644445] | Miles Bridges OVER PA 16.5 (GOBLIN) [id:10653808] | James Harden OVER PTS 14.5 (GOBLIN) [id:10645152] | Trendon Watford UNDER REB 3.5 (STANDARD) [id:10644896] | Moussa Diabaté UNDER PA 10.5 (STANDARD) [id:10644054],0.05053121361418492,20.0,1.0,20.0,1.0106242722836982,20.0,atlas,0.5518684408671074,0.05220909968871468,Bam Adebayo OVER PA 19.5 (GOBLIN) [id:10644445] | Miles Bridges OVER PA 16.5 (GOBLIN) [id:10653808] | James Harden OVER PTS 14.5 (GOBLIN) [id:10645152] | Trendon Watford UNDER REB 3.5 (STANDARD) [id:10644896] | Moussa Diabaté UNDER PA 10.5 (STANDARD) [id:10644054],0.0,0.0,0.0,0.0,0.0,0,0.0,1.0106242722836982,"['bam adebayo', 'miles bridges', 'james harden', 'trendon watford', 'moussa diabaté']",1.0106242722836982,1,Bam Adebayo OVER PA 19.5 (GOBLIN) [id:10644445],Miles Bridges OVER PA 16.5 (GOBLIN) [id:10653808],James Harden OVER PTS 14.5 (GOBLIN) [id:10645152],Trendon Watford UNDER REB 3.5 (STANDARD) [id:10644896],Moussa Diabaté UNDER PA 10.5 (STANDARD) [id:10644054],0,
5,LaMelo Ball OVER RA 10.5 (GOBLIN) [id:10652262] | Ryan Kalkbrenner OVER PA 4.5 (GOBLIN) [id:10644578] | Tyler Herro OVER PRA 24.5 (GOBLIN) [id:10644593] | De'Aaron Fox UNDER RA 10.5 (STANDARD) [id:10649865] | Trendon Watford UNDER PRA 16.5 (STANDARD) [id:10644893],0.049900885716831433,20.0,1.0,20.0,0.9980177143366287,20.0,atlas,0.5493865792438392,0.04785632424992377,LaMelo Ball OVER RA 10.5 (GOBLIN) [id:10652262] | Ryan Kalkbrenner OVER PA 4.5 (GOBLIN) [id:10644578] | Tyler Herro OVER PRA 24.5 (GOBLIN) [id:10644593] | De'Aaron Fox UNDER RA 10.5 (STANDARD) [id:10649865] | Trendon Watford UNDER PRA 16.5 (STANDARD) [id:10644893],0.0,0.0,0.0,0.0,0.0,0,0.0,0.9980177143366287,"['lamelo ball', 'ryan kalkbrenner', 'tyler herro', ""de'aaron fox"", 'trendon watford']",0.9980177143366287,1,LaMelo Ball OVER RA 10.5 (GOBLIN) [id:10652262],Ryan Kalkbrenner OVER PA 4.5 (GOBLIN) [id:10644578],Tyler Herro OVER PRA 24.5 (GOBLIN) [id:10644593],De'Aaron Fox UNDER RA 10.5 (STANDARD) [id:10649865],Trendon Watford UNDER PRA 16.5 (STANDARD) [id:10644893],0,
5,LaMelo Ball OVER PRA 24.5 (GOBLIN) [id:10644529] | Rudy Gobert OVER PR 19.5 (GOBLIN) [id:10652337] | Oso Ighodaro OVER PTS 4.5 (GOBLIN) [id:10649468] | Jaime Jaquez OVER PR 18.5 (STANDARD) [id:10643939] | Moussa Diabaté UNDER PA 10.5 (STANDARD) [id:10644054],0.049433398078296276,20.0,1.0,20.0,0.9886679615659255,20.0,atlas,0.5493228713679805,0.058350697462893675,LaMelo Ball OVER PRA 24.5 (GOBLIN) [id:10644529] | Rudy Gobert OVER PR 19.5 (GOBLIN) [id:10652337] | Oso Ighodaro OVER PTS 4.5 (GOBLIN) [id:10649468] | Jaime Jaquez OVER PR 18.5 (STANDARD) [id:10643939] | Moussa Diabaté UNDER PA 10.5 (STANDARD) [id:10644054],0.0,0.0,0.0,0.0,0.0,0,0.0,0.9886679615659255,"['lamelo ball', 'rudy gobert', 'oso ighodaro', 'jaime jaquez', 'moussa diabaté']",0.9886679615659255,1,LaMelo Ball OVER PRA 24.5 (GOBLIN) [id:10644529],Rudy Gobert OVER PR 19.5 (GOBLIN) [id:10652337],Oso Ighodaro OVER PTS 4.5 (GOBLIN) [id:10649468],Jaime Jaquez OVER PR 18.5 (STANDARD) [id:10643939],Moussa Diabaté UNDER PA 10.5 (STANDARD) [id:10644054],0,
5,Jalen Green OVER PA 19.5 (GOBLIN) [id:10652483] | Kon Knueppel OVER PA 19.5 (GOBLIN) [id:10644511] | Oso Ighodaro OVER PRA 13.5 (GOBLIN) [id:10649476] | Davion Mitchell OVER RA 7.5 (STANDARD) [id:10643888] | Moussa Diabaté UNDER PR 19 (STANDARD) [id:10644055],0.04904980551393501,20.0,1.0,20.0,0.9809961102787002,20.0,atlas,0.549221303721807,0.06515706997395049,Jalen Green OVER PA 19.5 (GOBLIN) [id:10652483] | Kon Knueppel OVER PA 19.5 (GOBLIN) [id:10644511] | Oso Ighodaro OVER PRA 13.5 (GOBLIN) [id:10649476] | Davion Mitchell OVER RA 7.5 (STANDARD) [id:10643888] | Moussa Diabaté UNDER PR 19 (STANDARD) [id:10644055],0.0,0.0,0.0,0.0,0.0,0,0.0,0.9809961102787002,"['jalen green', 'kon knueppel', 'oso ighodaro', 'davion mitchell', 'moussa diabaté']",0.9809961102787002,1,Jalen Green OVER PA 19.5 (GOBLIN) [id:10652483],Kon Knueppel OVER PA 19.5 (GOBLIN) [id:10644511],Oso Ighodaro OVER PRA 13.5 (GOBLIN) [id:10649476],Davion Mitchell OVER RA 7.5 (STANDARD) [id:10643888],Moussa Diabaté UNDER PR 19 (STANDARD) [id:10644055],0,
5,Jaime Jaquez OVER PTS 12.5 (GOBLIN) [id:10645604] | Oso Ighodaro OVER PRA 13.5 (GOBLIN) [id:10649476] | Grayson Allen OVER PTS 11.5 (GOBLIN) [id:10650230] | De'Aaron Fox UNDER PA 25.5 (STANDARD) [id:10649987] | Nikola Jokić UNDER PTS 28.5 (STANDARD) [id:10644402],0.04810085989015288,20.0,1.0,20.0,0.9620171978030576,20.0,atlas,0.5453475814002656,0.03613392637289746,Jaime Jaquez OVER PTS 12.5 (GOBLIN) [id:10645604] | Oso Ighodaro OVER PRA 13.5 (GOBLIN) [id:10649476] | Grayson Allen OVER PTS 11.5 (GOBLIN) [id:10650230] | De'Aaron Fox UNDER PA 25.5 (STANDARD) [id:10649987] | Nikola Jokić UNDER PTS 28.5 (STANDARD) [id:10644402],0.0,0.0,0.0,0.0,0.0,0,0.0,0.9620171978030576,"['jaime jaquez', 'oso ighodaro', 'grayson allen', ""de'aaron fox"", 'nikola jokić']",0.9620171978030576,1,Jaime Jaquez OVER PTS 12.5 (GOBLIN) [id:10645604],Oso Ighodaro OVER PRA 13.5 (GOBLIN) [id:10649476],Grayson Allen OVER PTS 11.5 (GOBLIN) [id:10650230],De'Aaron Fox UNDER PA 25.5 (STANDARD) [id:10649987],Nikola Jokić UNDER PTS 28.5 (STANDARD) [id:10644402],0,
5,Grayson Allen OVER PRA 18.5 (GOBLIN) [id:10649764] | LaMelo Ball OVER PA 24.5 (GOBLIN) [id:10644523] | Brandon Miller OVER PTS 18.5 (GOBLIN) [id:10645676] | De'Aaron Fox UNDER PTS 18.5 (STANDARD) [id:10649862] | Dennis Schröder UNDER PA 12.5 (STANDARD) [id:10646899],0.04746031292656337,20.0,1.0,20.0,0.9492062585312675,20.0,atlas,0.5442555645331919,0.04194531655765531,Grayson Allen OVER PRA 18.5 (GOBLIN) [id:10649764] | LaMelo Ball OVER PA 24.5 (GOBLIN) [id:10644523] | Brandon Miller OVER PTS 18.5 (GOBLIN) [id:10645676] | De'Aaron Fox UNDER PTS 18.5 (STANDARD) [id:10649862] | Dennis Schröder UNDER PA 12.5 (STANDARD) [id:10646899],0.0,0.0,0.0,0.0,0.0,0,0.0,0.9492062585312675,"['grayson allen', 'lamelo ball', 'brandon miller', ""de'aaron fox"", 'dennis schröder']",0.9492062585312675,1,Grayson Allen OVER PRA 18.5 (GOBLIN) [id:10649764],LaMelo Ball OVER PA 24.5 (GOBLIN) [id:10644523],Brandon Miller OVER PTS 18.5 (GOBLIN) [id:10645676],De'Aaron Fox UNDER PTS 18.5 (STANDARD) [id:10649862],Dennis Schröder UNDER PA 12.5 (STANDARD) [id:10646899],0,
5,Collin Gillespie OVER PA 11.5 (GOBLIN) [id:10652475] | Devin Booker OVER PR 24.5 (GOBLIN) [id:10652325] | Bam Adebayo OVER REB 8.5 (GOBLIN) [id:10643804] | Nikola Jokić UNDER PR 42 (STANDARD) [id:10644404] | Shai Gilgeous-Alexander UNDER PTS 31.5 (STANDARD) [id:10645531],0.04731005527758423,20.0,1.0,20.0,0.9462011055516846,20.0,atlas,0.5436633616534914,0.04113555948921891,Collin Gillespie OVER PA 11.5 (GOBLIN) [id:10652475] | Devin Booker OVER PR 24.5 (GOBLIN) [id:10652325] | Bam Adebayo OVER REB 8.5 (GOBLIN) [id:10643804] | Nikola Jokić UNDER PR 42 (STANDARD) [id:10644404] | Shai Gilgeous-Alexander UNDER PTS 31.5 (STANDARD) [id:10645531],0.0,0.0,0.0,0.0,0.0,0,0.0,0.9462011055516846,"['collin gillespie', 'devin booker', 'bam adebayo', 'nikola jokić', 'shai gilgeous-alexander']",0.9462011055516846,1,Collin Gillespie OVER PA 11.5 (GOBLIN) [id:10652475],Devin Booker OVER PR 24.5 (GOBLIN) [id:10652325],Bam Adebayo OVER REB 8.5 (GOBLIN) [id:10643804],Nikola Jokić UNDER PR 42 (STANDARD) [id:10644404],Shai Gilgeous-Alexander UNDER PTS 31.5 (STANDARD) [id:10645531],0,
5,Miles Bridges OVER PTS 11.5 (GOBLIN) [id:10644534] | Oso Ighodaro OVER PRA 13.5 (GOBLIN) [id:10649476] | Norman Powell OVER PTS 19.5 (GOBLIN) [id:10644383] | VJ Edgecombe UNDER PTS 18.5 (STANDARD) [id:10644634] | Jett Howard UNDER PA 6.5 (STANDARD) [id:10648860],0.04635827673041815,20.0,1.0,20.0,0.927165534608363,20.0,atlas,0.5416203974038905,0.035636014862757096,Miles Bridges OVER PTS 11.5 (GOBLIN) [id:10644534] | Oso Ighodaro OVER PRA 13.5 (GOBLIN) [id:10649476] | Norman Powell OVER PTS 19.5 (GOBLIN) [id:10644383] | VJ Edgecombe UNDER PTS 18.5 (STANDARD) [id:10644634] | Jett Howard UNDER PA 6.5 (STANDARD) [id:10648860],0.0,0.0,0.0,0.0,0.0,0,0.0,0.927165534608363,"['miles bridges', 'oso ighodaro', 'norman powell', 'vj edgecombe', 'jett howard']",0.927165534608363,1,Miles Bridges OVER PTS 11.5 (GOBLIN) [id:10644534],Oso Ighodaro OVER PRA 13.5 (GOBLIN) [id:10649476],Norman Powell OVER PTS 19.5 (GOBLIN) [id:10644383],VJ Edgecombe UNDER PTS 18.5 (STANDARD) [id:10644634],Jett Howard UNDER PA 6.5 (STANDARD) [id:10648860],0,
5,Naz Reid OVER REB 5.5 (GOBLIN) [id:10649440] | Ayo Dosunmu OVER PRA 21.5 (GOBLIN) [id:10652980] | James Harden OVER PTS 14.5 (GOBLIN) [id:10645152] | Coby White OVER PA 16.5 (STANDARD) [id:10643854] | Shai Gilgeous-Alexander UNDER PTS 31.5 (STANDARD) [id:10645531],0.045411106970642476,20.0,1.0,20.0,0.9082221394128496,20.0,atlas,0.5393455533272553,0.06164644080843564,Naz Reid OVER REB 5.5 (GOBLIN) [id:10649440] | Ayo Dosunmu OVER PRA 21.5 (GOBLIN) [id:10652980] | James Harden OVER PTS 14.5 (GOBLIN) [id:10645152] | Coby White OVER PA 16.5 (STANDARD) [id:10643854] | Shai Gilgeous-Alexander UNDER PTS 31.5 (STANDARD) [id:10645531],0.0,0.0,0.0,0.0,0.0,0,0.0,0.9082221394128496,"['naz reid', 'ayo dosunmu', 'james harden', 'coby white', 'shai gilgeous-alexander']",0.9082221394128496,1,Naz Reid OVER REB 5.5 (GOBLIN) [id:10649440],Ayo Dosunmu OVER PRA 21.5 (GOBLIN) [id:10652980],James Harden OVER PTS 14.5 (GOBLIN) [id:10645152],Coby White OVER PA 16.5 (STANDARD) [id:10643854],Shai Gilgeous-Alexander UNDER PTS 31.5 (STANDARD) [id:10645531],0,
5,Norman Powell OVER PRA 25.5 (GOBLIN) [id:10654224] | Miles Bridges OVER PTS 14.5 (GOBLIN) [id:10644027] | Kon Knueppel OVER PTS 14.5 (GOBLIN) [id:10643967] | Nique Clifford UNDER PA 15.5 (STANDARD) [id:10651773] | Royce O'Neale UNDER PRA 15.5 (STANDARD) [id:10650250],0.04435463665238497,20.0,1.0,20.0,0.8870927330476994,20.0,atlas,0.5366474262581827,0.03561210367812913,Norman Powell OVER PRA 25.5 (GOBLIN) [id:10654224] | Miles Bridges OVER PTS 14.5 (GOBLIN) [id:10644027] | Kon Knueppel OVER PTS 14.5 (GOBLIN) [id:10643967] | Nique Clifford UNDER PA 15.5 (STANDARD) [id:10651773] | Royce O'Neale UNDER PRA 15.5 (STANDARD) [id:10650250],0.0,0.0,0.0,0.0,0.0,0,0.0,0.8870927330476994,"['norman powell', 'miles bridges', 'kon knueppel', 'nique clifford', ""royce o'neale""]",0.8870927330476994,1,Norman Powell OVER PRA 25.5 (GOBLIN) [id:10654224],Miles Bridges OVER PTS 14.5 (GOBLIN) [id:10644027],Kon Knueppel OVER PTS 14.5 (GOBLIN) [id:10643967],Nique Clifford UNDER PA 15.5 (STANDARD) [id:10651773],Royce O'Neale UNDER PRA 15.5 (STANDARD) [id:10650250],0,
5,Donte DiVincenzo OVER RA 7.5 (GOBLIN) [id:10649247] | Rudy Gobert OVER REB 10.5 (GOBLIN) [id:10649560] | Coby White OVER PRA 16.5 (GOBLIN) [id:10653798] | Oso Ighodaro OVER PA 9.5 (STANDARD) [id:10649470] | De'Aaron Fox UNDER PA 25.5 (STANDARD) [id:10649987],0.04382596182454564,20.0,1.0,20.0,0.8765192364909127,20.0,atlas,0.5354337430892155,0.0579868594271337,Donte DiVincenzo OVER RA 7.5 (GOBLIN) [id:10649247] | Rudy Gobert OVER REB 10.5 (GOBLIN) [id:10649560] | Coby White OVER PRA 16.5 (GOBLIN) [id:10653798] | Oso Ighodaro OVER PA 9.5 (STANDARD) [id:10649470] | De'Aaron Fox UNDER PA 25.5 (STANDARD) [id:10649987],0.0,0.0,0.0,0.0,0.0,0,0.0,0.8765192364909127,"['donte divincenzo', 'rudy gobert', 'coby white', 'oso ighodaro', ""de'aaron fox""]",0.8765192364909127,1,Donte DiVincenzo OVER RA 7.5 (GOBLIN) [id:10649247],Rudy Gobert OVER REB 10.5 (GOBLIN) [id:10649560],Coby White OVER PRA 16.5 (GOBLIN) [id:10653798],Oso Ighodaro OVER PA 9.5 (STANDARD) [id:10649470],De'Aaron Fox UNDER PA 25.5 (STANDARD) [id:10649987],0,
5,Bam Adebayo OVER RA 11.5 (GOBLIN) [id:10650525] | Coby White OVER PA 11.5 (GOBLIN) [id:10653362] | Kon Knueppel OVER PRA 24.5 (GOBLIN) [id:10644517] | Karl-Anthony Towns UNDER PA 23.5 (STANDARD) [id:10650136] | Norman Powell OVER PA 23 (STANDARD) [id:10644081],0.04357445072223983,20.0,1.0,20.0,0.8714890144447967,20.0,atlas,0.5344086331299788,0.06376839904959822,Bam Adebayo OVER RA 11.5 (GOBLIN) [id:10650525] | Coby White OVER PA 11.5 (GOBLIN) [id:10653362] | Kon Knueppel OVER PRA 24.5 (GOBLIN) [id:10644517] | Karl-Anthony Towns UNDER PA 23.5 (STANDARD) [id:10650136] | Norman Powell OVER PA 23 (STANDARD) [id:10644081],0.0,0.0,0.0,0.0,0.0,0,0.0,0.8714890144447967,"['bam adebayo', 'coby white', 'kon knueppel', 'karl-anthony towns', 'norman powell']",0.8714890144447967,1,Bam Adebayo OVER RA 11.5 (GOBLIN) [id:10650525],Coby White OVER PA 11.5 (GOBLIN) [id:10653362],Kon Knueppel OVER PRA 24.5 (GOBLIN) [id:10644517],Karl-Anthony Towns UNDER PA 23.5 (STANDARD) [id:10650136],Norman Powell OVER PA 23 (STANDARD) [id:10644081],0,
5,Norman Powell OVER PTS 14.5 (GOBLIN) [id:10644080] | Miles Bridges OVER PTS 11.5 (GOBLIN) [id:10644534] | Donte DiVincenzo OVER PRA 20.5 (GOBLIN) [id:10652987] | Julius Randle OVER PR 29.5 (STANDARD) [id:10649385] | Karl-Anthony Towns UNDER RA 14.5 (STANDARD) [id:10650152],0.04082573471646803,20.0,1.0,20.0,0.8165146943293606,20.0,atlas,0.5277979048091097,0.05288554958870388,Norman Powell OVER PTS 14.5 (GOBLIN) [id:10644080] | Miles Bridges OVER PTS 11.5 (GOBLIN) [id:10644534] | Donte DiVincenzo OVER PRA 20.5 (GOBLIN) [id:10652987] | Julius Randle OVER PR 29.5 (STANDARD) [id:10649385] | Karl-Anthony Towns UNDER RA 14.5 (STANDARD) [id:10650152],0.0,0.0,0.0,0.0,0.0,0,0.0,0.8165146943293606,"['norman powell', 'miles bridges', 'donte divincenzo', 'julius randle', 'karl-anthony towns']",0.8165146943293606,1,Norman Powell OVER PTS 14.5 (GOBLIN) [id:10644080],Miles Bridges OVER PTS 11.5 (GOBLIN) [id:10644534],Donte DiVincenzo OVER PRA 20.5 (GOBLIN) [id:10652987],Julius Randle OVER PR 29.5 (STANDARD) [id:10649385],Karl-Anthony Towns UNDER RA 14.5 (STANDARD) [id:10650152],0,
